CityTown,Location,StateTerritory,Country,Date,EstimateText,EstimateLow,BestGuess,EstimateHigh,AdjustedLow,AdjustedHigh,Actor,Claim,Pro(2)/Anti(1),EventType,ReportedArrests,ReportedParticipantInjuries,ReportedPoliceInjuries,ReportedPropertyDamage,TownsCities,Events,Source1,Source2,Source3,Misc.,
Atlanta,Atlanta City Detention Center,GA,US,2018-07-01,dozens,24,,24,,,Families Belong Together,against jailing and separating immigrant children from their families,1,protest,1,0,0,0,1,1,https://act.moveon.org/event/families-belong-together/19832/signup/?&source=&s=,https://www.ajc.com/news/breaking-news/thousands-atlanta-rally-against-immigration-policy/55do7EkTYXZIYC3z1WvZ4I/,https://www.ajc.com/news/breaking-news/arrested-during-immigration-policy-protest-outside-atlanta-city-jail/l6lbFj9CaWrxtFgrFSEyhL/,Continuation of FBT protest one day earlier. Included today because of one arrest.,
Birmingham,Jesus Real Ministry,AL,US,2018-07-01,na,12,,12,,,general protestors,Calling for an end to violence,0,rally,0,0,0,0,1,1,https://www.cbs42.com/news/local/group-rallies-for-god-not-guns-in-birmingham/1277877001,,,,
Charlotte,U.S. Department of Homeland Security,NC,US,2018-07-01,,,,,,,general protesters,"for abolishing ICE, against border wall, for anarchism",1,occupation,0,0,0,0,0,1,https://clclt.com/charlotte/occupy-ice-protests/Slideshow/10421434,https://itsgoingdown.org/charlotee-anti-ice-anarchist-report-end-encampment/,,nine-day encampment in front of building,
Minneapolis,outside Fourth Precinct,MN,US,2018-07-01,na,60,,60,,,general protestors,Protesting the police killing of Thurman Blevins,0,protest,0,0,0,0,1,1,http://www.startribune.com/60-protesters-seek-justice-for-thurman-blevins/487070301/,,,,
New Orleans,from Veteran Affairs Hospital to the Libertarian National Convention,LA,US,2018-07-01,na,30,,30,,,veterans; general protestors,Calling attention to veteran suicides; calling for an end to the war on drugs,0,march,0,0,0,0,1,1,https://www.youtube.com/watch?v=NRVXbTxNwss,,,count estimated from video,
Pittsburgh,Penn Ave and Highland Ave,PA,US,2018-07-01,FB: 406,406,,406,,,general protestors,"for justice for Antwon Rose Jr., against police violence, against racism",1,rally,0,0,0,0,1,1,https://www.facebook.com/events/229225554546118/,https://twitter.com/PGHCityPaper/status/1013473000627240962,,,
Portland,through downtown Portland to Portland State University,OR,US,2018-07-01,more than 100,100,,100,,,general protestors,Protesting officers who shot and killed Jason Washington near campus,0,protest; march,0,0,0,0,1,1,http://www.kptv.com/story/38552478/psu-students-hold-rally-march-in-response-to-deadly-shooting-near-campus,https://www.cbsnews.com/news/portland-state-university-protests-after-police-shoot-kill-jason-washington/,https://www.theroot.com/portland-state-university-campus-police-shoot-and-kill-1827317986,,
San Francisco,Immigration and Customs Enforcement,CA,US,2018-07-01,about 20; nearly 40,20,,40,,,general protestors,protesting ICE,1,protest,0,0,0,0,1,1,https://sanfrancisco.cbslocal.com/2018/07/09/occupy-ice-protest-encampment-cleared/,,,Ran from 07-01-2018 to 07-09-2018; arrests took place on 07-09-2018,
Sheboygan,Paradigm Coffee and Music shop,WI,US,2018-07-01,about 50,50,,50,,,general protestors,against jailing and separating immigrant children from their families,1,protest,0,0,0,0,1,1,https://www.jsonline.com/story/news/2018/06/30/immigrants-rights-marchers-rally-shorewood-milwaukee-next/747964002/,https://www.sheboyganpress.com/story/news/2018/07/01/sheboygan-holds-keep-families-together-rally/734530002/,,,
Snow Hill,John Walter Smith Memorial Park,MD,US,2018-07-01,two dozen,24,,24,,,Lower Shore Progressive Caucus,against jailing and separating immigrant children from their families,1,protest,0,0,0,0,1,1,https://www.delmarvanow.com/story/news/local/maryland/2018/07/01/immigration-customs-enforcement-tensions-high-ice-protest-worcester-jail/749430002/,,,,
Snow Hill,Worcester County Detention Center,MD,US,2018-07-01,na,5,,5,,,general protestors,against Families Belong Together march,2,counter-protest,0,0,0,0,1,1,https://www.delmarvanow.com/story/news/local/maryland/2018/07/01/immigration-customs-enforcement-tensions-high-ice-protest-worcester-jail/749430002/,,,,
West Palm Beach,Dreher Park,FL,US,2018-07-01,about 100; FB: 125,100,,125,,,March For Our Lives,support gun control,1,rally,0,0,0,0,1,1,http://www.sun-sentinel.com/local/broward/parkland/florida-school-shooting/fl-sb-parkland-student-bus-tour-20180701-story.html,https://www.facebook.com/events/150816059121901/,,,
West Palm Beach,Dreher Park,FL,US,2018-07-01,about 10,10,,10,,,general protestors,protest March for Our Lives,2,protest,0,0,0,0,0,1,http://www.sun-sentinel.com/local/broward/parkland/florida-school-shooting/fl-sb-parkland-student-bus-tour-20180701-story.html,,,,
Wichita,Immigration and Customs building,KS,US,2018-07-01,hundreds,200,,200,,,general protestors,protest ICE,1,protest,,,,,1,1,http://www.kwch.com/content/news/Wichitans-protest-immigration-policies-487377431.html,,,"continued to Monday with (""dozens"")",
Atlanta,Atlanta City Detention Center,GA,US,2018-07-01,dozens,24,,24,,,Families Belong Together,against jailing and separating immigrant children from their families,1,protest,0,0,0,0,1,1,https://act.moveon.org/event/families-belong-together/19832/signup/?&source=&s=,https://www.ajc.com/news/breaking-news/thousands-atlanta-rally-against-immigration-policy/55do7EkTYXZIYC3z1WvZ4I/,https://www.ajc.com/news/breaking-news/arrested-during-immigration-policy-protest-outside-atlanta-city-jail/l6lbFj9CaWrxtFgrFSEyhL/,Removal of protest camp,
Hartford,ICE office,CT,US,2018-07-02,FB: 491,491,,491,,,general protestors,protesting ICE and separating immigrant families,1,protest,35,0,0,0,1,1,https://www.facebook.com/events/1964177237228349/,https://www.wtnh.com/news/connecticut/hartford/video-35-arrested-at-ice-protest-in-hartford/1278865966,,,
Kenosha,Civic Center Park,WI,US,2018-07-02,approximately 90,90,,90,,,Congregations United to Serve Humanity,Rallying against Trump immigration policy,1,rally,0,0,0,0,1,1,http://www.kenoshanews.com/news/local/ninety-concerned-citizens-attend-cush-immigration-rally/article_06747cc0-dec2-5689-a2e7-c98460f9ce64.html,,,,
Los Angeles,,CA,US,2018-07-02,thousands,2000,,2000,,,Fight for 15; Mijente,Marching for Immigrant rights; against Trump immigration policies,1,march,,,,,1,1,https://twitter.com/Fightfor15LA/status/1013850036407435266,,,,
Los Angeles,Metropolitan Detention Center,CA,US,2018-07-02,more than a dozen,12,,12,,,Councilman Mike Bonin,Protesting Zero Tolerance Immigration Policy,1,protest,17,0,0,0,0,1,http://www.latimes.com/local/lanow/la-me-ln-councilman-protest-20180702-story.html,http://abc7.com/society/la-city-councilman-mike-bonin-arrested-at-immigration-rally/3692460/,,,
Philadelphia,ICE office,PA,US,2018-07-02,na,75,,75,,,general protestors,Protesting ICE,1,protest,29,0,0,0,1,1,http://6abc.com/politics/demonstrators-rally-outside-of-ice-office/3694184/,https://www.metro.us/news/local-news/philadelphia/ice-protest-in-philly-ends-with-29-arrested,,,
Polson,Lake County Courthouse lawn,MT,US,2018-07-02,about 30,30,,30,,,general protestors,protest release of murder suspects,0,protest,0,0,0,0,1,1,http://www.leaderadvertiser.com/front_page_slider/20180706/justice_sought_during_protest_at_county_courthouse,,,,
Chicago,outside the Western Avenue office of Animal Care and Control,IL,US,2018-07-03,several dozen,36,,36,,,general protestors,Protesting the firing of Susan Russell,0,protest,0,0,0,0,1,1,https://chicago.cbslocal.com/2018/07/02/animal-control-director-fired/,http://www.chicagotribune.com/news/local/politics/ct-met-rahm-emanuel-animal-control-response-20180703-story.html,,,
Eugene ,Northwest Park Block,OR,US,2018-07-03,FB: 80,80,,80,,,general protestors,Families Belong Together,1,protest,,,,,1,1,https://www.facebook.com/events/227168417899937/,,,,
Iberville Parish,south of LA Highway 404,LA,US,2018-07-03,na,5,,5,,,general protestors,oppose construction of the Bayou Bridge Pipeline,0,protest,5,0,0,0,1,1,http://www.wbrz.com/news/protesters-cling-to-equipment-at-bayou-bridge-pipeline-4-reportedly-arrested/,http://www.wbrz.com/news/man-attached-to-equipment-in-second-bayou-bridge-pipeline-protest/,,,
Lewisburg,outside Greenbrier Valley Airport,WV,US,2018-07-03,na,7,,7,,,general protestors,Protesting Trump visit,1,protest,0,0,0,0,1,1,http://www.wdbj7.com/content/news/Group-gathers-to-protest-Presidents-visit-to-Greenbrier-487286361.html,,,,
Long Beach,City Hall,NY,US,2018-07-03,,,,,,,general protestors,protesting separation payments for city employees,0,protest,0,0,0,0,1,1,https://www.newsday.com/long-island/nassau/long-beach-separation-pay-1.19589332,,,,
Philadelphia,outside Immigration and Customs Enforcement office on 8th and Cherry Streets,PA,US,2018-07-03,around 75,75,,75,,,general protestors,protesting ICE and separating immigrant families,1,protest,29,0,0,0,1,1,https://philadelphia.cbslocal.com/2018/07/03/protests-turn-violent-as-demonstrators-arrested-in-front-of-philadelphia-ice-building/,http://www.philly.com/philly/news/pennsylvania/philadelphia/occupy-ice-philadelphia-police-destroy-camp-20180705.html,,removed by police on July 5,
Port Neches,Summer's Abbey Flooring Center,TX,US,2018-07-03,,,,,,,general protestors,Protesting flag removal,0,protest,0,0,0,0,1,1,https://www.beaumontenterprise.com/news/article/Mid-County-residents-protest-request-to-remove-13046800.php,,,,
Atlanta,from Woodruff Park to Centennial Olympic Park,GA,US,2018-07-04,30 to 50,30,,50,,,general protestors,protesting ICE and family separation,1,protest,6,0,0,0,1,1,https://www.ajc.com/news/crime--law/protesters-clash-with-atlanta-police-during-july-fourth-march-arrested/Dh3OTs0IKWjbg3vglyj4EP/,,,,
Aurora,outside ICE detention facility,CO,US,2018-07-04,about 100,100,,100,,,general protestors,protesting ICE and separating immigrant families; abolish ICE,1,protest,0,0,0,0,1,1,https://www.denverpost.com/2018/07/04/protest-family-separation-ice-facility/,,,,
East Grand Rapids,intersection of Bagley and Wealthy,MI,US,2018-07-04,about 50,50,,50,,,Movimiento Cosecha GR ,protesting Kent County's contract with ICE,1,protest,0,0,0,0,1,1,https://therapidian.org/parades-protest-politicians-fourth-july-greater-grand-rapids,https://griid.org/2018/07/05/cosecha-gr-confronts-the-contradictions-of-july-4th-in-america/,https://www.wzzm13.com/article/news/local/east-grand-rapids/its-a-moral-issue-not-a-legal-issue-immigration-group-protests-during-4th-of-july-parade/69-570643145,,
Evanston,,IL,US,2018-07-04,FB: 7,7,,7,,,North and Northwest Suburban IL NOW,Pro-choice,1,march,,,,,1,1,https://www.facebook.com/events/1918468748427030,https://www.bustle.com/p/6-4th-of-july-protests-marches-to-celebrate-independence-day-with-activism-9642221,,,
Los Angeles,Hall of Justice,CA,US,2018-07-04,,,,,,,Black Lives Matter LA,"against police brutality, for police accountability, Black Lives Matter, against District Attorney Jackie Lacey",1,protest,,,,,1,1,https://www.cnn.com/2020/07/10/us/jackie-lacey-la-da-black-lives-matter/index.html,https://www.newyorker.com/magazine/2020/11/16/after-years-of-protests-every-wednesday-la-activists-welcome-a-new-da,,,
New York,Statue of Liberty; Liberty Island,NY,US,2018-07-04,na,40,,40,,,Rise and Resist,protesting ICE and separating immigrant families,1,protest,0,0,0,0,1,1,https://www.npr.org/2018/07/05/626052069/activists-arrested-protesting-trumps-immigration-policies-at-statue-of-liberty,,,,
New York,Statue of Liberty; Liberty Island,NY,US,2018-07-04,na,1,,1,,,general protestors,protesting ICE and separating immigrant families,1,protest,1,0,0,0,1,1,https://www.npr.org/2018/07/05/626052069/activists-arrested-protesting-trumps-immigration-policies-at-statue-of-liberty,,,climbed statue,
Polebridge,Polebridge to Les Masons State Park,MT,US,2018-07-04,na,4,,4,,,veterans,60km trek in support of public lands,0,rally; march,0,0,0,0,1,1,http://www.dailyinterlake.com/local_news/20180704/veterans_march_60k_to_support_public_lands,,,,
Portland,ICE office on Macadam Ave,OR,US,2018-07-04,na,3,,3,,,general protestors,protesting ICE and separating immigrant families,1,protest; hunger strike,0,0,0,0,1,1,https://www.wweek.com/news/city/2018/07/05/protesters-at-portlands-occupy-ice-camp-start-hunger-strike-to-pressure-city-officials/,,,,
Webster,outside Trump's' Team Deplorable store,NY,US,2018-07-04,na,10,,10,,,general protestors,protesting the opening of a pro-Trump store,1,protest,0,0,0,0,1,1,http://spectrumlocalnews.com/nys/rochester/community/2018/07/05/team-deplorable-protest-webster,,,count estimated from video in article,
Sag Harbor,Sag Harbor Windmill,NY,US,2018-07-04,FB: 28,28,,28,,,general protestors,Walk for Interdependence: Keep our Families Together,1,march,,,,,1,1,https://www.facebook.com/events/236094743840710/,,,,
St. Augustine,,FL,US,2018-07-04,about 25,25,,25,,,general protestors,protesting confederate monument,1,protest,0,0,0,0,1,1,https://www.wuft.org/news/2018/07/05/anti-confederate-protesters-disrupt-independence-day-celebration-in-st-augustine/,,,,
Stone Mountain Village,Stone Mountain,GA,US,2018-07-04,count from pic,19,,19,,,NAACP,Protesting Confederate monument,1,protest,0,0,0,0,1,1,https://www.myajc.com/news/local-govt--politics/atlanta-naacp-marches-stone-mountain-protest-confederate-carving/5QObmAOF5tTADouLDnX2BK/,https://www.wltx.com/article/news/politics/naacp-calls-for-sandblasting-of-stone-mountains-confederate-carving/101-570777835,,,
Victoria,N. Navarro Street,TX,US,2018-07-04,about three dozen,36,,36,,,general protestors,"rallying for immigration reform, protesting family separations",1,protest,0,0,0,0,1,1,https://www.victoriaadvocate.com/news/government/victoria-residents-rally-for-immigration-reform-protest-family-separations/article_f70071a0-7ff5-11e8-b36b-77df349846e1.html,,,,
Webster,Main Street,NY,US,2018-07-04,na,8,,8,,,general protestors,Protesting Trump's Team Deplorable Community Activity Center,1,protest,0,0,0,0,1,1,https://cnycentral.com/news/local/demonstrators-oppose-newtrump-team-deplorable-store-in-webster,https://www.democratandchronicle.com/story/news/local/columnists/andreatta/2018/07/05/deplorable-t-shirt-shop-pro-trump-supporter-webster-ny-andreatta/758100002/,,,
Woodside,the entrance to the grounds of the Mounted Patrol of San Mateo County,CA,US,2018-07-04,between 20 and 25,20,,25,,,general protestors,protesting rodeo,0,protest,0,0,0,0,1,1,https://www.almanacnews.com/news/2018/07/05/woodside-annual-rodeo-draws-two-protest-groups,,,,
Columbus,Statehouse,OH,US,2018-07-05,dozens,24,,24,,,Freedom School students,protesting ICE and separating immigrant families,1,protest,0,0,0,0,1,1,https://www.10tv.com/article/kids-protest-against-separation-immigrant-families,,,,
Columbus,building used by ICE,OH,US,2018-07-05,,,,,,,general protestors,protesting ICE and separating immigrant families,1,protest,0,0,0,0,0,1,http://radio.wosu.org/post/activists-continue-protest-immigration-policy-ohio-statehouse#stream/0,,,,
Fairfax,ICE field office,VA,US,2018-07-05,about a hundred,100,,100,,,general protestors,protesting ICE and separating immigrant families,1,protest,0,0,0,0,1,1,https://www.localdvm.com/news/virginia/community-members-protest-for-abolition-of-ice/1285891900,https://www.dcmediagroup.us/2018/07/05/abolishice-protesters-call-profiteers-localities-working-ice-virginia/,,,
Great Falls,Four Seasons Arena,MT,US,2018-07-05,more than 6600,6600,,6600,,,general protestors,for President Trump and Republican candidates,2,rally,0,0,0,0,1,1,https://www.greatfallstribune.com/story/news/2018/07/06/trump-rally-polarizing-great-falls-rosendale-tester-daines-gianforte-president-donald-trump/763252002/,https://www.greatfallstribune.com/story/news/2018/07/05/trump-rally-great-falls-mt-protesters-gather/761293002/,http://www.bigforkeagle.com/local_news/20180705/thousands_rally_around_trump_in_great_falls,feat. President Trump,
Great Falls,outside Four Seasons Arena,MT,US,2018-07-05,more than 300,300,,300,,,general protestors,protesting outside a Trump rally,1,protest,0,0,0,0,1,1,https://helenair.com/news/government-and-politics/photos-crowd-gathers-in-great-falls-to-protest-trump-rally/collection_376d3080-adc7-52ab-82e7-9726dad9b75c.html#1,https://www.greatfallstribune.com/story/news/2018/07/05/trump-rally-great-falls-mt-protesters-gather/761293002/,,,
Houston,outside proposed detention center on Emancipation Avenue,TX,US,2018-07-05,,,,,,,general protestors,protesting ICE and separating immigrant families,1,protest,0,0,0,0,1,1,https://cw39.com/2018/07/06/houstonians-protest-proposed-immigrant-detention-center-ahead-of-court-mandated-deadline/,,,,
Lexington,outside Red Hen restaurant,VA,US,2018-07-05,count pic,6,,6,,,Patriot Picket,protest restaurant's request that S H Sanders leave,2,protest,0,0,0,0,1,1,https://www.usatoday.com/story/news/2018/07/05/red-hen-lexington-opens-sarah-huckabee-sanders-visit/761868002/,,,,
Mt. Wolf,outside Governor's home,PA,US,2018-07-05,roughly 30,30,,30,,,general protestors,demand governor call special legislative session for redistricting,0,protest,0,0,0,0,1,1,https://www.ydr.com/story/news/2018/07/06/protest-gov-wolfs-home-prompts-call-session-redistricting/762414002/,https://www.yorkdispatch.com/story/news/local/2018/07/11/outside-gov-wolfs-home-protesters-call-general-assembly-return-redistricting-vote/776029002/,,,
Spokane,Congresswoman Cathy McMorris Rodgers' office,WA,US,2018-07-05,about 25,25,,25,,,general protestors,protesting ICE and separating immigrant families,1,protest,0,0,0,0,1,1,https://www.kxly.com/news/immigrant-child-separation-protest-hits-spokane/763671454,https://www.krem.com/article/news/local/spokane-county/demonstrators-leave-shoes-at-cathy-mcmorris-rodgers-office-to-protest-immigration-policy/293-571127213,,,
Turlock,Julien Field,CA,US,2018-07-05,at least a dozen,12,,12,,,general protestors,protest decision to purchase All-Star hats rather than All-Star jerseys,0,protest,0,0,0,0,1,1,https://www.turlockjournal.com/sports/youth/national-parents-coaches-protest-decision-not-buy-all-star-jerseys/,,,,
Woodside,entrance to Mounted Patrol of San Mateo County,CA,US,2018-07-05,na,8,,8,,,general protestors,protesting pig scramble and rodeo ,0,protest,0,0,0,0,1,1,https://www.almanacnews.com/news/2018/07/05/woodside-annual-rodeo-draws-two-protest-groups,https://www.youtube.com/watch?v=GtTy-w0sQwU,,partial count estimated from photo and video,
Bellingham,outside Woodway Assisted Living facility,WA,US,2018-07-06,,,,,,,residents,protesting conditions at Woodway Assisted Living facility,0,protest,0,0,0,0,1,1,https://www.king5.com/article/news/local/senior-citizens-protest-living-conditions-at-bellingham-facility/281-571442822,,,,
Cape Canaveral,outside Comprehensive Health Services global headquarters; State Road A1A,FL,US,2018-07-06,about 30; roughly 40,30,,40,,,general protestors,protesting ICE and family separation; protesting Comprehensive Health Services work with ICE,1,protest,0,0,0,0,1,1,https://www.floridatoday.com/story/news/2018/07/06/protest-comprehensive-health-services-cape-canaveral/752465002/,,,,
Clackamas,Kaiser Permanente Sunnyside Medical Center,OR,US,2018-07-06,dozens,24,,24,,,nurses,rallying for better staffing,0,rally,0,0,0,0,1,1,https://katu.com/news/local/kaiser-nurses-rally-for-better-staffing,,,,
Gary,Gary/Chicago International Airport,IN,US,2018-07-06,more than 100,100,,100,,,general protestors,protest airport use for deportations; anti-ICE,1,protest,0,0,0,0,1,1,http://www.chicagotribune.com/suburbs/post-tribune/news/ct-ptb-gary-airport-protest-july-6-st-20180705-story.html,,,,
Hillsboro,Kaiser Permanente Westside Medical Center,OR,US,2018-07-06,dozens,24,,24,,,nurses,rallying for better staffing,0,rally,0,0,0,0,1,1,https://katu.com/news/local/kaiser-nurses-rally-for-better-staffing,,,,
Iberville Parish,,LA,US,2018-07-06,na,1,,1,,,general protestor,oppose construction of the Bayou Bridge Pipeline,0,protest,0,0,0,0,1,1,http://www.wbrz.com/news/man-attached-to-equipment-in-second-bayou-bridge-pipeline-protest/,,,,
Joliet,Jefferson Street and N. Larkin Avenue,IL,US,2018-07-06,,,,,,,Pro-Life Action League,anti-abortion,2,rally,,,,,1,1,https://prolifeaction.org/event/truthtour2018/,,,,
Joliet,Route 59 and Caton Farm Road,IL,US,2018-07-06,,,,,,,Pro-Life Action League,anti-abortion,2,rally,,,,,0,1,https://prolifeaction.org/event/truthtour2018/,,,,
Laurel,Gorman Road bridge over I-95,MD,US,2018-07-06,,,,,,,Howard County Indivisible Immigration Action Team,protesting ICE and family separation,1,protest,,,,,1,1,http://www.baltimoresun.com/news/maryland/howard/ph-ho-immigration-protest-0706-story.html,,,,
Omaha,outside DHS office,NE,US,2018-07-06,about 25,25,,25,,,general protestors,protesting ICE and family separation,1,protest,0,0,0,0,1,1,http://www.wowt.com/content/news/Omaha-area-protests-DHS-and-ICE-487533341.html,,,,
Philadelphia,outside city hall,PA,US,2018-07-06,about 2 dozen,24,,24,,,Occupy ICE,protesting ICE and separating immigrant families,1,protest,0,0,0,0,1,1,http://www.philly.com/philly/news/ice-protest-philadelphia-occupy-city-hall-20180706.html,,,,
Raymondville,outside Willacy County courthouse,TX,US,2018-07-06,about 50,50,,50,,,ARISE,against ICE; against reopening immigrant detention facility ,1,protest,0,0,0,0,1,1,https://www.texasobserver.org/despite-protests-willacy-county-forges-ahead-with-resurrection-of-notorious-immigrant-detention-center/,,,,
Shorewood,Route 59 and Black Road,IL,US,2018-07-06,,,,,,,Pro-Life Action League,anti-abortion,2,rally,,,,,1,1,https://prolifeaction.org/event/truthtour2018/,,,,
Tempe,Tempe Police Dept; 120 E 5th Street ,AZ,US,2018-07-06,FB: 2,2,,2,,,general protestors,opposed police use of excessive force,0,protest,,,,,1,1,https://www.facebook.com/events/1774671782624819/,,,,
Aurora,Planned Parenthood,IL,US,2018-07-07,,,,,,,Pro-Life Action League,anti-abortion,1,rally,,,,,1,1,https://prolifeaction.org/event/truthtour2018/,,,,
Aurora,Fox Valley Mall,IL,US,2018-07-07,,,,,,,Pro-Life Action League,anti-abortion,1,rally,,,,,0,1,https://prolifeaction.org/event/truthtour2018/,,,,
Bedminster,Clarence Dillon Public Library,NJ,US,2018-07-07,around 20,20,,20,,,general protestors,Protesting Trump,1,protest,0,0,0,0,1,1,https://www.mycentraljersey.com/story/news/politics/new-jersey/2018/07/07/president-trump-returns-bedmisnter-so-do-protesters/765432002/,,,,
Boston,50 Spruce Street by the 300th Anniversary Monument,MA,US,2018-07-07,FB: 8,8,,8,,,March for Our Rights,pro-second amendment,2,protest,0,0,0,0,1,1,https://www.facebook.com/events/1658293747572316/,,,,
Boulder,Central Park,CO,US,2018-07-07,FB: 8,8,,8,,,March for Our Rights,pro-second amendment,2,protest,0,0,0,0,1,1,https://www.facebook.com/events/1727994550654045/,,,,
Charlottesville ,,VA,US,2018-07-07,na,100,,100,,,Charlottesville community members and delegates,Civil Rights pilgrimage,1,march; protest,,,,,1,1,https://www.newsleader.com/story/news/2018/07/11/charlottesville-mayor-leads-pilgrimage-montgomery-al-lynching-memorial/774560002/,,,,
Chicago,Dan Ryan Expressway (79th to 67th st),IL,US,2018-07-07,thousands,2000,,2000,,,Rev. Michael Pfleger; general protestors,demand city officials address gun violence; pro-gun control,0,protest,,,,,1,1,http://www.chicagotribune.com/news/local/breaking/ct-met-protest-gun-violence-dan-ryan-20180625-story.html,http://time.com/5332511/chicago-protest-dan-ryan-expressway/,,,
Chicago,Millennium Park,IL,US,2018-07-07,a few dozen,36,,36,,,general Protestors,"Anti-fascism, pro-immigration reform",1,protest,0,0,0,0,0,1,http://www.chicagotribune.com/news/local/breaking/ct-met-group-gathers-to-protest-president-policies-20180707-story.html,,,,
Chicago,Millennium Park,IL,US,2018-07-07,approximately 35,35,,35,,,March for Our Rights,pro-second amendment,2,rally,0,0,0,0,0,1,https://www.oregonlive.com/today/index.ssf/2018/07/organizers_of_pro-gun_rallies.html,,,,
Concord,New Hampshire State House,NH,US,2018-07-07,FB: 40,40,,40,,,March for Our Rights,pro-second amendment,2,protest,0,0,0,0,1,1,https://www.facebook.com/events/1927989647246141/,,,,
Corsicana,Bunert Park,TX,US,2018-07-07,more than 50,50,,50,,,Navarro County Open Door Democrats Club,rally for Texas democrats,1,rally,0,0,0,0,1,1,http://www.corsicanadailysun.com/news/open-door-democrats-rally-saturday/article_db537850-83c7-11e8-87a0-3b17c3ef113a.html,,,,
Dallas,across the street from Paul Quinn College,TX,US,2018-07-07,about 20,20,,20,,,Open Carry Texas,protest March for Our Lives,2,protest,0,0,0,0,1,1,https://www.dallasnews.com/news/guns/2018/07/07/parkland-school-shooting-survivors-bring-gun-control-message-dallas,https://www.edweek.org/ew/articles/2018/07/08/parkland-school-shooting-survivors-kick-off-bus.html,,,
Houston,Hermann Square,TX,US,2018-07-07,FB: 18,18,,18,,,March for Our Rights,pro-second amendment,2,rally,0,0,0,0,1,1,https://m4or.org/rsvp-hou/,https://www.facebook.com/events/228489377916348/,,,
Indianapolis,east steps of Indiana's State House,IN,US,2018-07-07,about 60,60,,60,,,general Protestors,support women who said Attorney General Curtis Hill inappropriately touched them; call for Hill's resignation,0,rally,0,0,0,0,1,1,https://www.indystar.com/story/news/2018/07/07/attorney-general-curtis-hill-rally-indiana-statehouse-inappropriate-touching-allegations/760542002/,,,,
Kenosha,Kenosha County Detention Center,WI,US,2018-07-07,dozens,24,,24,,,Industrial Workers of the World (IWW),protesting ICE,1,protest,0,0,0,0,1,1,http://www.fightbacknews.org/2018/7/9/scores-protesters-march-immigrant-detention-center-kenosha-wi,,,,
Longview,Civic Circle,WV,US,2018-07-07,about 120,120,,120,,,Patriot Prayer,pro-second amendment; pro-trump;anti-immigration,2,rally,0,0,0,0,1,1,https://tdn.com/news/local/speakers-praise-bill-of-rights-attack-government-overreach-at-longview/article_7e86e5a1-9845-55bb-bcd1-8371018ccc8b.html,,,,
