date,locality,state,location,title,size_text,size_low,size_high,organizations,participants,claims,valence,event_type,police_measures,participant_measures,police_injuries,participant_injuries,arrests,property_damage,police_deaths,participant_deaths,macroevent,notes,coder,source1,source2,source3,source4,source5,source6,source7,source8,source9,source10,source11,source12,source13,source14,source15,source16,source17,source18,source19,source20,source21,source22,source23,source24,source25,source26,source27,source28,source29,source30
2021-07-17,Huntsville,AL,Brahan Spring Park,Good Trouble Vigil for Democracy & Voting Rights,,,,Declaration for American Democracy,,"for passage of the For the People Act, for the John Lewis Voting Rights Amendment Act, for DC statehood, end the Jim Crow filibuster",1,vigil,,,,,,,,,,,,https://www.mobilize.us/democracyvigils/event/400271/,,,,,,,,,,,,,,,,,,,,,,,,,,,,,
2021-07-17,Hutchinson,KS,Chester I. Lewis Plaza,Good Trouble Vigil for Democracy & Voting Rights,,,,Declaration for American Democracy,,"for passage of the For the People Act, for the John Lewis Voting Rights Amendment Act, for DC statehood, end the Jim Crow filibuster",1,vigil,,,,,,,,,,,,https://www.mobilize.us/democracyvigils/event/400267/,,,,,,,,,,,,,,,,,,,,,,,,,,,,,
2021-07-17,Indianapolis,IN,City-County Building; Pan Am Plaza; Monument Circle,Justice for Dorian Murrell,count video,40,50,Black Liberation Militia; New Black Panther Party; Not Fucking Around Coalition; Huey Newton Gun Club; Fred Hampton Gun Club; Panthers Special Operation Command,family,"for Black unity, against injustice, death to white supremacy, for justice for Dorian Murrell, against police brutality",1,rally,,tactical gear; openly carrying guns,,,,,,,,,,https://twitter.com/ScooterCasterNY/status/1416479819831853060,https://twitter.com/ScooterCasterNY/status/1416590252563648513,https://twitter.com/ScooterCasterNY/status/1416794448705593345,https://www.youtube.com/watch?v=5mzWaHcweYE,https://unicornriot.ninja/2021/open-carry-march-for-teenager-killed-in-downtown-indy/,,,,,,,,,,,,,,,,,,,,,,,,,
2021-07-17,Indianapolis,IN,"El Taco Loco, 2705 W Washington St; Monument Circle",The Walk for Licenses,,,,Cosecha Indiana; Islamic Center of Bloomington,undocumented immigrants,"for state legislation allowing undocumented immigrants to get driver's licenses, for permanent protection for all undocumented immigrants, for state coronavirus relief for all, dignity for all workers, freedom for all",1,march,,,,,,,,,,,,https://www.idsnews.com/article/2021/07/immigrant-leaders-allies-demonstrate-in-bloomington-during-300-mile-walk-for-licenses-across-indiana,https://twitter.com/CosechaMovement/status/1416381999871315973,https://twitter.com/CosechaMovement/status/1416498993656381443,,,,,,,,,,,,,,,,,,,,,,,,,,,
2021-07-17,Jackson,MI,205 N East Ave,Henry Ford Vaccine Protest,hundreds,200,200,,,"against mandatory COVID-19 vaccinations for employees of Henry Ford Health System, my body my choice, HFA is doing big pharma's dirty work",2,protest,,,,,,,,,,,,https://www.facebook.com/events/289531026251806/,https://www.freep.com/story/news/local/michigan/2021/07/17/covid-19-vaccine-mandate-protest-henry-ford-hospitals/7985941002/,https://www.wilx.com/2021/07/18/statewide-protests-over-henry-ford-vaccine-mandate/,https://www.fox47news.com/neighborhoods/jackson-hillsdale/hundreds-gather-at-protest-against-henry-ford-health-vaccine-mandate,,,,,,,,,,,,,,,,,,,,,,,,,,
2021-07-17,Jacksonville,FL,"All Starrz, 1111 Cesery Blvd",Good Trouble Vigil for Democracy & Voting Rights,,,,Declaration for American Democracy,,"for passage of the For the People Act, for the John Lewis Voting Rights Amendment Act, for DC statehood, end the Jim Crow filibuster",1,vigil,,,,,,,,,,,,https://www.mobilize.us/democracyvigils/event/401116/,,,,,,,,,,,,,,,,,,,,,,,,,,,,,
2021-07-17,Jacksonville,FL,The Landing Park,,,,,,,in solidarity with protesters in Cuba,0,rally,,,,,,,,,,,,https://www.news4jax.com/news/local/2021/07/17/rallies-of-support-continue-in-jacksonville-calling-for-freedom-in-cuba/,,,,,,,,,,,,,,,,,,,,,,,,,,,,,
2021-07-17,Jefferson City,MO,Missouri State Capitol,Good Trouble Vigil for Democracy & Voting Rights,,,,Declaration for American Democracy,,"for passage of the For the People Act, for the John Lewis Voting Rights Amendment Act, for DC statehood, end the Jim Crow filibuster",1,vigil,,,,,,,,,,,,https://www.mobilize.us/democracyvigils/event/400443/,,,,,,,,,,,,,,,,,,,,,,,,,,,,,
2021-07-17,Jersey City,NJ,McGinley Square; Lo-Fidelity Bar,,,,,Kevin Bing for Ward C,,"for Kevin Bing for city council, for government transparency, for safer streets for bicyclists, for social justice",1,rally; bicycle ride,,,,,,,,,,,,https://secure.actblue.com/donate/bikewithbing,https://twitter.com/KevinRBing/status/1413959509215780868,,,,,,,,,,,,,,,,,,,,,,,,,,,,
2021-07-17,Juneau,AK,Mayor Bill Overstreet Park,,about 25,25,25,,Cuban-Americans,in solidarity with protesters in Cuba,0,demonstration,,,,,,,,,,,,https://www.juneauempire.com/news/residents-gather-to-support-protests-in-cuba/,,,,,,,,,,,,,,,,,,,,,,,,,,,,,
2021-07-17,Kansas City,MO,Spirit of Freedom Fountain,Good Trouble Vigil for Democracy & Voting Rights,,,,Declaration for American Democracy,,"for passage of the For the People Act, for the John Lewis Voting Rights Amendment Act, for DC statehood, end the Jim Crow filibuster",1,vigil,,,,,,,,,,,,https://www.mobilize.us/democracyvigils/event/401346/,,,,,,,,,,,,,,,,,,,,,,,,,,,,,
2021-07-17,Kingstree,SC,Hampton Apartments,Good Trouble Vigil for Democracy & Voting Rights,,,,Declaration for American Democracy,,"for passage of the For the People Act, for the John Lewis Voting Rights Amendment Act, for DC statehood, end the Jim Crow filibuster",1,vigil,,,,,,,,,,,,https://www.mobilize.us/democracyvigils/event/400926/,,,,,,,,,,,,,,,,,,,,,,,,,,,,,
2021-07-17,Knoxville,TN,Market Square,,count video,20,30,,Cuban-Americans; community members,"in solidarity with protesters in Cuba, for freedom in Cuba",0,demonstration,,,,,,,,,,,,https://www.wate.com/news/cuban-americans-protest-in-market-square-across-u-s/,,,,,,,,,,,,,,,,,,,,,,,,,,,,,
2021-07-17,LaGrange,GA,Lafayette Square,,count pic,10,12,Troup County Medical Society,physicians; healthcare professionals,for COVID-19 vaccination,0,demonstration,,,,,,,,,,,,https://www.lagrangenews.com/2021/07/20/health-professionals-urge-vaccination-with-demonstration/,,,,,,,,,,,,,,,,,,,,,,,,,,,,,
2021-07-17,Lancaster,CA,Aerospace Walk of Honor,Good Trouble Vigil for Democracy & Voting Rights,,,,Declaration for American Democracy,,"for passage of the For the People Act, for the John Lewis Voting Rights Amendment Act, for DC statehood, end the Jim Crow filibuster",1,vigil,,,,,,,,,,,,https://www.mobilize.us/democracyvigils/event/401101/,,,,,,,,,,,,,,,,,,,,,,,,,,,,,
2021-07-17,Lansing,MI,Michigan State Capitol,,,,,Justice for Davyon And Nick In Memory of Davyon Rose and Nick Sada,family,"for tougher state laws against drunk driving, for safer roads",0,protest,,,,,,,,,,,,https://www.wilx.com/2021/07/06/mother-slain-construction-worker-protesting-stricter-drunk-driving-laws/,https://www.facebook.com/events/812439369384933/,,,,,,,,,,,,,,,,,,,,,,,,,,,,
2021-07-17,Las Vegas,NV,,Good Trouble Vigil for Democracy & Voting Rights,,,,Declaration for American Democracy,,"for passage of the For the People Act, for the John Lewis Voting Rights Amendment Act, for DC statehood, end the Jim Crow filibuster",1,vigil,,,,,,,,,,,,https://www.mobilize.us/democracyvigils/event/401035/,,,,,,,,,,,,,,,,,,,,,,,,,,,,,
2021-07-17,Lauderhill,FL,"Supervisor of Elections, 1519 NW 40th Ave",Good Trouble Vigil for Democracy & Voting Rights,,,,Declaration for American Democracy,,"for passage of the For the People Act, for the John Lewis Voting Rights Amendment Act, for DC statehood, end the Jim Crow filibuster",1,vigil,,,,,,,,,,,,https://www.mobilize.us/democracyvigils/event/400027/,,,,,,,,,,,,,,,,,,,,,,,,,,,,,
2021-07-17,Los Angeles,CA,"MacArthur Park; Wi Spa, 2700 Wilshire Blvd",,dozens; about 50,24,50,Proud Boys; Mass Resistance California,,"against pedophelia, against transgender people and homosexuality, for patriotism, protect our kids, protect female spaces, against President Biden, trans women are not women",2,protest,large deployment in advance; riot gear; instructed counter-protesters to remain in designated area; used batons and less-lethal munitions on counter-protesters; pushed and struck counter-protesters; formed skirmish line; backup arrived also in riot gear; declared unlawful assembly; separated protesters and counter-protesters; kettled counter-protesters,marched in street; some in body armor and helmets; shields; bats; bear spray; tasers; threw water bottles; verbal threats at counter-protesters; assaulted journalist and some counter-protesters,,unspecified,"38 total, unclear how many per side",vandalized cars,,,20210717-la-wispa,,,https://twitter.com/VPS_Reports/status/1413005877230018561,https://twitter.com/LCRWnews/status/1416430548893896706,https://twitter.com/ACatWithNews/status/1416416882412777479,https://twitter.com/SamBraslow/status/1416441311096303620,https://twitter.com/waterspider__/status/1416433838582943744,https://twitter.com/joeyneverjoe/status/1416433179699912709,https://twitter.com/BGOnTheScene/status/1416474390213054482,https://twitter.com/chadloder/status/1416476374001348611,https://twitter.com/az_rww/status/1416557322709594112,https://www.theguardian.com/society/2021/jul/18/dozens-arrested-in-los-angeles-as-anti-trans-protest-outside-spa-turns-violent,https://www.mercurynews.com/2021/07/18/protests-over-transgender-rights-at-la-spa-turn-violent/,https://theintercept.com/2021/07/18/transphobes-rally-los-angeles-spa-police-attack-counterprotesters/?utm_medium=social&utm_campaign=theintercept&utm_source=twitter,https://twitter.com/FordFischer/status/1417120825300463617,,,,,,,,,,,,,,,,,
2021-07-17,Los Angeles,CA,"Wi Spa, 2700 Wilshire Blvd","Smash Transphobia, Smash Fascism",about 60,60,60,,,"against transphobia, against fascism, trans lives matter, cops and Klan go hand in hand",1,counter-protest,large deployment in advance; riot gear; instructed counter-protesters to remain in designated area; used batons and less-lethal munitions on counter-protesters; pushed and struck counter-protesters; formed skirmish line; backup arrived also in riot gear; declared unlawful assembly; separated protesters and counter-protesters; kettled counter-protesters,some in black bloc; verbal confrontations with police and protesters; some carried mace and knives; silly string; blocked alley with dumpster; smoke bomb; water bottles,,unspecified,"38 total, unclear how many per side",,,,20210717-la-wispa,,,https://twitter.com/AARF_LA/status/1413368997194698756,https://twitter.com/LCRWnews/status/1416430548893896706,https://twitter.com/ACatWithNews/status/1416416882412777479,https://twitter.com/SamBraslow/status/1416441311096303620,https://twitter.com/waterspider__/status/1416433838582943744,https://twitter.com/joeyneverjoe/status/1416433179699912709,https://twitter.com/BGOnTheScene/status/1416474390213054482,https://twitter.com/chadloder/status/1416476374001348611,https://www.theguardian.com/society/2021/jul/18/dozens-arrested-in-los-angeles-as-anti-trans-protest-outside-spa-turns-violent,https://www.mercurynews.com/2021/07/18/protests-over-transgender-rights-at-la-spa-turn-violent/,https://theintercept.com/2021/07/18/transphobes-rally-los-angeles-spa-police-attack-counterprotesters/?utm_medium=social&utm_campaign=theintercept&utm_source=twitter,https://twitter.com/FordFischer/status/1417120825300463617,,,,,,,,,,,,,,,,,,
2021-07-17,Los Angeles,CA,"Wilshire Federal Building, 11000 Wilshire Blvd",Good Trouble Vigil for Democracy & Voting Rights,,,,Declaration for American Democracy,,"for passage of the For the People Act, for the John Lewis Voting Rights Amendment Act, for DC statehood, end the Jim Crow filibuster",1,vigil,,,,,,,,,,,,https://www.mobilize.us/democracyvigils/event/400211/,,,,,,,,,,,,,,,,,,,,,,,,,,,,,
2021-07-17,Louisville,KY,11th St and W Main St,Good Trouble Vigil for Democracy & Voting Rights,,,,Declaration for American Democracy,,"for passage of the For the People Act, for the John Lewis Voting Rights Amendment Act, for DC statehood, end the Jim Crow filibuster",1,vigil,,,,,,,,,,,,https://www.mobilize.us/democracyvigils/event/400422/,,,,,,,,,,,,,,,,,,,,,,,,,,,,,
2021-07-17,Madison,WI,,,,,,350 Madison Climate Action Team,climate activists,"against Line 3 oil pipeline, calling on banks to defund Line 3, for environmental protection, for indigenous peoples' rights",1,demonstration,,flash mob dance,,,,,,,,,,https://wkow.com/2021/07/17/flash-mob-protests-pipeline-loans/,,,,,,,,,,,,,,,,,,,,,,,,,,,,,
2021-07-17,Manassas,VA,,Good Trouble Vigil for Democracy & Voting Rights,,,,Declaration for American Democracy,,"for passage of the For the People Act, for the John Lewis Voting Rights Amendment Act, for DC statehood, end the Jim Crow filibuster",1,vigil,,,,,,,,,,,,https://www.mobilize.us/democracyvigils/event/400929/,,,,,,,,,,,,,,,,,,,,,,,,,,,,,
2021-07-17,Marble Falls,TX,Johnson Park,Turn Rural Texas Blue,,,,,elected officials,for Democratic candidates for office,1,rally,called to scene,,,1,,,,,20210717-marblefalls-turntxblue,,,https://www.dailytrib.com/2021/07/19/man-arrested-during-democratic-rally/,https://www.rawstory.com/trump-supporter-arrested-2653852504/,,,,,,,,,,,,,,,,,,,,,,,,,,,,
2021-07-17,Marble Falls,TX,Johnson Park,,a man,1,1,,,"against Democrats, for Donald Trump",2,counter-protest,called to scene,assaulted rally-goers,,,1,,,,20210717-marblefalls-turntxblue,,,https://www.dailytrib.com/2021/07/19/man-arrested-during-democratic-rally/,https://www.rawstory.com/trump-supporter-arrested-2653852504/,,,,,,,,,,,,,,,,,,,,,,,,,,,,
2021-07-17,Marietta,OH,Muskingum Park,Good Trouble Vigil for Democracy & Voting Rights,,,,Declaration for American Democracy,,"for passage of the For the People Act, for the John Lewis Voting Rights Amendment Act, for DC statehood, end the Jim Crow filibuster",1,vigil,,,,,,,,,,,,https://www.mobilize.us/democracyvigils/event/400894/,,,,,,,,,,,,,,,,,,,,,,,,,,,,,
2021-07-17,Marion,IA,"Lutheran Church of the Resurrection, 3500 29th Ave",Unity Rally,several dozen,36,36,Marion Alliance for Racial Equity; Advocates for Social Justice,faith leaders; students,"for a more inclusive and safe Marion for all, against racism, for LGBTQ+ rights, for unity",1,rally,,,,,,,,,,,,https://www.facebook.com/events/549030199603986/,https://www.thegazette.com/local-government/marion-social-justice-activists-call-for-action-and-unity/,,,,,,,,,,,,,,,,,,,,,,,,,,,,
2021-07-17,Martinsville,IN,"Texas Corral, 610 Birk Rd",Arise USA The Resurrection Tour,,,,Constitutional Sheriff & Peace Officer's Association; Earth Intelligence Network,,"for constitutional freedom, for health freedom, for Christian faith, for patriotism, for sovereign citizenship, against state coronavirus mandates and vaccines",2,rally,,,,,,,,,,,,https://ariseusa.com/about/,https://bigbatusa.org/2021/07/15/location-51-martinsville-in-17-july-530-8-pm/,,,,,,,,,,,,,,,,,,,,,,,,,,,,
2021-07-17,Memphis,TN,Cooper St,,over 40,40,40,Memphis Voices for Palestine; Freedom Road Socialist Organization; Never Again TN; Jewish Memphians for Social Justice,,"free Palestine, Zionism equals violence, against Israeli apartheid and ethnic cleansing, against U.S. aid to Israel",0,demonstration; march,,marched in street,,,,,,,,,,https://dailymemphian.com/article/22994/memphis-voices-for-palestine-rally-in-cooper-young,http://www.fightbacknews.org/2021/7/19/memphis-rallies-support-palestine,,,,,,,,,,,,,,,,,,,,,,,,,,,,
2021-07-17,Memphis,TN,I AM A MAN Plaza,Good Trouble Vigil for Democracy & Voting Rights,,,,Declaration for American Democracy,,"for passage of the For the People Act, for the John Lewis Voting Rights Amendment Act, for DC statehood, end the Jim Crow filibuster",1,vigil,,,,,,,,,,,,https://www.mobilize.us/democracyvigils/event/400411/,,,,,,,,,,,,,,,,,,,,,,,,,,,,,
2021-07-17,Miami,FL,6205 NW 27th Ave,Good Trouble Vigil for Democracy & Voting Rights,,,,Declaration for American Democracy,,"for passage of the For the People Act, for the John Lewis Voting Rights Amendment Act, for DC statehood, end the Jim Crow filibuster",1,vigil,,,,,,,,,,,,https://www.mobilize.us/democracyvigils/event/400336/,,,,,,,,,,,,,,,,,,,,,,,,,,,,,
2021-07-17,Miami,FL,Freedom Tower,,"thousands; around 3,000",2000,3000,,,"in solidarity with protesters in Cuba, for freedom, against communism",0,rally,blocked street and redirected traffic,filled street,,,,,,,,,,https://wsvn.com/news/local/miami-dade/hundreds-calling-for-democracy-in-cuba-gather-outside-freedom-tower-ahead-of-rally/,https://www.local10.com/news/local/2021/07/18/massive-crowd-protests-outside-freedom-tower-in-downtown-miami-calling-for-cuban-freedom/,https://www.sun-sentinel.com/news/florida/fl-ne-mh-cuban-protests-saturday-20210718-hulvdurhtff4fdm7gxnfpytnfe-story.html,,,,,,,,,,,,,,,,,,,,,,,,,,,
2021-07-17,Miami,FL,"La Carreta, 8650 Bird Rd",Miami-Dade MAGA Save Cuba Rally,,,,Floridians First; Proud Boys; Three Percenters,,"in solidarity with protesters in Cuba, for freedom, against communism, patria y vida",0,rally,,,,,,,,,,,,https://twitter.com/MIAagainstFash/status/1417199950660837380,,,,,,,,,,,,,,,,,,,,,,,,,,,,,
2021-07-17,Michigan City,IN,La Porte County Herald-Dispatch,Good Trouble Vigil for Democracy & Voting Rights,,,,Declaration for American Democracy,,"for passage of the For the People Act, for the John Lewis Voting Rights Amendment Act, for DC statehood, end the Jim Crow filibuster",1,vigil,,,,,,,,,,,,https://www.mobilize.us/democracyvigils/event/400279/,,,,,,,,,,,,,,,,,,,,,,,,,,,,,
2021-07-17,Montesano,WA,Fleet Park,Good Trouble Vigil for Democracy & Voting Rights,,,,Declaration for American Democracy,,"for passage of the For the People Act, for the John Lewis Voting Rights Amendment Act, for DC statehood, end the Jim Crow filibuster",1,vigil,,,,,,,,,,,,https://www.mobilize.us/democracyvigils/event/400879/,,,,,,,,,,,,,,,,,,,,,,,,,,,,,
2021-07-17,Montgomery,AL,Dexter Avenue King Memorial Baptist Church,Good Trouble Vigil for Democracy & Voting Rights,,,,Declaration for American Democracy,,"for passage of the For the People Act, for the John Lewis Voting Rights Amendment Act, for DC statehood, end the Jim Crow filibuster",1,vigil,,,,,,,,,,,,https://www.mobilize.us/democracyvigils/event/400930/,,,,,,,,,,,,,,,,,,,,,,,,,,,,,
2021-07-17,Moose Lake,MN,40 Arrowhead Ln,Good Trouble Vigil for Democracy & Voting Rights,,,,Declaration for American Democracy,,"for passage of the For the People Act, for the John Lewis Voting Rights Amendment Act, for DC statehood, end the Jim Crow filibuster",1,vigil,,,,,,,,,,,,https://www.mobilize.us/democracyvigils/event/400927/,,,,,,,,,,,,,,,,,,,,,,,,,,,,,
2021-07-17,Naperville,IL,"Free Speech Pavilion, Naperville Riverwalk",Good Trouble Vigil for Democracy & Voting Rights,,,,Declaration for American Democracy,,"for passage of the For the People Act, for the John Lewis Voting Rights Amendment Act, for DC statehood, end the Jim Crow filibuster",1,vigil,,,,,,,,,,,,https://www.mobilize.us/democracyvigils/event/400673/,https://www.chicagotribune.com/suburbs/naperville-sun/ct-ecn-naperville-voting-rights-rally-john-lewis-st-0721-20210720-j26ulhrgcba73abe2dpbuloidu-story.html,,,,,,,,,,,,,,,,,,,,,,,,,,,,
2021-07-17,New Orleans,LA,New Orleans City Hall,Good Trouble Vigil for Democracy & Voting Rights,,,,Declaration for American Democracy,,"for passage of the For the People Act, for the John Lewis Voting Rights Amendment Act, for DC statehood, end the Jim Crow filibuster",1,vigil,,,,,,,,,,,,https://www.mobilize.us/democracyvigils/event/400569/,,,,,,,,,,,,,,,,,,,,,,,,,,,,,
2021-07-17,New York,NY,"202 Bay St, Staten Island",7 Years Since the Public Lynching of Eric Garner,,,,The Legacy Eric Garner Left Behind; Black Jews 4 Black Liberation; The Legacy Youth Chapter; Why Accountability; Shaolin Rising; Maroon Party; Shut It Down NYC,,"against police brutality, against racism, for justice for Eric Garner and other victims of state violence in New York, get your arm off my neck",1,rally,,,,,,,,,,,,https://twitter.com/NYC_ShutItDown/status/1409899825852735489,https://twitter.com/AshAgony/status/1416167201070108673,https://twitter.com/protest_nyc/status/1416521586455232524,,,,,,,,,,,,,,,,,,,,,,,,,,,
2021-07-17,New York,NY,"2128 Frederick Douglass Blvd, Manhattan",Good Trouble Vigil for Democracy & Voting Rights,,,,Declaration for American Democracy,,"for passage of the For the People Act, for the John Lewis Voting Rights Amendment Act, for DC statehood, end the Jim Crow filibuster",1,vigil,,,,,,,,,,,,https://www.mobilize.us/democracyvigils/event/401086/,,,,,,,,,,,,,,,,,,,,,,,,,,,,,
2021-07-17,New York,NY,"Avenue C and McDonald Ave, Brooklyn",Globalize the Intifada: Bengalis for Palestine,,,,Within Our Lifetime,,"in solidarity with Palestine, against imperialism",0,rally,,,,,,,,,,,,https://www.instagram.com/p/CRXtobpjG0I/?utm_source=ig_web_copy_link,,,,,,,,,,,,,,,,,,,,,,,,,,,,,
2021-07-17,New York,NY,"Carl Schurz Park, Manhattan",,,,,Upper East Side for Black Lives Matter,,"against racism, against police violence",1,vigil; march,,,,,,,,,,,,https://www.instagram.com/p/CRbyvIpDRNM/?utm_source=ig_web_copy_link,,,,,,,,,,,,,,,,,,,,,,,,,,,,,
2021-07-17,New York,NY,"Central Park, Manhattan",,count video,50,70,Halt Solitary,,"in celebration of passage of Halt Solitary Confinement act, for state criminal justice reform",1,rally,,,,,,,,,,,,https://twitter.com/hamzasaldana614/status/1416076000643911680,https://twitter.com/datainput/status/1416463227584712706,,,,,,,,,,,,,,,,,,,,,,,,,,,,
2021-07-17,New York,NY,"Foley Square, Manhattan",Fire Artem,,,,,,"against police brutality, against racism, for firing NYPD officer Artem Prusayev",1,rally; march,,,,,,,,,,,,https://www.instagram.com/p/CRZxhE7HX-n/?utm_source=ig_web_copy_link,,,,,,,,,,,,,,,,,,,,,,,,,,,,,
2021-07-17,New York,NY,"Gracie Mansion, Manhattan",Youth Homeless + Houseless Rights Rally,,,,,,"in support of homeless and houseless youth, Black children matter, for protecting Black youth organizers",1,vigil,,,,,,,,,,,,https://www.instagram.com/p/CRU6MjJriBL/,,,,,,,,,,,,,,,,,,,,,,,,,,,,,
2021-07-17,New York,NY,"Grand Army Plaza, Brooklyn",Good Trouble Vigil for Democracy & Voting Rights,,,,Declaration for American Democracy,,"for passage of the For the People Act, for the John Lewis Voting Rights Amendment Act, for DC statehood, end the Jim Crow filibuster",1,vigil,,,,,,,,,,,,https://www.mobilize.us/democracyvigils/event/400521/,,,,,,,,,,,,,,,,,,,,,,,,,,,,,
2021-07-17,New York,NY,"McCarren Park, Brooklyn",,,,,,,"against racism, against police violence",1,vigil,,,,,,,,,,,,https://www.instagram.com/p/CRZvBAMHemE/?utm_source=ig_web_copy_link,,,,,,,,,,,,,,,,,,,,,,,,,,,,,
2021-07-17,New York,NY,"Union Square, Manhattan; Broadway",,about 100,100,100,,,"in solidarity with protesters in Cuba, SOS Cuba",0,rally; march,,marched in street,,,,,,,,,,https://twitter.com/ScooterCasterNY/status/1416493037740564483,https://twitter.com/ScooterCasterNY/status/1416546453699317763,,,,,,,,,,,,,,,,,,,,,,,,,,,,
2021-07-17,New York,NY,"United Metro Energy Corp., 500 Kingsland Ave, Brooklyn",,,,,Teamsters Local 553,,for higher pay and better health benefits for United Metro Energy workers,0,strike; picket,,,,,,,,,,,,https://inthesetimes.com/article/united-metro-energy-labor-politics-unions,,,,,,,,,,,,,,,,,,,,,,,,,,,,,
2021-07-17,Newark,OH,Licking County Courthouse,Good Trouble Vigil for Democracy & Voting Rights,,,,Declaration for American Democracy,,"for passage of the For the People Act, for the John Lewis Voting Rights Amendment Act, for DC statehood, end the Jim Crow filibuster",1,vigil,,,,,,,,,,,,https://www.mobilize.us/democracyvigils/event/400054/,,,,,,,,,,,,,,,,,,,,,,,,,,,,,
2021-07-17,North Lauderdale,FL,Pomano Park,Good Trouble Vigil for Democracy & Voting Rights,,,,Declaration for American Democracy,,"for passage of the For the People Act, for the John Lewis Voting Rights Amendment Act, for DC statehood, end the Jim Crow filibuster",1,vigil,,,,,,,,,,,,https://www.mobilize.us/democracyvigils/event/400401/,,,,,,,,,,,,,,,,,,,,,,,,,,,,,
2021-07-17,Oakland,CA,1233 Preservation Park Way,Good Trouble Vigil for Democracy & Voting Rights,,,,Declaration for American Democracy,,"for passage of the For the People Act, for the John Lewis Voting Rights Amendment Act, for DC statehood, end the Jim Crow filibuster",1,vigil,,,,,,,,,,,,https://www.mobilize.us/democracyvigils/event/400160/,,,,,,,,,,,,,,,,,,,,,,,,,,,,,
2021-07-17,Ocala,FL,Ocala Police Department,,,,,,,"in solidarity with protesters in Cuba, freedom for Cuba, SOS Cuba, patria y vida",0,protest,,,,,,,,,,,,https://www.ocala-news.com/2021/07/19/sos-cuba-supporters-stage-protest-in-ocala/,,,,,,,,,,,,,,,,,,,,,,,,,,,,,
2021-07-17,Omaha,NE,72nd St and Dodge,,20,20,20,,,"in solidarity with protesters in Cuba, freedom for Cuba, for U.S. military intervention in Cuba, SOS Cuba, stop killing my unarmed family",0,demonstration,,,,,,,,,,,,https://twitter.com/mel_atNOISE/status/1416468577671127049,https://twitter.com/noiseomaha/status/1416522965118865412,,,,,,,,,,,,,,,,,,,,,,,,,,,,
2021-07-17,Orangeburg,SC,Orangeburg County Courthouse,Good Trouble Vigil for Democracy & Voting Rights,,,,Declaration for American Democracy,,"for passage of the For the People Act, for the John Lewis Voting Rights Amendment Act, for DC statehood, end the Jim Crow filibuster",1,vigil,,,,,,,,,,,,https://www.mobilize.us/democracyvigils/event/401037/,,,,,,,,,,,,,,,,,,,,,,,,,,,,,
