date,locality,state,location,title,size_text,size_low,size_high,organizations,participants,claims,valence,event_type,police_measures,participant_measures,police_injuries,participant_injuries,arrests,property_damage,police_deaths,participant_deaths,macroevent,notes,coder,source1,source2,source3,source4,source5,source6,source7,source8,source9,source10,source11,source12,source13,source14,source15,source16,source17,source18,source19,source20,source21,source22,source23,source24,source25,source26,source27,source28,source29,source30
2021-07-23,Washington,DC,Arlington Memorial Bridge; Roosevelt Bridge; Lincoln Memorial,,hundreds,200,200,United We Dream; CASA; Center for Popular Democracy Action; FIRM Action; Green New Deal Network,undocumented youth,for a pathway to citizenship for all undocumented immigrants as part of federal coronavirus recovery efforts,1,rally; banner drop,,,,,,,,,,,,https://twitter.com/UNITEDWEDREAM/status/1418589898207109120,https://twitter.com/CASAforall/status/1418589470354444289,https://twitter.com/aletweetsnews/status/1418624248994799619,,,,,,,,,,,,,,,,,,,,,,,,,,,
2021-07-23,Washington,DC,"Tifereth Israel Congregation, 7701 16th Street NW",,,,,Tifereth Israel Congregation,,"against racism, solidarity with Black Lives Matter",1,vigil,,,,,,,,,,,,https://tiferethdc.shulcloud.com/event/vigil-against-racism.html,,,,,,,,,,,,,,,,,,,,,,,,,,,,,
2021-07-23,Wooster,OH,Wooster Square,,,,,Wayne County Racial Justice Coalition,,against racism,1,demonstration,,,,,,,,,,,,online submission,,,,,,,,,,,,,,,,,,,,,,,,,,,,,
2021-07-23,Worcester,MA,St. Vincent Hospital,,,,,Massachusetts Nurses Association,nurses,for fair contract and safe staffing levels for nurses at St. Vincent Hospital,0,strike; picket,,,,,,,,,,,,https://www.telegram.com/story/news/2021/07/21/st-vincent-hospital-nurses-strike-marlena-pellegrino-tenet-healthcare/8043601002/,https://www.masslive.com/worcester/2021/07/supporters-march-through-worcester-in-solidarity-with-striking-saint-vincent-hospital-nurses-well-be-here-as-long-as-it-takes.html,,,,,,,,,,,,,,,,,,,,,,,,,,,,
2021-07-24,Albuquerque,NM,"University of New Mexico Hospital, 2211 Lomas Blvd",March for Medicare for All,,,,Progressive Democrats of America,elected officials,"for Medicare for all, for a single comprehensive national healthcare service system, healthcare is a human right, healthcare not warfare",1,march,,,,,,,,,,,,https://www.mobilize.us/marchformedicareforallm4m4all-1/event/389271/,https://www.krqe.com/news/politics-government/medicare-for-all-bill-focus-of-saturday-rally/,,,,,,,,,,,,,,,,,,,,,,,,,,,,
2021-07-24,Amesbury,MA,5 Market St,Peaceful Rally for Black Lives Matter,FB: 3,3,3,,,"Black Lives Matter, against racism",1,rally,,,,,,,,,,,,https://www.facebook.com/events/2645979722372701/,,,,,,,,,,,,,,,,,,,,,,,,,,,,,
2021-07-24,Amherst,MA,Amherst Town Hall,,about 100,100,100,Amherst-Pelham Education Association,union members,for higher pay for paraeducators in Amerherst schools,0,protest,,,,,,,,,,,,https://www.masslive.com/news/2021/07/union-protesters-demand-amherst-paraeducators-be-paid-a-living-wage.html,,,,,,,,,,,,,,,,,,,,,,,,,,,,,
2021-07-24,Ann Arbor,MI,St. Joseph Mercy Ann Arbor,,,,,,healthcare workers,"against COVID-19 vaccination mandate for healthcare workers with Trinity Health, for freedom of choice",2,protest,,,,,,,,,,,,https://www.wxyz.com/news/unvaccinated-michigan-hospital-workers-expected-to-protest-mandates-for-covid-19-vaccine,,,,,,,,,,,,,,,,,,,,,,,,,,,,,
2021-07-24,Asheville,NC,,March for Medicare for All,,,,,,"for Medicare for all, for a single comprehensive national healthcare service system",1,march,,,,,,,,,,,,https://www.mobilize.us/marchformedicareforallm4m4all-1/event/393003/,,,,,,,,,,,,,,,,,,,,,,,,,,,,,
2021-07-24,Atlanta,GA,25 Courtland St SE,March for Medicare for All,,,,,,"for Medicare for all, for a single comprehensive national healthcare service system",1,march,,,,,,,,,,,,https://www.mobilize.us/marchformedicareforallm4m4all-1/event/394654/,,,,,,,,,,,,,,,,,,,,,,,,,,,,,
2021-07-24,Atlanta,GA,Piedmont Park,World Wide Rally for Freedom,around 100; about 100,100,100,North GA White Rose; I Do Not Comply; Three Percenters; No Left Turn in Education,,"for medical freedom, against government coronavirus mandates, against the New World Order and International Sabbatean Cabal, against transgender indoctrination and critical race theory in schools, against Bill Gates for injecting AI into people, for sovereign citizenship, for Donald Trump, against election fraud",2,rally,,,,,,,,,,feat. Kandiss Taylor,,https://www.instagram.com/p/CQy7DbRt2mZ/,https://t.me/worldwidegeorgia,https://twitter.com/afainatl/status/1418994772912525321,https://dirtysouthrightwatch.org/2021/atl-worldwide3/,https://twitter.com/afainatl/status/1424959538353090560,,,,,,,,,,,,,,,,,,,,,,,,,
2021-07-24,Auburn,MA,,,about two dozen,24,24,MassEquality,,"against pro-Trump right-wing fundraising event, against hate speech, for LGBTQ+ pride, Black Lives Matter",1,protest,,,,,,,,,,,,https://www.telegram.com/story/news/local/2021/07/24/refounding-fathers-festival-auburn-trump-supporters-protesters/8069728002/,,,,,,,,,,,,,,,,,,,,,,,,,,,,,
2021-07-24,Austin,TX,1100 Congress Ave,March for Medicare for All,,,,Green Party,,"for Medicare for all, for a single comprehensive national healthcare service system",1,march,,,,,,,,,,,,https://www.mobilize.us/marchformedicareforallm4m4all-1/event/399510/,https://twitter.com/Brookiepoosays/status/1418988103008722950,https://twitter.com/IndLeftNews/status/1419161763673636866,https://twitter.com/GreenPartyUS/status/1419160805480669184,,,,,,,,,,,,,,,,,,,,,,,,,,
2021-07-24,Baltimore,MD,"Baltimore Gas & Electric Company, 110 W Fayette St",,dozens,24,24,IBEW Local 410,workers,for more training and safer working conditions for Baltimore Gas and Electric Company workers,0,protest,,,,,,,,,,,,https://news.yahoo.com/baltimore-gas-electric-workers-rally-031433806.html,,,,,,,,,,,,,,,,,,,,,,,,,,,,,
2021-07-24,Baltimore,MD,War Memorial Plaza,2nd Annual Black Trans Lives Matter Rally,more than 100,100,100,Baltimore Safe Haven,Black transgender activists,"for better access to health care and employment and foster care and substance use support and housing for members of LGBTQ+ communities, for public education inclusive of queer history and the enforcement of nondiscrimination policies, Black trans lives matter",1,rally,,,,,,,,,,,,https://www.baltimoresun.com/maryland/baltimore-city/bs-md-ci-black-trans-lives-matter-march-city-hall-20210724-3jpbhqci3beotcq35mgqtiydpq-story.html,,,,,,,,,,,,,,,,,,,,,,,,,,,,,
2021-07-24,Bemidji,MN,300 Bemidji Ave,March for Medicare for All,,,,Our Revolution,,"for Medicare for all, for a single comprehensive national healthcare service system",1,march,,,,,,,,,,,,https://www.mobilize.us/marchformedicareforallm4m4all-1/event/397767/,https://www.facebook.com/events/161897812624063/,,,,,,,,,,,,,,,,,,,,,,,,,,,,
2021-07-24,Bend,OR,"Peace Corner, NW Greenwood Ave and NW Wall St",March for Medicare for All,,,,Central Oregon Healthcare for All,,"for Medicare for all, for a single comprehensive national healthcare service system",1,march,,,,,,,,,,,,https://www.mobilize.us/marchformedicareforallm4m4all-1/event/402225/,https://ktvz.com/videos/local-videos/2021/07/25/bend-rally-calls-for-medicare-for-all/,,,,,,,,,,,,,,,,,,,,,,,,,,,,
2021-07-24,Birmingham,AL,"Railroad Park Foundation, 1600 1st Ave S",March for Medicare for All,count pic,15,20,,,"for Medicare for all, for a single comprehensive national healthcare service system",1,march,,,,,,,,,,,,https://www.mobilize.us/marchformedicareforallm4m4all-1/event/401940/,https://twitter.com/myhaze/status/1419121954649481217,,,,,,,,,,,,,,,,,,,,,,,,,,,,
2021-07-24,Boston,MA,Faneuil Hall,,,,,Cubans in Boston,,"in solidarity with protesters in Cuba, patria y vida, for democracy in Cuba",0,rally,,,,,,,,,,,,https://www.bostonglobe.com/2021/07/22/metro/patria-y-vida-boston-demonstrators-rally-against-authoritarianism-cuba-city-hall-plaza/,,,,,,,,,,,,,,,,,,,,,,,,,,,,,
2021-07-24,Boston,MA,Nubian Square; Boston Common,March for Medicare for All,count video,40,50,,,"for Medicare for all, for a single comprehensive national healthcare service system",1,march,,,,,,,,,,,,https://www.mobilize.us/marchformedicareforallm4m4all-1/event/397994/,https://whdh.com/news/demonstrators-march-in-boston-for-medicare-for-all/,https://twitter.com/gregsbrews/status/1418968550690238484,,,,,,,,,,,,,,,,,,,,,,,,,,,
2021-07-24,Boston,MA,Park Street Station,,,,,Alliance for Secular and Democratic South Asia; ANSWER Coalition Boston; Boston May Day Coalition; Boston South Asian Coalition; Committee for Peace and Human Rights; Fanmi Lavalas Boston; International Action Center; July 26th Coalition; Palestinian House of New England; Party for Socialism and Liberation Boston; Team Solidarity; USW Local 8751-Boston School Bus Drivers; United American Indians of New England; Workers World Party,,"for ending U.S. economic sanctions on Cuba, against U.S. intervention in Haiti",0,rally,,,,,,,,,,,,https://www.instagram.com/p/CRo7L-SHtBK/?utm_source=ig_web_copy_link,,,,,,,,,,,,,,,,,,,,,,,,,,,,,
2021-07-24,Boulder,CO,Pearl Street Mall,March for Medicare for All,,,,,,"for Medicare for all, for a single comprehensive national healthcare service system",1,march,,,,,,,,,,,,https://www.mobilize.us/marchformedicareforallm4m4all-1/event/402501/,,,,,,,,,,,,,,,,,,,,,,,,,,,,,
2021-07-24,Bridgeport,CT,45 Lyon Terrace,March for Medicare for All,,,,,,"for Medicare for all, for a single comprehensive national healthcare service system",1,march,,,,,,,,,,,,https://www.mobilize.us/marchformedicareforallm4m4all-1/event/400361/,,,,,,,,,,,,,,,,,,,,,,,,,,,,,
2021-07-24,Brookwood,AL,Warror Met Coal Inc.,,,,,United Mine Workers of America,,against unfair labor practices at Warrior Met Coal,0,strike; picket,,,,,,,,,,,,https://twitter.com/TheRealNews/status/1413205492806012929,,,,,,,,,,,,,,,,,,,,,,,,,,,,,
2021-07-24,Cannonball,ND,Standing Rock,,,,,Native Organizers Alliance; IllumiNative; House of Tears Carvers of the Lummi Nation,,"for protecting places sacred to native peoples, for environmental conservation, for tribal rights",1,rally,,,,,,,,,,,,https://actionnetwork.org/forms/standing-rock/,https://michiganadvance.com/2021/07/29/indigenous-activists-protest-line-5-in-michigan-on-20000-mile-journey-to-dc/,,,,,,,,,,,,,,,,,,,,,,,,,,,,
2021-07-24,Chattanooga,TN,"Eastdale Village Community Church, 1403 Tunnel Blvd",Voting Rights,,,,Unity Group of Chattanooga; Poor People's Campaign,,"for pasage of the federal For the People Act and John Lewis Voting Rights Act, for $15 minimum wage",1,rally,,,,,,,,,,,,https://wdef.com/2021/07/24/voting-rights-rally/,https://www.facebook.com/events/496051974797087/,https://www.wrcbtv.com/story/44370947/coalitions-rally-for-a-call-to-action-against-voter-suppression-and-minimum-wage,,,,,,,,,,,,,,,,,,,,,,,,,,,
2021-07-24,Chicago,IL,Federal Plaza,Abolish ICE/No Kids in Cages/Biden Close the Camps,FB: 15,15,15,Black Lives Matter In Wheeling; Justice for Black Lives; Chicago Activist Coalition For Justice; Tikkun Chai Inter-National,,"abolish ICE, no kids in cages, against immigrant family separations",1,protest,,,,,,,,,,,,https://www.facebook.com/events/329819312004350/,,,,,,,,,,,,,,,,,,,,,,,,,,,,,
2021-07-24,Chicago,IL,Maggie Daley Park; Federal Plaza,March for Medicare for All,over 100,100,100,Cook County Green Party,,"for Medicare for all, for a single comprehensive national healthcare service system, healthcare is a human right",1,march,escorted marchers,marched in street,,,,,,,,,,https://www.mobilize.us/marchformedicareforallm4m4all-1/event/391881/,https://wgntv.com/news/chicago-news/over-100-people-march-in-support-of-medicare-for-all-downtown/,https://twitter.com/joyfulnoyz/status/1419143204709019650,https://twitter.com/IndLeftNews/status/1419166773207879681,https://twitter.com/JunaidForUs/status/1419139199152934915,,,,,,,,,,,,,,,,,,,,,,,,,
2021-07-24,Chicago,IL,Michigan and Madison,World Wide Rally for Freedom,,,,,,"for medical freedom, against government coronavirus mandates",2,rally,,,,,,,,,,,,https://www.instagram.com/p/CRcVyMGtsDQ/,https://t.me/worldwidechicago,,,,,,,,,,,,,,,,,,,,,,,,,,,,
2021-07-24,Chicopee,MA,,,count video,15,20,,local residents,"against plan to construct Cumberland Farms gas station in Aldenville neighborhood, residents before revenue",0,protest,,,,,,,,,,,,https://www.wwlp.com/news/local-news/hampden-county/chicopee-residents-protest-proposed-cumberland-farms-convenience-store/,,,,,,,,,,,,,,,,,,,,,,,,,,,,,
2021-07-24,College Station,TX,College Station City Hall,,count pic,30,40,SOS Cuba Brazos Valley,Brazos County residents; Cuban-Americans,"in solidarity with protesters in Cuba, for freedom for Cuba, patria y vida",0,rally,,,,,,,,,,,,https://www.kbtx.com/2021/07/24/second-weekend-row-bryan-college-station-residents-rally-support-cuba/,,,,,,,,,,,,,,,,,,,,,,,,,,,,,
2021-07-24,Columbus,OH,Ohio Statehouse,March for Medicare for All,over 100,100,100,Unified People's Coalition,,"for Medicare for all, for a single comprehensive national healthcare service system",1,march,,,,,,,,,,,,https://www.mobilize.us/marchformedicareforallm4m4all-1/event/395929/,https://www.facebook.com/events/493882081826548/,https://twitter.com/PeopleUnified/status/1419129379876184071,,,,,,,,,,,,,,,,,,,,,,,,,,,
2021-07-24,Corpus Cristi,TX,"Dr. Hector P. Garcia Plaza, Texas A&M University-Corpus Cristi",Our History Won't Be Erased,,,,League of Latin American Citizens; LULAC Para Todos; Corpus Christi American Federation of Teachers; NAACP; Indigenous Peoples of the Coastal Bend,,"against SB 3, against state legislation restricting public education on racism and other controversial topics",1,rally,,,,,,,,,,,,https://www.caller.com/story/news/2021/07/24/local-organizations-hold-rally-against-texas-senate-bill-3/8060059002/,https://www.kristv.com/news/local-news/civil-rights-leaders-gather-to-protest-senate-bill-3-at-tamu-cc,,,,,,,,,,,,,,,,,,,,,,,,,,,,
2021-07-24,Corvallis,OR,NW 4th St & NW Monroe Ave,March for Medicare for All,,,,,,"for Medicare for all, for a single comprehensive national healthcare service system",1,march,,,,,,,,,,,,https://www.mobilize.us/marchformedicareforallm4m4all-1/event/397127/,,,,,,,,,,,,,,,,,,,,,,,,,,,,,
2021-07-24,Creswell,OR,West Ln; home of the mayor,"""Prohibited Activity"" Parade",dozens; about 50,24,50,People's Rights; Three Percenters,,"in support of organizers of July 4 parade, against tyranny, for freedom, for patriotism",2,rally; caravan,,,,,,,,,,,,https://twitter.com/EugYLF/status/1418287071572250629,https://kpic.com/newsletter-daily/protest-in-creswell-fights-against-citations-for-4th-of-july-parade-07-25-2021,https://www.kezi.com/content/news/Some-residents-uneasy-about-parade--574917031.html,,,,,,,,,,,,,,,,,,,,,,,,,,,
2021-07-24,Denver,CO,Colorado State Capitol,March for Medicare for All,,,,,,"for Medicare for all, for a single comprehensive national healthcare service system",1,march,,,,,,,,,,,,https://www.mobilize.us/marchformedicareforallm4m4all-1/event/393727/,,,,,,,,,,,,,,,,,,,,,,,,,,,,,
2021-07-24,Des Moines,IA,Iowa State Capitol,March for Medicare for All,,,,,,"for Medicare for all, for a single comprehensive national healthcare service system",1,march,,,,,,,,,,,,https://www.mobilize.us/marchformedicareforallm4m4all-1/event/402320/,,,,,,,,,,,,,,,,,,,,,,,,,,,,,
2021-07-24,Des Moines,IA,Iowa State Capitol,World Wide Rally for Freedom,more than 100,100,100,Informed Choice Iowa,elected officials,"for medical freedom, against government coronavirus mandates, stop vax bullying, against socialism",2,rally,,,,,,,,,,,,https://www.instagram.com/p/CRcVyMGtsDQ/,https://www.desmoinesregister.com/story/news/2021/07/24/covid-19-vaccine-mandates-over-100-rally-iowa-state-capitol-against-them-coronavirus-des-moines/8073571002/,https://www.3newsnow.com/news/coronavirus/over-100-people-protest-vaccine-mandates-at-iowa-capitol,,,,,,,,,,,,,,,,,,,,,,,,,,,
2021-07-24,Detroit,MI,"HUDA Free Clinic, 13240 Woodrow Wilson St",March for Medicare for All,,,,,,"for Medicare for all, for a single comprehensive national healthcare service system",1,march,,,,,,,,,,,,https://www.mobilize.us/marchformedicareforallm4m4all-1/event/391940/,https://twitter.com/ChuckModi1/status/1419011164856594440,,,,,,,,,,,,,,,,,,,,,,,,,,,,
2021-07-24,Elgin,IL,Kimball St and N Grove Ave,March for Medicare for All,,,,,,"for Medicare for all, for a single comprehensive national healthcare service system",1,march,,,,,,,,,,,,https://www.mobilize.us/marchformedicareforallm4m4all-1/event/402211/,,,,,,,,,,,,,,,,,,,,,,,,,,,,,
2021-07-24,Elmira,NY,,,,,,,local hockey supporters,"against plans to close First Arena, for keeping recreation venue open",0,protest,,,,,,,,,,,,https://www.mytwintiers.com/news-cat/elmira-enforcers-fans-protest-to-save-the-first-arena/,,,,,,,,,,,,,,,,,,,,,,,,,,,,,
2021-07-24,Erie,PA,Harley Davidson Erie,Back the Blue II,hundreds,200,200,,riders,"in support of police, for patriotism",2,rally; motorcycle ride,,,,,,,,,,,,https://www.erienewsnow.com/story/44336507/back-the-blue-ride-and-rally-returns-to-erie,https://www.wnct.com/news/national/second-annual-back-the-blue-rally-takes-place-at-harley-davidson-erie/,,,,,,,,,,,,,,,,,,,,,,,,,,,,
2021-07-24,Fayetteville,AR,280 N College Ave,March for Medicare for All,,,,,,"for Medicare for all, for a single comprehensive national healthcare service system",1,march,,,,,,,,,,,,https://www.mobilize.us/marchformedicareforallm4m4all-1/event/397753/,,,,,,,,,,,,,,,,,,,,,,,,,,,,,
2021-07-24,Fort Worth,TX,Tarrant County Corrections Center; Fort Worth City Hall,,hundreds,200,200,Texas NORML,,for decriminalization of marijuana possession and use,0,rally; march,traffic control for march; observed rally,openly smoked marijuana,,,,,,,,,,https://www.fwweekly.com/2021/07/25/hundreds-gather-for-weed-march-downtown/,,,,,,,,,,,,,,,,,,,,,,,,,,,,,
2021-07-24,Fountain Valley,CA,Mile Square Regional Park,March for Medicare for All,,,,,,"for Medicare for all, for a single comprehensive national healthcare service system",1,rally,,,,,,,,,,,,https://www.mobilize.us/marchformedicareforallm4m4all-1/event/402836/,,,,,,,,,,,,,,,,,,,,,,,,,,,,,
2021-07-24,French Camp,CA,"San Joaquin Sheriff's Office, 7000 Michael Canlis Blvd",We Demand Transparency in the Name of Arthur Robbins,,,,Turlock BLM Movement,,"for justice for Arthur Robbins, for police transparency, for full investigation into apparent suicide of Black man",1,protest,,,,,,,,,,,,https://twitter.com/TurlockBLM/status/1418652633040965634,,,,,,,,,,,,,,,,,,,,,,,,,,,,,
2021-07-24,Gilmer,TX,Gilmer Civic Center,,about 300,300,300,Republican Party of Upshur County,lawmakers,"for Republican candidates for office, MAGA, for Donald Trump",2,rally,,,,,,,,,,,,https://www.kltv.com/2021/07/24/texas-congressman-headline-gop-rally-gilmer/,,,,,,,,,,,,,,,,,,,,,,,,,,,,,
2021-07-24,Graham,NC,Court Square,,,,,,,against anti-racism protesters,2,counter-protest,,,,,,,,,20210724-graham-releasethetapes,,,https://www.thetimesnews.com/story/news/2021/07/27/anti-confederate-protestors-ride-through-graham-motorcade-saturday-statue-march-wyatt-outlaw/5374590001/,,,,,,,,,,,,,,,,,,,,,,,,,,,,,
2021-07-24,Graham,NC,Walmart; Alamance County Detention Center; Graham Police Department; Court Square,,count video,25,35,Alamance Alliance for Justice; Occupy Graham; Justice 4 the Next Generation,,"for releasing tapes from March to the Polls event in October 2020, against police brutality, for police accountability, Black Lives Matter, for removing Confederate monument",1,march; caravan; demonstration,escorted caravan; observed demonstration,,,,,,,,20210724-graham-releasethetapes,,,https://myfox8.com/news/north-carolina/piedmont-triad/graham-police-tell-public-to-expect-heavy-traffic-downtown-during-planned-protest/,https://www.wfmynews2.com/video/news/local/graham-protest-demands-law-enforcement-release-video-from-march-where-officers-deployed-pepper-spray/83-ef4de6c5-72ad-4b6c-bfff-202fc2c34069,https://www.thetimesnews.com/story/news/2021/07/27/anti-confederate-protestors-ride-through-graham-motorcade-saturday-statue-march-wyatt-outlaw/5374590001/,,,,,,,,,,,,,,,,,,,,,,,,,,,
2021-07-24,Greensboro,NC,,March for Medicare for All,,,,,,"for Medicare for all, for a single comprehensive national healthcare service system",1,caravan,,,,,,,,,,,,https://www.mobilize.us/marchformedicareforallm4m4all-1/event/400644/,,,,,,,,,,,,,,,,,,,,,,,,,,,,,
2021-07-24,Harrisburg,PA,online,World Wide Rally for Freedom,,,,,,"for medical freedom, against government coronavirus mandates",2,virtual rally,,,,,,,,,,,,https://www.instagram.com/p/CRmPq9ANb0y/?utm_source=ig_web_copy_link,,,,,,,,,,,,,,,,,,,,,,,,,,,,,
2021-07-24,Honolulu,HI,Ala Moana Beach Park,March for Medicare for All,20,20,20,Healthcare for All Hawaii,,"for Medicare for all, for a single comprehensive national healthcare service system",1,march,,,,,,,,,,,,https://www.mobilize.us/marchformedicareforallm4m4all-1/event/393690/,https://www.facebook.com/events/206180477993669/,https://www.youtube.com/watch?v=pQq7hmEEbto,https://twitter.com/healthcarehi/status/1419244964874055688,,,,,,,,,,,,,,,,,,,,,,,,,,
2021-07-24,Honolulu,HI,Ala Moana Beach Park,World Wide Rally for Freedom,,,,Aloha Freedom Coalition,,"for medical freedom, against government coronavirus mandates",2,rally,,,,,,,,,,,,https://www.instagram.com/p/CRcaKvLNLEd/,,,,,,,,,,,,,,,,,,,,,,,,,,,,,
2021-07-24,Houston,TX,Houston City Hall,World Wide Rally for Freedom,,,,,,"for medical freedom, against government coronavirus mandates",2,rally,,,,,,,,,,,,https://www.instagram.com/p/CRqHUG2NyGS/?utm_source=ig_web_copy_link,,,,,,,,,,,,,,,,,,,,,,,,,,,,,
2021-07-24,Houston,TX,Houston Galleria,World Wide Rally for Freedom,,,,,,"for medical freedom, against government coronavirus mandates",2,rally,,,,,,,,,,,,https://www.instagram.com/p/CRjAjqZNAd5/?utm_source=ig_web_copy_link,https://t.me/WorldwideDemonstrationHouston,,,,,,,,,,,,,,,,,,,,,,,,,,,,
2021-07-24,Houston,TX,,,,,,,,in solidarity with protesters in Cuba,0,caravan,,,,,,,,,,"headed to Washington, DC",,https://www.houstonchronicle.com/news/houston-texas/houston/article/I-feel-so-proud-Cuban-Americans-in-Houston-16336551.php,,,,,,,,,,,,,,,,,,,,,,,,,,,,,
2021-07-24,Huntsville,AL,Madison County Courthouse,March for Medicare for All,count video,20,30,,,"for Medicare for all, for a single comprehensive national healthcare service system",1,march,,,,,,,,,,,,https://www.mobilize.us/marchformedicareforallm4m4all-1/event/400697/,https://twitter.com/theoneronin1312/status/1419132848326553605,,,,,,,,,,,,,,,,,,,,,,,,,,,,
2021-07-24,Hyannis,MA,Village Green,World Wide Rally for Freedom,,,,,,"for medical freedom, against government coronavirus mandates",2,rally,,,,,,,,,,,,https://www.instagram.com/p/CRcUZZgtrex/,https://t.me/worldwidedemocapecod,,,,,,,,,,,,,,,,,,,,,,,,,,,,
2021-07-24,Indianapolis,IN,University Park,World Wide Rally for Freedom,,,,,,"for medical freedom, against government coronavirus mandates",2,rally,,,,,,,,,,,,https://twitter.com/INMutualAid/status/1418708875562340357,,,,,,,,,,,,,,,,,,,,,,,,,,,,,
2021-07-24,Irvine,CA,City of Irvine City Hall,March for Medicare for All,,,,,,"for Medicare for all, for a single comprehensive national healthcare service system",1,march,,,,,,,,,,,,https://www.mobilize.us/marchformedicareforallm4m4all-1/event/393853/,,,,,,,,,,,,,,,,,,,,,,,,,,,,,
2021-07-24,Jacksonville,FL,Jacksonville Beach; The Landing,,count video,30,50,,Cuban-Americans,"in solidarity with protesters in Cuba, for U.S. intervention in Cuba, SOS Cuba",0,caravan; rally,,,,,,,,,,,,https://www.firstcoastnews.com/article/news/local/free-cuba-protesters-caravan-across-jacksonville-push-for-us-government-to-do-more-local/77-1f0c65a6-f3f8-4583-a437-fe76f60c4a5a,,,,,,,,,,,,,,,,,,,,,,,,,,,,,
2021-07-24,Juneau,AK,"The Whale Project, Harris Harbor Way",March for Medicare for All,,,,,,"for Medicare for all, for a single comprehensive national healthcare service system",1,rally,,,,,,,,,,,,https://www.mobilize.us/marchformedicareforallm4m4all-1/event/402769/,,,,,,,,,,,,,,,,,,,,,,,,,,,,,
2021-07-24,Kansas City,KS,J.C. Nichols Memorial Fountain,March for Medicare for All,,,,,,"for Medicare for all, for a single comprehensive national healthcare service system",1,march,,,,,,,,,,,,https://www.mobilize.us/marchformedicareforallm4m4all-1/event/396351/,https://twitter.com/SocialistMMA/status/1418992096967602178,https://twitter.com/SocialistMMA/status/1419075793414656003,,,,,,,,,,,,,,,,,,,,,,,,,,,
2021-07-24,Kansas City,MO,Washington Square Park,,about 40,40,40,Kansas/Missouri Dream Alliance,,"for a pathway to citizenship for all undocumented immigrants, no more deportation, abolish ICE, stay familiies together",1,rally,,,,,,,,,,,,https://sportsgrindentertainment.com/kansas-citians-rally-following-judges-decision-to-end-daca/,,,,,,,,,,,,,,,,,,,,,,,,,,,,,
2021-07-24,Las Vegas,NV,495 S Main St,March for Medicare for All,,,,,,"for Medicare for all, for a single comprehensive national healthcare service system",1,march,,,,,,,,,,,,https://www.mobilize.us/marchformedicareforallm4m4all-1/event/397723/,,,,,,,,,,,,,,,,,,,,,,,,,,,,,
2021-07-24,Little Rock,AR,Arkansas State Capitol,March for Medicare for All,,,,,,"for Medicare for all, for a single comprehensive national healthcare service system",1,march,,,,,,,,,,,,https://www.mobilize.us/marchformedicareforallm4m4all-1/event/399773/,,,,,,,,,,,,,,,,,,,,,,,,,,,,,
2021-07-24,Los Angeles,CA,"Crossroads Kitchen, 8282 Melrose Ave",,around 20,20,20,,anti-maskers and anti-vaxxers,"against COVID-19 vaccination requirement to dine at Crossroads Kitchen restaurant, against vaccine passports",2,protest,on scene,verbally harassed diners and staff,,,,,,,,"incl. Shiva Bagheri, Jason Lefkowitz, and Paul Onaga",,https://twitter.com/VPS_Reports/status/1419158558180929536,https://twitter.com/SamBraslow/status/1419170880840617985,,,,,,,,,,,,,,,,,,,,,,,,,,,,
