id,type,section,date,headline,url,category,lead_paragraph,Black Lives Matter,BLM,Police Brutality,George Floyd,Breonna Taylor,Tyrel Nichols,Ahmaud Abery,Blue Lives Matter
george-floyd-protests-monday-curfews-autopsy,article,us-news,2020-06-02,george floyd killing: widespread curfews fail to stop fresh wave of protests across us,https://www.theguardian.com/us-news/2020/jun/01/george-floyd-protests-monday-curfews-autopsy,News,"cities witnessed another night of protests despite widespread curfews as sporadic unrest continued across the us one week after george floyd’s death, which autopsies on monday  ruled was a homicide.trong>r/>trong>r/>from new york to washington dc and from philadelphia to los angeles, many communities enacted curfews on monday, in some cases giving residents just hours’ or minutes’ notice.",False,False,False,True,False,False,False,False
george-floyd-violent-rioters-america-police-officers,article,commentisfree,2020-06-01,"across america, police are responding to peaceful protests with violence | nathan robinson",https://www.theguardian.com/commentisfree/2020/jun/01/george-floyd-violent-rioters-america-police-officers,Opinion,"the footage and photographs are disturbing. these lawless rioters are out of control. they have  driven an suv into a crowd,  tossed journalists to the ground and pepper-sprayed them,  beaten people with batons and even  blinded a woman in one eye. they have been launching  unprovoked attacks on peaceful, law-abiding citizens exercising their constitutional rights. the violent behavior of these mobs should be condemned by all. we need to restore order: someone must stop the police.",False,False,False,False,False,False,False,False
george-floyd-brother-philonise-floyd-congress,article,us-news,2020-06-10,'make it stop': george floyd's brother calls on congress to act over police violence,https://www.theguardian.com/us-news/2020/jun/10/george-floyd-brother-philonise-floyd-congress,News,"hours after george floyd was laid to rest in houston, his younger brother made an impassioned plea to congress to prevent his death from becoming just “another name” on an ever-growing list of black americans killed by police.",False,False,False,True,False,False,False,False
husband-los-angeles-district-attorney-charged-with-pointing-a-gun-at-black-lives-matter-protesters,article,us-news,2020-08-04,husband of la district attorney charged after pointing gun at black lives matter protesters,https://www.theguardian.com/us-news/2020/aug/04/husband-los-angeles-district-attorney-charged-with-pointing-a-gun-at-black-lives-matter-protesters,News,"the husband of the los angeles district attorney has been charged with multiple firearm assaults after he pointed a gun at black lives matter activists and said, “i will shoot you.”",True,False,False,False,False,False,False,False
stormzy-black-lives-matter,article,music,2020-07-09,"stormzy on black lives matter: 'if we weren't oppressed, we wouldn't be shouting'",https://www.theguardian.com/music/2020/jul/09/stormzy-black-lives-matter,Arts,"the  black lives matter movement represents “hundreds, thousands of years” of “real pain”,  stormzy has told the bbc.",True,False,False,False,False,False,False,False
john-boyega-challenged-racism-movie-star-hyde-park-speech,article,film,2020-06-04,'i ain’t waiting': john boyega shows movie stars what political engagement looks like,https://www.theguardian.com/film/2020/jun/04/john-boyega-challenged-racism-movie-star-hyde-park-speech,Arts,"already, the  sneery backlash has begun – as so much trumpism is founded on that keynote of faux-underdog self-pity in the face of supposedly all-powerful  liberalism. when actor john boyega, from star wars and attack the block, addressed protesters at a  black lives matter rally in london’s hyde park, he said: “i’m speaking to you from my heart. look, i don’t know if i’m going to have a career after this, but fuck that.” social media exploded with knowing jeers and giggling gotchas about how, actually, boyega m>hadm> to protest, or else his career would suffer! people on twitter who had shown no very obvious knowledge of or interest in the issue of civil rights or hollywood politics before this, were suddenly intoxicated by their delicious paradox, and made boyega’s comments the pretext of once again righteously smashing the 5g mast of liberal power.",False,False,False,False,False,False,False,False
hundreds-armed-counter-protesters-confront-black-lives-matter-event-bethel-ohio,article,us-news,2020-06-18,hundreds of armed counter-protesters confront black lives matter rally in ohio,https://www.theguardian.com/us-news/2020/jun/18/hundreds-armed-counter-protesters-confront-black-lives-matter-event-bethel-ohio,News,a small and peaceful demonstration in an ohio town to support the black lives matter movement at the weekend was overwhelmed when hundreds of counter-protesters – some armed with rifles or baseball bats – harassed the group.,True,False,False,False,False,False,False,False
man-rescued-by-uk-black-lives-matter-protester-is-ex-police-officer,article,uk-news,2020-06-18,man rescued by uk black lives matter protester is ex-police officer,https://www.theguardian.com/world/2020/jun/18/man-rescued-by-uk-black-lives-matter-protester-is-ex-police-officer,News,"the counter-protester carried to safety by a black lives matter protester last weekend is a former officer at british transport police, the force has confirmed.",True,False,False,False,False,False,False,False
blm-activists-demonstrating-against-anti-protest-bill-targeted-by-police,article,world,2021-03-16,blm activists demonstrating against anti-protest bill 'targeted by police',https://www.theguardian.com/world/2021/mar/16/blm-activists-demonstrating-against-anti-protest-bill-targeted-by-police,News,activists behind many of last summer’s black lives matter protests have accused the police of targeting and harassing them in an effort to stop them from taking part in  demonstrations against a police bill.,False,True,False,False,False,False,False,False
us-journalists-media-protests-donald-trump,article,media,2020-06-08,'denigrated and discredited': how american journalists became targets during protests,https://www.theguardian.com/media/2020/jun/08/us-journalists-media-protests-donald-trump,News,a photographer who says she was blinded in one eye. a tv reporter surrounded and arrested by police live on air. a cameraman slammed in the chest with a riot shield while filming a peaceful protest outside the president’s home.,False,False,False,False,False,False,False,False
mothers-black-children-killed-by-police-speak-out,article,us-news,2020-06-11,mothers of black americans killed by police speak out: ‘nothing's changed’,https://www.theguardian.com/us-news/2020/jun/11/mothers-black-children-killed-by-police-speak-out,News,"in his final moments of life, george floyd called for his mother as a white minneapolis police officer knelt on his neck in the street.",False,False,False,False,False,False,False,False
protests-george-floyd-black-lives-matter-saturday,article,us-news,2020-06-07,george floyd killing: peaceful protests sweep america as calls for racial justice reach new heights,https://www.theguardian.com/us-news/2020/jun/06/protests-george-floyd-black-lives-matter-saturday,News,"hundreds of thousands of americans took to the streets, in big cities and small towns, from coast to coast, marking one of the the most expansive mobilizations yet in the nationwide protests against police violence and systemic racism sparked by the police killing of george floyd in minneapolis.",False,False,False,True,False,False,False,False
this-weekend-has-to-be-day-one-of-rugby-unions-fight-against-racism,article,sport,2020-08-13,this weekend has to be day one of rugby's fight against racism | ugo monye,https://www.theguardian.com/sport/blog/2020/aug/13/this-weekend-has-to-be-day-one-of-rugby-unions-fight-against-racism,Sport,"black lives matter. those three words – a statement distilled to its purest form – are the best explanation i can give as to why i will take a knee when rugby restarts on friday night. i am totally aware that the statement has been politicised and i strongly disagree with some of the things the organisation stands for, but there is one reason why pretty much every household has developed a greater understanding and awareness of anti-racism recently: the black lives matter movement.",False,False,False,False,False,False,False,False
long-baileys-sacking-sparks-renewed-focus-on-us-and-israeli-police-links,article,politics,2020-06-25,long-bailey's sacking sparks focus on reporting of us-israeli police links,https://www.theguardian.com/politics/2020/jun/25/long-baileys-sacking-sparks-renewed-focus-on-us-and-israeli-police-links,News,keir starmer’s decision  to sack rebecca long-bailey as shadow education secretary after she shared on twitter an interview with the actor maxine peake has focused attention on links between us police forces and their israeli counterparts – and how those connections have been reported by some media outlets in recent weeks.,False,False,False,False,False,False,False,False
new-york-city-protesters-detained-abysmal-conditions,article,us-news,2020-06-10,"no masks, no water: new york protesters held in ‘abysmal’ conditions, experts say",https://www.theguardian.com/us-news/2020/jun/10/new-york-city-protesters-detained-abysmal-conditions,News,"protesters in new york have been unnecessarily arrested and detained for as long as 48 hours in “abysmal” conditions without access to masks, food and water, according to legal experts.",False,False,False,False,False,False,False,False
end-scourge-of-white-supremacy,article,world,2020-06-08,end scourge of white supremacy,https://www.theguardian.com/us-news/2020/jun/08/end-scourge-of-white-supremacy,News,"we the undersigned, members of a group known collectively as the london recruits, condemn the killing of george floyd at the hands of police. we condemn police and state brutality against black people in the us, uk and worldwide, and applaud the brave protesters who are risking their lives during a pandemic to say that black lives matter.",False,False,False,False,False,False,False,False
breonna-taylor-louisville-protest-george-floyd,article,us-news,2020-06-06,'she should be with us': louisville protesters remember breonna taylor,https://www.theguardian.com/us-news/2020/jun/06/breonna-taylor-louisville-protest-george-floyd,News,"breonna taylor would have been 27 on friday, but most of the people who showed up in downtown louisville to mark that milestone did not know her. a lot probably wish they had never heard her name.",False,False,False,False,True,False,False,False
utah-militia-armed-group-police-black-lives-matter-protests,article,us-news,2020-07-27,the birth of a militia: how an armed group polices black lives matter protests,https://www.theguardian.com/us-news/2020/jul/27/utah-militia-armed-group-police-black-lives-matter-protests,News,"the utah citizens’ alarm is only a month old, and yet it already boasts 15,000-plus members.",True,False,False,False,False,False,False,False
starbucks-black-lives-matter-clothing,article,business,2020-06-12,starbucks reverses stance and allows staff to wear black lives matter clothing,https://www.theguardian.com/business/2020/jun/12/starbucks-black-lives-matter-clothing,News,"starbucks  said friday that employees will be allowed to wear clothing and accessories in support of black lives matter, responding to a backlash and boycott calls after the coffee chain banned staff from wearing their own t-shirts and pins supporting the movement.",True,False,False,False,False,False,False,False
the-day-bristol-dumped-its-hated-slave-trader-in-the-docks-and-a-nation-began-to-search-its-soul,article,uk-news,2020-06-14,the day bristol toppled colston – and a nation began to search its soul,https://www.theguardian.com/uk-news/2020/jun/14/the-day-bristol-dumped-its-hated-slave-trader-in-the-docks-and-a-nation-began-to-search-its-soul,News,"after the statue of 17th-century slave trader edward colston was hauled to the ground last weekend, a series of black bristolians clambered on his empty plinth and spoke from the heart about racism and the struggle for equality in the city and beyond.",False,False,False,False,False,False,False,False
black-lives-matter-sports-underlying-failure-racism,article,sport,2020-06-13,black lives matter has exposed sport's underlying  failure to deal with racism | jonathan liew,https://www.theguardian.com/sport/2020/jun/13/black-lives-matter-sports-underlying-failure-racism,Sport,"the premier league has decided that next week, black lives will matter. or at least, it has decreed – at the behest of several club captains – that for the opening round of fixtures when the season resumes next week,  the phrase “black lives matter” can be borne on players’ shirts, in place of their names. it hasn’t formally decided whether black lives will matter beyond next week or for the rest of the season. but rest assured it will be consulting key stakeholders and making an announcement in due course.",True,False,False,False,False,False,False,False
being-black-public-spaces-outdoors-perils-christian-cooper,article,commentisfree,2020-06-03,the perils of being black in public: we are all christian cooper and george floyd | carolyn finney,https://www.theguardian.com/commentisfree/2020/jun/03/being-black-public-spaces-outdoors-perils-christian-cooper,Opinion,"in the summer of 1997, i lived in seattle. i worked at a temp job while preparing to start my master’s degree in the fall. i was walking to a bus stop after a day at the office, when i stepped into a pothole on the street and heard my ankle crack.",False,False,False,True,False,False,False,False
trayvon-martin-oscar-grant-tamir-rice-police-killings-protest,article,us-news,2020-06-08,families of trayvon martin and oscar grant on protests: 'white supremacy is on its way out',https://www.theguardian.com/us-news/2020/jun/08/trayvon-martin-oscar-grant-tamir-rice-police-killings-protest,News,“i am enraged. i am on fire.”,False,False,False,False,False,False,False,False
george-floyd-killing-police-arrest-non-violent-protesters,article,us-news,2020-06-08,"‘they set us up’: us police arrested over 10,000 protesters, many non-violent",https://www.theguardian.com/us-news/2020/jun/08/george-floyd-killing-police-arrest-non-violent-protesters,News,"since george floyd’s death at the hands of police in minneapolis, minnesota, on 25 may,trong> trong> about 140 cities in  all 50 states throughout the us have seen protests and demonstrations in response to the killing.",False,False,False,False,False,False,False,False
black-lives-matter-surprise-supporters-mitt-romney-gushers-elmo,article,world,2020-06-11,gushers? witches? and ... mitt romney? the surprise coalition backing black lives matter,https://www.theguardian.com/us-news/2020/jun/11/black-lives-matter-surprise-supporters-mitt-romney-gushers-elmo,News,"the protests over george floyd’s death are unprecedented for a number of reasons – their size, their duration, their impact. but what’s also unprecedented is their diversity, and not just along the lines of race or geography.",True,False,False,False,False,False,False,False
minneapolis-city-council-defund-police-george-floyd,article,us-news,2020-06-08,minneapolis lawmakers vow to disband police department in historic move,https://www.theguardian.com/us-news/2020/jun/07/minneapolis-city-council-defund-police-george-floyd,News,"the minneapolis city council has pledged to disband the city’s police department and replace it with a new system of public safety, a historic move that comes as calls to  defund law enforcement are sweeping the us.",False,False,False,False,False,False,False,False
police-marching-with-protesters-george-floyd-reform,article,us-news,2020-06-02,police marching with protesters: how some cities got it right and others didn't,https://www.theguardian.com/us-news/2020/jun/02/police-marching-with-protesters-george-floyd-reform,News,"when larry hamm, a veteran activist with people’s organization for progress, kicked off last weekend’s protest in newark, new jersey, he asked the crowd what they wanted. the majority – though not all – said they wanted a peaceful protest.",False,False,False,False,False,False,False,False
clergy-priests-attacked-police-washington-dc-st-john-church-trump-photo-op,article,us-news,2020-06-02,'they turned holy ground into a battleground': clergy teargassed by washington police,https://www.theguardian.com/us-news/2020/jun/02/clergy-priests-attacked-police-washington-dc-st-john-church-trump-photo-op,News,"episcopal clergy linked to st john’s church in washington dc were among the peaceful protesters violently swept out of the way by police so that donald trump could pose in front of the building on monday evening, and they have condemned the us president’s behavior.",False,False,False,False,False,False,False,False
nigerian-president-criticised-over-response-to-protests-crackdown,article,world,2020-10-22,nigerian president criticised over response to protests crackdown,https://www.theguardian.com/world/2020/oct/22/nigerian-president-criticised-over-response-to-protests-crackdown,News,"nigeria’s president, muhammadu buhari, has called for an end to nationwide demonstrations against police brutality, but failed to directly mention the fatal shooting of peaceful protesters.",False,False,False,False,False,False,False,False
defunding-the-police-us-what-does-it-mean,article,us-news,2020-06-06,what does 'defund the police' mean? the rallying cry sweeping the us – explained,https://www.theguardian.com/us-news/2020/jun/05/defunding-the-police-us-what-does-it-mean,News,"the call to “defund the police” has  become a rallying cry at protests across america this week, and some lawmakers appear to be listening.",False,False,False,False,False,False,False,False
manuel-ellis-death-police-firing-mayor-victoria-woodards,article,us-news,2020-06-05,manuel ellis killing: mayor calls for firing of officers involved in death of black man,https://www.theguardian.com/us-news/2020/jun/05/manuel-ellis-death-police-firing-mayor-victoria-woodards,News,"the mayor of tacoma, washington, has called for the police officers involved in the  death of an african american man in march to be fired and prosecuted after cellphone footage surfaced of him being beaten while lying on the ground.",False,False,False,False,False,False,False,False
donald-trump-protests-george-floyd-dominate,article,us-news,2020-06-01,angry donald trump calls on governors to 'dominate' george floyd protests,https://www.theguardian.com/us-news/2020/jun/01/donald-trump-protests-george-floyd-dominate,News,"donald trump has urged us governors and law enforcement officials to take a more forceful approach in responding to protests sparked by the death of  george floyd, an african american man who pleaded for air as a white minneapolis police officer pressed his knee against his neck for several minutes.",False,False,False,True,False,False,False,False
george-floyd-killing-memorial-service-protests,article,us-news,2020-06-06,george floyd killing: hundreds of thousands turn out for huge protests across us,https://www.theguardian.com/us-news/2020/jun/06/george-floyd-killing-memorial-service-protests,News,hundreds of thousands of demonstrators marched in cities across the united states on saturday in what were some of the largest protests yet seen in the unrest triggered by the killing of george floyd by a white minneapolis police officer.,False,False,False,True,False,False,False,False
bob-kroll-george-floyd-minneapolis-police-union-chief,article,us-news,2020-06-01,anger as local police union chief calls george floyd a 'violent criminal',https://www.theguardian.com/us-news/2020/jun/01/bob-kroll-george-floyd-minneapolis-police-union-chief,News,"the president of the minneapolis police union has written to its members calling george floyd a “violent criminal”, describing those protesting over his death as terrorists and criticizing the city’s political leadership for not authorizing greater use of force to stop the rioting.",False,False,False,True,False,False,False,False
george-floyd-death-minneapolis-police-chief-medaria-arradondo-officers-complicit,article,us-news,2020-06-01,minneapolis police chief: all four officers ‘complicit’ in george floyd's death,https://www.theguardian.com/us-news/2020/jun/01/george-floyd-death-minneapolis-police-chief-medaria-arradondo-officers-complicit,News,"the chief of minneapolis police spoke directly to the brother of george floyd on sunday night,  dramatically cutting into a tv interview to say “all four officers” involved in floyd’s death were “complicit”, though only one has been charged with murder.",False,False,False,True,False,False,False,False
premier-league-issues-restart-rules-with-no-spitting-or-crowding-officials,article,football,2020-06-15,premier league issues restart rules with no spitting or crowding officials,https://www.theguardian.com/football/2020/jun/15/premier-league-issues-restart-rules-with-no-spitting-or-crowding-officials,Sport,"premier league players have been told not to spit, clear their nose or surround match officials when the season restarts, and will be directed towards a “celebration camera” after scoring in closed-doors matches.",False,False,False,False,False,False,False,False
trump-military-retired-general-john-allen-protest,article,us-news,2020-06-04,'slide to illiberalism': ex-general joins chorus of condemnation of trump,https://www.theguardian.com/us-news/2020/jun/04/trump-military-retired-general-john-allen-protest,News,the retired marine general who led the global coalition against isis and commanded us forces in afghanistan has warned that donald trump’s actions this week could start a us “ slide into illiberalism” and the beginning of the end of “the american experiment”.,False,False,False,False,False,False,False,False
angela-davis-on-george-floyd-as-long-as-the-violence-of-racism-remains-no-one-is-safe,article,us-news,2020-06-15,angela davis: ‘we knew the role of the police was to protect white supremacy’,https://www.theguardian.com/us-news/2020/jun/15/angela-davis-on-george-floyd-as-long-as-the-violence-of-racism-remains-no-one-is-safe,News,"it is 1972, and angela davis is answering a question about whether she approves of the use of violence by  the black panthers. she is sitting against a backdrop of powder-blue breeze blocks, the walls of a california state prison cell. dressed in a red turtleneck, with her  signature afro and a lit cigarette, she stares at the swedish interviewer – almost straight through him – as she delivers her reply: “you ask me whether i approve of violence? that just doesn’t make any sense at all. whether i approve of guns? i grew up in birmingham, alabama. some very, very good friends of mine were killed by bombs – bombs that were planted by racists. i remember, from the time i was very small, the sound of bombs exploding across the street and the house shaking … that’s why, when someone asks me about violence, i find it incredible because it means the person asking that question has absolutely no idea what black people have gone through and experienced in this country from the time the first black person was kidnapped from the shores of africa.”",False,False,False,False,False,False,False,False
american-police-violence-against-black-people,article,us-news,2020-06-04,us police have a history of violence against black people. will it ever stop?,https://www.theguardian.com/us-news/2020/jun/04/american-police-violence-against-black-people,News,"in ferguson, missouri, mike brown’s body lay lifeless on the street for four hours after he was shot dead by a white officer.  witnesses described him holding his hands up in surrender before he was killed.",False,False,False,False,False,False,False,False
un-human-rights-monitors-us-modern-racial-terror-lynchings,article,world,2020-06-05,un experts condemn modern-day ‘racial terror’ lynchings in us,https://www.theguardian.com/world/2020/jun/05/un-human-rights-monitors-us-modern-racial-terror-lynchings,News,a group of 66 united nations human rights monitors have issued a devastating critique of what they call modern-day “racial terror” lynchings in the us in the form of state-sponsored police violence against black americans.,False,False,False,False,False,False,False,False
watch-police-shows-black-lives-matter,article,commentisfree,2020-06-12,how to watch police shows in the age of black lives matter | elias rodriques,https://www.theguardian.com/commentisfree/2020/jun/12/watch-police-shows-black-lives-matter,Opinion,"in a 2017 episode of  brooklyn nine-nine, the acclaimed police comedy show, sergeant terry jeffords (played by terry crews) is racially profiled while walking in his own neighbourhood. he later tells his captain, raymond holt (played by andre braugher), who is also black, that he wants to lodge a complaint. captain holt responds that he should not; doing so will make it difficult for him to advance in the nypd, which comes with the prospect of making an even bigger change. this is also the route, holt explains, that he took: he endured years of abuse as the only black, gay detective to become police captain so that he might make the nypd less racist and anti-queer. in either case, the culprit is clear: racism in the nypd. the solution is equally clear: change from within.",True,False,False,False,False,False,False,False
