id,type,section,date,headline,url,category,lead_paragraph,Black Lives Matter,BLM,Police Brutality,George Floyd,Breonna Taylor,Tyrel Nichols,Ahmaud Abery,Blue Lives Matter
aid-spending-in-africa-must-be-african-led-it-needs-a-black-lives-matter-reckoning,article,global-development,2021-01-11,aid spending in africa must be african-led – it needs a black lives matter reckoning | dedo baranshamaje and katie bunten-wamaru,https://www.theguardian.com/global-development/2021/jan/11/aid-spending-in-africa-must-be-african-led-it-needs-a-black-lives-matter-reckoning,News,"while the us continues to reckon with its long-simmering struggle against racial injustice, it is important to remember that racism is not just a homegrown problem – we are also exporting it.",True,False,False,False,False,False,False,False
george-floyd-protests-can-trump-deploy-federal-troops-onto-the-streets-in-the-us,article,us-news,2020-06-02,george floyd protests: can trump deploy federal troops on to the streets in the us?,https://www.theguardian.com/us-news/2020/jun/02/george-floyd-protests-can-trump-deploy-federal-troops-onto-the-streets-in-the-us,News,us president donald trump has  threatened to deploy the united states military to american cities to quell civil unrest in the wake of george floyd’s death.,False,False,False,True,False,False,False,False
tucker-carlson-kenosha-shooting-teen-kyle-rittenhouse,article,media,2020-08-27,tucker carlson defends actions of teen charged in killings of kenosha protesters,https://www.theguardian.com/media/2020/aug/26/tucker-carlson-kenosha-shooting-teen-kyle-rittenhouse,News,"the rightwing fox news host tucker carlson has defended the actions of a 17-year-old who was arrested and charged with murder after two people were killed in kenosha,  wisconsin, as white vigilante agitators shot at black lives matter protesters.",False,False,False,False,False,False,False,False
olivette-otele-discussions-of-cancel-culture-are-very-middle-class-activists-just-survive-and-support-each-other,article,books,2020-10-16,olivette otele: 'discussions of cancel culture are very middle class. activists just survive and support each other',https://www.theguardian.com/books/2020/oct/16/olivette-otele-discussions-of-cancel-culture-are-very-middle-class-activists-just-survive-and-support-each-other,Arts,"olivette otele is the quintessential african european. she was born in cameroon, grew up in france where she received her education, and now lives in wales. in 2018, she became the uk’s first black female history professor, and this she year was included in the  “100 great black britons” list. when  edward colston’s statue was torn down and dragged into bristol’s harbour, otele, who teaches the history of slavery at the university of bristol, could not have been better placed to witness and process the moment.",False,False,False,False,False,False,False,False
derek-chauvin-trial-george-floyd-death-absolutely-preventable-doctor-testifies,article,us-news,2021-04-12,"derek chauvin trial: george floyd was ‘a person everybody loved’, brother says",https://www.theguardian.com/us-news/2021/apr/12/derek-chauvin-trial-george-floyd-death-absolutely-preventable-doctor-testifies,News,"george floyd’s younger brother, philonise floyd, took the stand on monday in the trial of the former police officer accused of murdering him and told the jury how george floyd was “a person that everybody loved around the community”.",False,False,False,True,False,False,False,False
uk-police-officer-denies-sending-offensive-george-floyd-meme,article,uk-news,2021-01-28,uk police officer denies sending offensive george floyd meme,https://www.theguardian.com/uk-news/2021/jan/28/uk-police-officer-denies-sending-offensive-george-floyd-meme,News,a police sergeant has denied a charge of sending a grossly offensive meme of george floyd to colleagues in a whatsapp group.,False,False,False,True,False,False,False,False
george-floyd-trial-delayed-for-decision-on-extra-charge,article,us-news,2021-03-08,derek chauvin murder trial delayed for decision on extra charge,https://www.theguardian.com/us-news/2021/mar/08/george-floyd-trial-delayed-for-decision-on-extra-charge,News,the judge overseeing the trial of a former minneapolis police officer accused of murdering george floyd delayed the start of jury selection on monday for at least a day while an appeal proceeds over the possible reinstatement of an additional charge.,False,False,False,False,False,False,False,False
blm-activist-sasha-johnson-in-critical-condition-after-gunshot-to-the-head,article,world,2021-05-23,sasha johnson: blm activist in critical condition after gunshot to the head,https://www.theguardian.com/world/2021/may/23/blm-activist-sasha-johnson-in-critical-condition-after-gunshot-to-the-head,News,"the black lives matter activist sasha johnson is in a critical condition after sustaining a gunshot wound to her head in an incident in south london, her affiliated group, taking the initiative party, has announced on social media.",False,True,False,False,False,False,False,False
i-grew-up-not-knowing-my-african-heritage-but-now-i-feel-a-calling,article,commentisfree,2020-10-13,i grew up not knowing my african heritage. but now i feel a calling | florence boafo,https://www.theguardian.com/commentisfree/2020/oct/13/i-grew-up-not-knowing-my-african-heritage-but-now-i-feel-a-calling,Opinion,"growing up, i envied those who understood their mother’s native language. speaking it was admirable, but the very act of comprehension was a beautiful thing to witness. from afar it seemed like a love language, something intimate and secretive spoken between families – it suggested a bond, a closeness that seemed impenetrable.",False,False,False,False,False,False,False,False
the-spin-awards-a-biosecure-summer-of-unsung-heroes-like-no-other,article,sport,2020-09-22,the spin awards: a biosecure summer of unsung heroes like no other | tim de lisle,https://www.theguardian.com/sport/2020/sep/22/the-spin-awards-a-biosecure-summer-of-unsung-heroes-like-no-other,Sport,"at first, after the unbeatable thrills of 2019, the men’s international cricket season of 2020 looked like being an anticlimax. then, as one nation after another locked down, it looked like not happening at all. next, it looked like happening after a fashion but being too weird to cast a spell. and finally, it happened, without a hitch, and with many a magic moment. now was our easter of discontent made glorious summer.",False,False,False,False,False,False,False,False
sydney-black-lives-matter-protest-organisers-say-blm-rally-will-proceed-despite-pm-and-premiers-condemnation,article,australia-news,2020-07-22,sydney black lives matter protest organisers say rally will proceed despite pm and premier's condemnation,https://www.theguardian.com/australia-news/2020/jul/22/sydney-black-lives-matter-protest-organisers-say-blm-rally-will-proceed-despite-pm-and-premiers-condemnation,News,organisers of a black lives matter protest planned for sydney next week say the demonstration will go ahead despite both the prime minister and  new south wales premier demanding it be cancelled.,True,False,False,False,False,False,False,False
donald-trump-national-garden-american-heroes-statues,article,us-news,2021-01-18,trump orders creation of 'garden of american heroes' amid backlash over monuments,https://www.theguardian.com/us-news/2021/jan/18/donald-trump-national-garden-american-heroes-statues,News,"heading out of office in a blur of insurrection, mass deaths due to a pandemic, scandal and lies, donald trump on monday issued  an executive order directing the building of a national garden of american heroes, “to reflect the awesome splendour of our country’s timeless exceptionalism”.",False,False,False,False,False,False,False,False
restaurateur-chef-cook-campaigner-what-2020-taught-us,article,food,2020-12-06,"a restaurateur, a radical chef and a cook-turned-campaigner: ‘what 2020 has taught us’",https://www.theguardian.com/food/2020/dec/06/restaurateur-chef-cook-campaigner-what-2020-taught-us,Lifestyle,"m>owner, lunya restaurant and deli, liverpoolm>",False,False,False,False,False,False,False,False
derek-chauvin-trial-minneapolis-george-floyd-protesters,article,us-news,2021-04-08,the protesters who gather every day to demand justice for george floyd,https://www.theguardian.com/us-news/2021/apr/08/derek-chauvin-trial-minneapolis-george-floyd-protesters,News,"behind the hennepin county courthouse in downtown minneapolis, which is heavily fortified for the  murder trial of derek chauvin, a small but determined core of seven protesters gathers every day.",False,False,False,True,False,False,False,False
injured-boy-stopped-and-searched-by-met-officer-he-asked-for-help,article,world,2020-07-01,injured boy 'stopped and searched' by met officer he asked for help,https://www.theguardian.com/world/2020/jul/01/injured-boy-stopped-and-searched-by-met-officer-he-asked-for-help,News,"rights groups have criticised police after a boy of 16, attacked by far-right opponents of a black lives matter demonstration in london, said he was stopped and searched by the policeman he had asked for help.",False,False,False,False,False,False,False,False
la-haine-review-effervescent-classic-radiates-with-rage-and-comedy,article,film,2020-09-11,la haine review – effervescent classic radiates with rage and comedy,https://www.theguardian.com/film/2020/sep/11/la-haine-review-effervescent-classic-radiates-with-rage-and-comedy,Arts,"m athieu kassovitz’s classic of banlieue rage has been rereleased after 25 years with a new urgency and relevance in the black lives matter era. what comes across now isn’t the “hate” of the title, more the aimless, directionless comedy of three guys hanging around, bantering and squabbling about things such as which cartoon character is the most badass. it is touches like this which make you realise how very 90s it all is, similar to tarantino and trainspotting (with a nod to taxi driver’s “ you talkin’ to me?” scene) but it also has a little something of the french new wave, the world of jacques rivette’s paris belongs to us, all of which influenced the later americans. it’s a film about which i’ve had fluctuating views. perhaps as a result of having watched it so much, i greeted the 10th-anniversary rerelease with some grumpy contrarianism. now i think it simply looks superb.",False,False,False,False,False,False,False,False
labour-criticises-pm-silence-on-equalities-review-boris-johnson-black-lives-matter-protests,article,inequality,2020-07-13,labour criticises pm's silence on promised equalities review,https://www.theguardian.com/inequality/2020/jul/13/labour-criticises-pm-silence-on-equalities-review-boris-johnson-black-lives-matter-protests,News,"labour has questioned why the government has not yet revealed who will chair an equalities review, a month after it was announced by boris johnson as a response to the black lives matter movement.",False,False,False,False,False,False,False,False
greek-pm-appeals-for-peace-after-police-brutality-ignites-riots,article,world,2021-03-10,greek pm appeals for peace after police brutality ignites riots,https://www.theguardian.com/world/2021/mar/10/greek-pm-appeals-for-peace-after-police-brutality-ignites-riots,News,"the greek government, put on the defensive by mounting allegations of police brutality, has appealed for calm following clashes on the streets of athens, mass protests and growing anger over the country’s prolonged lockdown.",False,False,False,False,False,False,False,False
breonna-taylor-louisville-state-of-emergency-grand-jury-decision,article,us-news,2020-09-22,louisville declares state of emergency ahead of breonna taylor decision,https://www.theguardian.com/us-news/2020/sep/22/breonna-taylor-louisville-state-of-emergency-grand-jury-decision,News,"a state of emergency was declared in louisville, kentucky, in anticipation of protests following an imminent grand jury decision on the police killing of breonna taylor.",False,False,False,False,True,False,False,False
kenosha-protesters-killed-who-were-they-anthony-huber-joseph-rosenbaum,article,us-news,2020-08-27,a father and a 26-year-old skateboarder: the protesters killed in kenosha,https://www.theguardian.com/us-news/2020/aug/27/kenosha-protesters-killed-who-were-they-anthony-huber-joseph-rosenbaum,News,the two men shot dead when white armed extremists disrupted a black lives matter protest and at least one agitator opened fire on a group of protesters in kenosha have been identified.,False,False,False,False,False,False,False,False
semi-truck-drives-through-crowd-of-protesters-on-minneapolis-bridge,article,us-news,2020-06-01,truck drives through crowd of protesters on minneapolis bridge,https://www.theguardian.com/us-news/2020/may/31/semi-truck-drives-through-crowd-of-protesters-on-minneapolis-bridge,News,a fuel semi-truck drove into a george floyd demonstration of thousands of people on a bridge in minneapolis apparently without seriously injuring anyone.,False,False,False,False,False,False,False,False
uk-police-officer-charged-offensive-george-floyd-meme,article,uk-news,2021-01-21,uk police officer charged over offensive george floyd meme,https://www.theguardian.com/uk-news/2021/jan/21/uk-police-officer-charged-offensive-george-floyd-meme,News,a police officer has been charged with a criminal offence for allegedly sending a grossly offensive meme of george floyd to colleagues in a whatsapp group.,False,False,False,True,False,False,False,False
breonna-taylor-black-women-history-progress,article,commentisfree,2020-10-01,"these days, having hope as a black woman can be hard. but history shows progress is possible | shanita hubbard",https://www.theguardian.com/commentisfree/2020/oct/01/breonna-taylor-black-women-history-progress,Opinion,"on 24 september, a kentucky grand jury delivered an unsurprising verdict: breonna taylor’s killers would walk free. the frequency of black killings at the hands of police does not lessen the severity of the pain, it deepens the wound.",False,False,False,False,False,False,False,False
thursday-briefing-10000-excess-deaths-at-home-since-june,article,world,2020-09-24,"thursday briefing: 10,000 excess deaths at home since june",https://www.theguardian.com/world/2020/sep/24/thursday-briefing-10000-excess-deaths-at-home-since-june,News,"good morning and welcome to this thursday briefing with me, alison rourke.",False,False,False,False,False,False,False,False
los-angeles-police-george-floyd-protests-review,article,us-news,2021-03-12,independent review criticizes la police for handling of george floyd protests,https://www.theguardian.com/us-news/2021/mar/11/los-angeles-police-george-floyd-protests-review,News,"the los angeles police department has been criticised over its handling of the widespread protests that broke out over the summer after the death of george floyd, with an independent review finding that poor planning led to chaos and mass arrests.",False,False,False,True,False,False,False,False
the-guardian-view-on-the-of-george-floyd-a-racial-reckoning-begins,article,commentisfree,2021-04-21,the guardian view on the murder of george floyd: a racial reckoning begins | editorial,https://www.theguardian.com/commentisfree/2021/apr/21/the-guardian-view-on-the-of-george-floyd-a-racial-reckoning-begins,Opinion,"the relief that swept through the crowd outside the minneapolis court, and rippled around the world, was in its own way shocking. the conviction of derek chauvin  href=""https://www.theguardian.com/us-news/2021/apr/20/derek-chauvin-verdict-guilty-murder-george-floyd"" title="""">for george floyd’s murder should have been inevitable. the sight of the policeman kneeling upon the 46-year-old’s neck for nine minutes and 29 seconds, as the dying man  href=""https://www.theguardian.com/us-news/2020/jul/08/george-floyd-police-killing-transcript-i-cant-breathe"" title="""">pleaded repeatedly that he couldn’t breathe and called out to his late mother, was caught on camera, described by traumatised witnesses, and condemned by fellow officers during the trial.",False,False,False,True,False,False,False,False
wave-rightwing-republicans-run-office-trump-blessing-extremist,article,us-news,2020-08-24,"wave of extremist republicans run for office, many with trump's blessing",https://www.theguardian.com/us-news/2020/aug/24/wave-rightwing-republicans-run-office-trump-blessing-extremist,News,"when donald trump congratulated laura loomer, an islamophobe and conspiracy theorist, on her  republican congressional primary victory this week, it seemed to bring the president’s version of the republican party full-circle to the start of his rise.",False,False,False,False,False,False,False,False
first-thing-derek-chauvin-supervisor-says-his-force-against-george-floyd-was-unnecessary,article,us-news,2021-04-02,chauvin’s supervisor says his force against george floyd was unnecessary | first thing,https://www.theguardian.com/us-news/2021/apr/02/first-thing-derek-chauvin-supervisor-says-his-force-against-george-floyd-was-unnecessary,News,good morning.,False,False,False,True,False,False,False,False
harlequins-sale-premiership-rugby-restart,article,sport,2020-08-14,marcus smith puts gloss on rugby's ragged return as harlequins beat sale,https://www.theguardian.com/sport/2020/aug/14/harlequins-sale-premiership-rugby-restart,Sport,"english rugby is back, albeit with more of a clunk than a bang, but after five long months we must gratefully accept what we are given. harlequins will not care that the rust from both sides was all too evident, nor that the penalty count kept good pace with the number of errors, and even eddie jones might have gone home happy with the mature performance of the home fly-half marcus smith.",False,False,False,False,False,False,False,False
shocking-lack-of-racial-diversity-and-women-in-uk-journalism-report,article,world,2020-09-17,bbc newsnight accused over failure to interview any bame guests for a week,https://www.theguardian.com/world/2020/sep/17/shocking-lack-of-racial-diversity-and-women-in-uk-journalism-report,News,"bbc newsnight went an entire week without featuring a single live interview with a guest from a minority ethnic background, according to an analysis of national media output.",False,False,False,False,False,False,False,False
the-best-childrens-books-of-2020-for-all-ages,article,books,2020-12-13,the best children's books of 2020 for all ages,https://www.theguardian.com/books/2020/dec/13/the-best-childrens-books-of-2020-for-all-ages,Arts,"as  covid-19 tightened its grip in march, forcing schools, bookshops and libraries to close, so the children’s book world responded in characteristically generous style, producing an explosion of free online content to educate, entertain and support children and families.  julia donaldson and axel scheffler created a series of covid-related cartoons featuring beloved characters (“the gruffalos stayed in the gruffalo cave’”) and children’s laureate cressida cowell read daily chapters of m> how to train your dragonm>. picture book creator rob biddulph became a viral phenomenon thanks to his m> draw with robm> videos, culminating in no less than a guinness world record for the largest online art class when 45,611 people joined him in drawing a whale. a whole new covid category of children’s books was born, both instructional and inspirational. there was m> coronavirus: a book for children about covid-19m> (nosy crow), m> while we can’t hugm> by eoin mclaughlin and polly dunbar (faber), and a slew of rainbow-hued picture books. health workers were celebrated in m> the hospital dogm> by julia donaldson and sara ogilvie (macmillan) while  captain tom moore’s record-breaking fundraiser for the nhs became the m> one hundred stepsm> picture book (puffin), illustrated by adam larkum. and although not written in response to the pandemic, maggie o’farrell weaves resilience and bravery into her elegant debut picture book, m> where snow angels gom> (walker), an unforgettable winter adventure with illustratrions by daniela jaglenka terrazzini.",False,False,False,False,False,False,False,False
system-rigged-seun-kuti-reviving-fela-political-party-nigeria,article,world,2021-01-19,'the system is rigged': seun kuti on reviving fela's political party,https://www.theguardian.com/world/2021/jan/19/system-rigged-seun-kuti-reviving-fela-political-party-nigeria,News,"“for 60 years nothing has really been solved in this country,” seun kuti says. “healthcare, education, electricity, transportation, welfare – nothing has been accomplished.”",False,False,False,False,False,False,False,False
first-thing-police-did-not-let-bystanders-help-george-floyd-court-hears,article,us-news,2021-03-31,"police did not let bystanders help george floyd, court hears | first thing",https://www.theguardian.com/us-news/2021/mar/31/first-thing-police-did-not-let-bystanders-help-george-floyd-court-hears,News,good morning.,False,False,False,True,False,False,False,False
racism-doesnt-dissolve-once-its-out-of-the-headlines-is-the-fashion-industry-doing-enough-to-address-diversity,article,fashion,2020-12-21,‘racism doesn’t dissolve once it’s out of the headlines’: is the fashion industry doing enough to address diversity?,https://www.theguardian.com/fashion/2020/dec/21/racism-doesnt-dissolve-once-its-out-of-the-headlines-is-the-fashion-industry-doing-enough-to-address-diversity,Lifestyle,"this month, fashion’s unofficial watchdog,  diet prada, posted a  “how it started versus how it’s going” meme on instagram. contrasting a past moment of hope with a current moment of reckoning, diet prada turned its attention to the us clothing and homeware store anthropologie.",False,False,False,False,False,False,False,False
mps-demand-review-of-national-curriculum-led-by-black-leaders,article,politics,2020-06-10,"mps demand review of national curriculum, led by black leaders",https://www.theguardian.com/politics/2020/jun/10/mps-demand-review-of-national-curriculum-led-by-black-leaders,News,mps are demanding the government holds a review of the national curriculum led by black and ethnic minority leaders and historians to better reflect black history.,False,False,False,False,False,False,False,False
george-floyd-life-biography,article,us-news,2021-04-20,the life of george floyd: ‘he knew how to make people feel better’,https://www.theguardian.com/us-news/2021/apr/20/george-floyd-life-biography,News,george floyd’s loved ones said  at his funeral on 9 june last year that his tragic killing at the hands of police was “going to change the world”.,False,False,False,True,False,False,False,False
george-floyd-family-activists-murder-trial-derek-chauvin,article,us-news,2021-03-29,‘america is on trial’: george floyd family and activists gather outside courthouse,https://www.theguardian.com/us-news/2021/mar/29/george-floyd-family-activists-murder-trial-derek-chauvin,News,members of george floyd’s family along with the civil rights attorney ben crump and the campaigner al sharpton gathered and knelt in front of the courthouse in minneapolis on monday morning as the murder trial began of former police officer derek chauvin.,False,False,False,True,False,False,False,False
revealed-weak-rules-allow-the-worlds-largest-police-forces-to-kill,article,us-news,2021-03-11,how laws allow the world's largest police departments to use lethal force,https://www.theguardian.com/global-development/2021/mar/11/revealed-weak-rules-allow-the-worlds-largest-police-forces-to-kill,News,"police departments in major cities across the world give their officers legal impunity to use lethal force even when their lives are not in danger, according to new research commissioned by the guardian.",False,False,False,False,False,False,False,False
biden-george-floyd-family-anniversary-of-murder,article,us-news,2021-05-25,george floyd family urges biden to pass police reform bill as it stalls in senate,https://www.theguardian.com/us-news/2021/may/25/biden-george-floyd-family-anniversary-of-murder,News,"“say his name,” said seven-year-old gianna floyd. in bright sunshine outside the west wing of the white house, family members and lawyers raised their fists and said her father’s name in chorus: “george floyd!”",False,False,False,True,False,False,False,False
derek-chauvin-trial-george-floyd-defense,article,us-news,2021-04-14,derek chauvin trial: defense claims bad heart and drug use killed george floyd,https://www.theguardian.com/us-news/2021/apr/14/derek-chauvin-trial-george-floyd-defense,News,a leading forensic pathologist has told the derek chauvin trial that george floyd was killed by his heart condition and drug use.,False,False,False,True,False,False,False,False
the-family-whose-black-lives-matter-sign-shook-their-conservative-town,article,us-news,2020-09-28,the family whose black lives matter sign shook their conservative town,https://www.theguardian.com/us-news/2020/sep/28/the-family-whose-black-lives-matter-sign-shook-their-conservative-town,News,"the hamlet of white sulphur springs, two hours north-west of new york city, tumbles toward the rolling foothills of the catskill mountains off new york state route 52 in rural, verdant sullivan county. the first white settlers, drawn by the dense hemlock forest, set up sawmills; later, dairy farms and tanneries were the area’s main economic drivers. but now and for the past hundred or so years, this bucolic wedge of new york countryside relies on tourism.",True,False,False,False,False,False,False,False
