id,type,section,date,headline,url,category,lead_paragraph,Black Lives Matter,BLM,Police Brutality,George Floyd,Breonna Taylor,Tyrel Nichols,Ahmaud Abery,Blue Lives Matter
rayshard-brooks-atlanta-police-shooting-black-man-protests-trump-politics-latest-live,liveblog,us-news,2020-06-14,trump claims 'radical left' have 'taken over' seattle during policing protests – as it happened,https://www.theguardian.com/us-news/live/2020/jun/14/rayshard-brooks-atlanta-police-shooting-black-man-protests-trump-politics-latest-live,News,"class=""block-time published-time""> ime datetime=""2020-06-14t22:08:26.472z"">11.08pm pan class=""timezone"">bstpan>ime>",False,False,False,False,False,False,False,False
congress-police-reform-republican-bill-democrats,article,us-news,2020-06-24,democrats block 'empty' republican police reform bill,https://www.theguardian.com/us-news/2020/jun/24/congress-police-reform-republican-bill-democrats,News,congress was at a standstill on police reform on wednesday after senate democrats successfully blocked a republican bill criticized as a toothless response to police brutality.,False,False,False,False,False,False,False,False
why-antiracist-protests-are-achieving-more-progress-under-trump-than-obama,article,commentisfree,2020-06-18,why antiracism protests are achieving more progress under trump than obama | cas mudde,https://www.theguardian.com/commentisfree/2020/jun/18/why-antiracist-protests-are-achieving-more-progress-under-trump-than-obama,Opinion,"the us is now in its fourth week of mass protests against institutional racism and police brutality. substantive debates about police reform – including formerly radical proposals to “ defund the police” – have entered the mainstream political discussion and in some cases already achieved  political traction. while it is still early, and history is a warning against too much optimism, it seems clear that the protests in the wake of the brutal murder of george floyd are producing more, and more concrete, results than similar recent protests did.",False,False,False,False,False,False,False,False
us-coronavirus-deaths-trump-republicans-relief-bill-portland-oregon-protests-agents-latest-news-live-updates,liveblog,world,2020-07-26,"coronavirus us: polls put biden ahead of trump as deaths top 1,000 a day – as it happened",https://www.theguardian.com/world/live/2020/jul/26/us-coronavirus-deaths-trump-republicans-relief-bill-portland-oregon-protests-agents-latest-news-live-updates,News,"class=""block-time published-time""> ime datetime=""2020-07-26t21:49:41.562z"">10.49pm pan class=""timezone"">bstpan>ime>",False,False,False,False,False,False,False,False
the-day-bristol-woke-up-to-a-new-statue,article,uk-news,2020-07-15,the day bristol woke up to a new statue,https://www.theguardian.com/world/2020/jul/15/the-day-bristol-woke-up-to-a-new-statue,News,"when bristol went to bed on tuesday night, the question was theoretical: what should replace the toppled statue of the slave trader edward colston?",False,False,False,False,False,False,False,False
reality-v-donald-trump-inside-the-3-july-edition-of-the-guardian-weekly,article,news,2020-07-01,reality v donald trump:the 3 july edition of the guardian weekly,https://www.theguardian.com/news/2020/jul/01/reality-v-donald-trump-inside-the-3-july-edition-of-the-guardian-weekly,News,"it was m>anotherm> eventful week  in the united states. on monday, the supreme court struck down a restrictive law that could have undone the landmark roe v wade abortion decision. meanwhile, it was revealed that  russia had allegedly offered bounties for attacks on us forces in afghanistan (something the president was told about in february, despite saying last weekend he hadn’t been). trong> trong>",False,False,False,False,False,False,False,False
suffocating-french-delivery-driver-cedric-chouviat-last-words-george-floyd-case,article,world,2020-06-23,‘i’m suffocating’: french delivery driver’s last words echo george floyd case,https://www.theguardian.com/world/2020/jun/23/suffocating-french-delivery-driver-cedric-chouviat-last-words-george-floyd-case,News,"a french delivery driver who died after being arrested in paris pleaded, “i’m suffocating” several times as police held him to the ground.",False,False,False,True,False,False,False,False
stocks-rise-despite-us-protests-george-floyd-and-us-china-jitters-business-live,liveblog,business,2020-06-01,stocks rise despite us-china jitters; outdoor markets open in england – business live,https://www.theguardian.com/business/blog/live/2020/jun/01/stocks-rise-despite-us-protests-george-floyd-and-us-china-jitters-business-live,News,"class=""block-time published-time""> ime datetime=""2020-06-01t14:32:29.803z"">3.32pm pan class=""timezone"">bstpan>ime>",False,False,False,False,False,False,False,False
creative-activism-inspired-by-george-floyd-death-stars-in-london-arts-festival,article,stage,2020-07-15,'creative activism' inspired by george floyd at forefront of london arts festival,https://www.theguardian.com/stage/2020/jul/15/creative-activism-inspired-by-george-floyd-death-stars-in-london-arts-festival,Arts,"artists need to engage in “creative activism” to help combat racism, according to the creators of a piece of theatre inspired by the police killing of george floyd, which will take centre stage at the first major live arts festival since the covid-19 lockdown began.",False,False,False,True,False,False,False,False
ten-years-black-twitter-watchdog,article,technology,2019-12-23,ten years of black twitter: a merciless watchdog for problematic behavior,https://www.theguardian.com/technology/2019/dec/23/ten-years-black-twitter-watchdog,News,"there is power in numbers. no internet subsection displayed this fact better than black twitter, which touched nearly every sphere of american culture and politics this decade.",False,False,False,False,False,False,False,False
a-reckoning-will-europe-face-its-colonial-past-inside-the-19-june-guardian-weekly,article,news,2020-06-17,will europe face up to its colonial past? the 19 june guardian weekly,https://www.theguardian.com/news/2020/jun/17/a-reckoning-will-europe-face-its-colonial-past-inside-the-19-june-guardian-weekly,News,"last saturday, central london was taken over by counter-protesters, largely of the far right, who descended on westminster to protect the capital’s already boarded-up statues. in the midst of daylong attacks on the police, one man was photographed  urinating next to a memorial to a police officer killed in 2017 while trying to stop an act of terrorism. it was a depressing day. yet there was a hopeful moment: the sight of black lives matter supporter patrick hutchinson rescuing a white counter-protester from a skirmish and carrying him to safety.",False,False,False,False,False,False,False,False
john-boyega-worries-blm-rally-speech-in-june-will-harm-career,article,film,2020-11-10,john boyega worries blm rally speech in june will harm career,https://www.theguardian.com/film/2020/nov/10/john-boyega-worries-blm-rally-speech-in-june-will-harm-career,Arts,john boyega has said he is genuinely worried that  his impassioned speech at a black lives matter protest in london in june will have damaging consequences for his career.,False,True,False,False,False,False,False,False
deaths-in-our-backyard-432-indigenous-australians-have-died-in-custody-since-2008,article,australia-news,2020-06-01,'deaths in our backyard': 432 indigenous australians have died in custody since 1991,https://www.theguardian.com/australia-news/2020/jun/01/deaths-in-our-backyard-432-indigenous-australians-have-died-in-custody-since-2008,News,"australia’s track record on deaths in custody is again under scrutiny, as aboriginal people whose family members died in similar circumstances to  george floyd express solidarity with protestors on the streets of major us cities following the death of the unarmed black man.",False,False,False,False,False,False,False,False
salute-blm-and-extinction-rebellion-when-they-protest-not-when-they-coerce,article,commentisfree,2020-09-06,"persuasion, not coercion, should be the goal of blm and extinction rebellion | kenan malik",https://www.theguardian.com/commentisfree/2020/sep/06/salute-blm-and-extinction-rebellion-when-they-protest-not-when-they-coerce,Opinion,"“it is never ok to coerce people’s participation; that is just bullying.”  so wrote lauren victor last week. victor is a us black lives matter supporter who has participated in many blm protests. she is also the woman who, in a video that went viral, refused to raise her fist when a group of blm supporters invaded a restaurant in washington dc and demanded that all diners do so. why did she not comply? “i wholeheartedly support the black lives matter movement,” victor wrote. “however, i also support an individual’s choice to participate in a protest or not.”",False,True,False,False,False,False,False,False
us-politics-live-john-lewis-obama-trump-biden-coronavirus-protests-latest-updates,liveblog,us-news,2020-07-18,barack obama leads tributes to civil rights leader john lewis – as it happened,https://www.theguardian.com/us-news/live/2020/jul/18/us-politics-live-john-lewis-obama-trump-biden-coronavirus-protests-latest-updates,News,"class=""block-time published-time""> ime datetime=""2020-07-18t21:37:08.873z"">10.37pm pan class=""timezone"">bstpan>ime>",False,False,False,False,False,False,False,False
sam-newman-resigns-from-channel-nine-after-comments-about-george-floyd,article,media,2020-06-19,sam newman resigns from channel nine after comments about george floyd,https://www.theguardian.com/media/2020/jun/19/sam-newman-resigns-from-channel-nine-after-comments-about-george-floyd,News,the controversial afl commentator sam newman has resigned from all channel nine television shows after a petition to sack him was widely shared on friday.,False,False,False,True,False,False,False,False
no-ban-england-fans-singing-swing-low-sweet-chariot-twickenham-rfu,article,sport,2020-10-08,"no ban on england fans singing swing low, sweet chariot at twickenham",https://www.theguardian.com/sport/2020/oct/08/no-ban-england-fans-singing-swing-low-sweet-chariot-twickenham-rfu,Sport,"england supporters will not be banned from singing swing low, sweet chariot when allowed back into twickenham but it is understood the lyrics will no longer be emblazoned around the stadium and the rugby football union has stopped selling merchandise that references the song.",False,False,False,False,False,False,False,False
trump-seattle-threats-protests-twitter-complaints,article,us-news,2020-06-11,trump complains about 'ugly anarchists' as police continue aggression on us protesters,https://www.theguardian.com/us-news/2020/jun/11/trump-seattle-threats-protests-twitter-complaints,News,"donald trump has blamed “anarchists” and “domestic terrorists” for a protest in seattle overnight and threatened to intervene as anti-racism demonstrations again erupted across much of the us, in rage at the killing of  george floyd by police in minneapolis last month.",False,False,False,False,False,False,False,False
first-thing-with-america-ablaze-trump-retreated-to-the-bunker,article,us-news,2020-06-01,"first thing: with america ablaze, trump retreated to the bunker",https://www.theguardian.com/us-news/2020/jun/01/first-thing-with-america-ablaze-trump-retreated-to-the-bunker,News,good morning.,False,False,False,False,False,False,False,False
osaka-and-gauff-should-not-be-discouraged-from-their-protests,article,sport,2020-05-31,osaka and gauff should not be discouraged from their protests | tumaini carayol,https://www.theguardian.com/sport/blog/2020/may/31/osaka-and-gauff-should-not-be-discouraged-from-their-protests,Sport,"a couple of weeks ago naomi osaka decided that it was time to eradicate her shyness once and for all. it was exhausting, she said, missing out on moments because she was too terrified to speak in the presence of people she admired. her options for socialising limited in quarantine, she set up a series of interviews with players. before long, fellow players frances tiafoe, stefanos tsitsipas, gaël monfils and iga swiatek were her subjects. “i’m coming for every tennis reporter’s neck,” she said.",False,False,False,False,False,False,False,False
texas-charles-schwab-challenge-golf-return-pga-tour,article,sport,2020-06-10,texas the stage as golf makes closed-doors return to tournament play | ewan murray,https://www.theguardian.com/sport/blog/2020/jun/10/texas-charles-schwab-challenge-golf-return-pga-tour,Sport,"in the most optimistic of outlooks, a journey which begins with ryan palmer cracking a tee shot at the colonial country club in forth worth, texas, will conclude with the crowning of a masters champion in front of adoring galleries at augusta on 15 november.",False,False,False,False,False,False,False,False
uk-protests-black-lives-matter-colston-statue-rhodes-live,liveblog,world,2020-06-09,uk protests: statue of 18th-century slave owner robert milligan taken down in london — as it happened,https://www.theguardian.com/world/live/2020/jun/09/uk-protests-black-lives-matter-colston-statue-rhodes-live,News,"class=""block-time published-time""> ime datetime=""2020-06-09t18:37:05.253z"">7.37pm pan class=""timezone"">bstpan>ime>",False,False,False,False,False,False,False,False
what-have-protests-achieved-george-floyd-death-police-funding-statues,article,us-news,2020-06-08,what the george floyd protests have achieved in just two weeks,https://www.theguardian.com/us-news/2020/jun/08/what-have-protests-achieved-george-floyd-death-police-funding-statues,News,"in the weeks since video evidence showed a police officer kneeling on the neck of george floyd, an unarmed black man, for almost nine minutes, protests have erupted across the us and the rest of the world.",False,False,False,True,False,False,False,False
covid-has-highlighted-americas-flaws-says-bank-boss-jamie-dimon,article,business,2020-10-05,"covid has highlighted america's flaws, says bank boss jamie dimon",https://www.theguardian.com/business/2020/oct/05/covid-has-highlighted-americas-flaws-says-bank-boss-jamie-dimon,News,the jp morgan boss has said the covid pandemic and the police killing of george floyd have shone a spotlight on america’s flaws and its failure to address inequality and racism.,False,False,False,False,False,False,False,False
defund-the-police-us-george-floyd-budgets,article,us-news,2020-06-04,movement to defund police gains 'unprecedented' support across us,https://www.theguardian.com/us-news/2020/jun/04/defund-the-police-us-george-floyd-budgets,News,"thetrong> trong>movement to defund the police is gaining significant support across america, including from elected leaders, as  protests over the  killing of george floyd sweep the nation.",False,False,False,False,False,False,False,False
george-floyd-protests-us-live-news-updates-donald-trump,liveblog,us-news,2020-06-04,ex-defense secretary james mattis condemns trump's handling of protests – as it happened,https://www.theguardian.com/us-news/live/2020/jun/03/george-floyd-protests-us-live-news-updates-donald-trump,News,"class=""block-time published-time""> ime datetime=""2020-06-04t10:29:39.608z"">11.29am pan class=""timezone"">bstpan>ime>",False,False,False,False,False,False,False,False
a-photo-of-my-daughter-and-me-at-a-black-lives-matter-march-made-news-this-is-my-story,article,commentisfree,2020-06-12,a photo of my daughter and me at a black lives matter march made news. this is my story | greta morton elangué,https://www.theguardian.com/commentisfree/2020/jun/12/a-photo-of-my-daughter-and-me-at-a-black-lives-matter-march-made-news-this-is-my-story,Opinion,"on monday i discovered that a photo of myself and my eight-year-old daughter has appeared in the guardian. this is a first. i work in the arts but our life is private, quietly enclosed.",True,False,False,False,False,False,False,False
roger-robinson-poets-can-translate-trauma,article,books,2020-06-13,roger robinson: 'poets can translate trauma',https://www.theguardian.com/books/2020/jun/13/roger-robinson-poets-can-translate-trauma,Arts,"roger robinson is a writer who has taught and performed worldwide. his fourth poetry collection, m>a portable paradisem>m>, m>won the royal society of literature’s ondaatje prize last month, an award for a work evoking the spirit of a place: while his previous books have focused on the memory of the caribbean, here he turns his gaze on england, unflinchingly portraying a place far from paradise as he tackles topics including the grenfell tower disaster, the windrush scandal, and the legacy of slavery. the collection also won the ts eliot prize and is shortlisted for the derek walcott prize. robinson was born in hackney in 1967 to trinidadian parents and moved to trinidad aged four, before returning to the uk at 19.",False,False,False,False,False,False,False,False
i-aint-voting-till-black-lives-matter-what-does-an-activists-radical-strategy-mean-for-2020,article,us-news,2020-04-18,'i ain't voting till black lives matter': what does an activist's radical strategy mean for 2020?,https://www.theguardian.com/us-news/2020/apr/18/i-aint-voting-till-black-lives-matter-what-does-an-activists-radical-strategy-mean-for-2020,News,death was the catalyst for walter “hawk” newsome’s most contentious idea. it came to him during the first few days of july in 2016. this was the week that a minnesota police officer shot 32-year-old philando castile  five times and killed him in his car; an off-duty new york police officer  killed 37-year-old delron dempsey in front of his family; and two louisiana cops fatally shot alton sterling  six times.,False,False,False,False,False,False,False,False
pass-over-review-spike-lee-antoinette-nwandu,article,stage,2020-06-03,pass over review – spike lee directs antoinette nwandu’s masterful tragedy,https://www.theguardian.com/stage/2020/jun/03/pass-over-review-spike-lee-antoinette-nwandu,Arts,"two homeless men in spike lee’s film who inhabit a shabby street corner fear for their lives, although there is no visible threat. they joke and banter, but terror buzzes beneath the repartee. one keeps vigil while the other sleeps. their stalkers, it becomes clear, are the police, though their purported crimes remain undefined: “we’re just two black men standing here and we ain’t doing shit.” they puzzle over the death toll of black men around them. “what his crime is?” asks one man. “breathing while black?”",False,False,False,False,False,False,False,False
he-just-doesnt-get-it-has-trump-been-left-behind-by-americas-awakening-on-racism,article,us-news,2020-06-13,'he just doesn't get it': has trump been left behind by america's awakening on racism?,https://www.theguardian.com/us-news/2020/jun/12/he-just-doesnt-get-it-has-trump-been-left-behind-by-americas-awakening-on-racism,News,"longtime observers of donald trump have often compared him to an old man sitting at the end of a bar, holding forth with crazed opinions, overwhelming self-assurance and taboo-busting shock value guaranteed to draw a crowd.",False,False,False,False,False,False,False,False
spike-lee-send-us-your-questions-for-the-director-of-do-the-right-thing,article,film,2020-06-05,spike lee: send us your questions for the director of do the right thing and malcolm x,https://www.theguardian.com/film/2020/jun/05/spike-lee-send-us-your-questions-for-the-director-of-do-the-right-thing,Arts,"for the past three decades, spike lee has been one of the most vital forces in film-making. his movies – snappy, engaged, uncompromising, entertaining, literate, disturbing – reinvigorated the cinematic landscape and shook the status quo.",False,False,False,False,False,False,False,False
george-floyd-protests-uk-anti-racism-campaign,article,uk-news,2020-06-06,george floyd protests give fresh impetus to uk anti-racism campaign,https://www.theguardian.com/uk-news/2020/jun/06/george-floyd-protests-uk-anti-racism-campaign,News,"it was the week that britain’s young people stood up against racial injustice after watching the brutal killing of george floyd, declaring in their thousands that black lives matter via a succession of passionate and largely peaceful protests that show no sign of abating.",False,False,False,True,False,False,False,False
spike-lee-race-relations-today-are-a-direct-response-to-having-a-black-president,article,film,2020-06-12,spike lee: 'race relations today are the direct result of having a black president',https://www.theguardian.com/film/2020/jun/12/spike-lee-race-relations-today-are-a-direct-response-to-having-a-black-president,Arts,"for more than three decades,  spike lee has been one of the most vital forces in film-making. his latest movie, da 5 bloods – about four african american veterans who return to vietnam in search of the remains of their squad leader –  is described by peter bradshaw as “a blast of satire and emotional agony about … the fact that black deaths matter”.",False,False,False,False,False,False,False,False
trump-george-floyd-comments-economy-unemployment,article,us-news,2020-06-05,'revolting': trump condemned for saying george floyd is praising us economy,https://www.theguardian.com/us-news/2020/jun/05/trump-george-floyd-comments-economy-unemployment,News,"donald trump was condemned on friday for making the “revolting, enraging, disrespectful” claim that george floyd, an african american man killed by police, is looking down from heaven and praising the us economy.",False,False,False,True,False,False,False,False
black-pound-day-founder-urges-blm-marchers-to-spend-black,article,world,2020-10-01,black pound day founder urges blm marchers to 'spend black',https://www.theguardian.com/world/2020/oct/01/black-pound-day-founder-urges-blm-marchers-to-spend-black,News,"people who attended anti-racism marches this summer should turn their attention “to what really matters” and spend their money with black-owned businesses, the founder of black pound day has said.",False,True,False,False,False,False,False,False
set-the-night-on-fire-la-in-the-sixties-mike-davis-jon-wiener-review-,article,books,2020-04-26,set the night on fire by mike davis and jon wiener – review,https://www.theguardian.com/books/2020/apr/26/set-the-night-on-fire-la-in-the-sixties-mike-davis-jon-wiener-review-,Arts,"in the mid-1960s, california occupied a singular place in the american popular consciousness as a perpetually sun-drenched, wave-lashed paradise populated by tanned white people. tv shows such as m> 77 sunset stripm> competed with teen movies such as m> beach partym>  and m> bikini beachm> to buoy up the myth, while a succession of classic beach boys hits hymned california’s endless summer.",False,False,False,False,False,False,False,False
morning-mail-george-floyd-charges-flawed-coronavirus-study-madeline-mccann-suspect,article,australia-news,2020-06-03,"morning mail: george floyd charges, flawed coronavirus study, madeline mccann suspect",https://www.theguardian.com/australia-news/2020/jun/04/morning-mail-george-floyd-charges-flawed-coronavirus-study-madeline-mccann-suspect,News,"good morning, this is richard parkin bringing you the main stories and must-reads on thursday 4 june.",False,False,False,True,False,False,False,False
houses-of-parliament-art-has-a-lot-of-racist-history-says-its-curator,article,uk-news,2020-06-19,"we must confront racist history of uk parliament's art, says curator",https://www.theguardian.com/uk-news/2020/jun/19/houses-of-parliament-art-has-a-lot-of-racist-history-says-its-curator,News,the curator of parliament’s extensive art collection has acknowledged that many artefacts that adorn the plinths and corridors of westminster have a “racist history” and were bought with slave-owning and colonial wealth.,False,False,False,False,False,False,False,False
uk-schools-what-are-you-doing-for-black-history-month,article,world,2020-09-28,uk schools: what are you doing for black history month?,https://www.theguardian.com/world/2020/sep/28/uk-schools-what-are-you-doing-for-black-history-month,News,"black history month in the uk is observed in october and we’d like to find whether the  black lives matter protests across britain, during the summer, have inspired schools and teachers to provide any special projects or initiatives this year.",False,False,False,False,False,False,False,False
white-people-racism-george-floyd,article,commentisfree,2020-06-02,fighting the racism that killed george floyd requires more than hashtags | nesrine malik,https://www.theguardian.com/commentisfree/2020/jun/02/white-people-racism-george-floyd,Opinion,"every few years, being black becomes a macabre spectacle. what is usually a complicated private identity becomes a public one.  a black man is killed by a white police officer in the united states, and suddenly the world is attuned to your race.",False,False,False,True,False,False,False,False
from-blm-to-lgbt-why-sex-and-the-city-will-need-a-2020-rethink,article,tv-and-radio,2021-01-11,from blm to lgbt+: why sex and the city will need a 2020 rethink,https://www.theguardian.com/tv-and-radio/2021/jan/11/from-blm-to-lgbt-why-sex-and-the-city-will-need-a-2020-rethink,Arts,"sex and the city is back, with a new name – and just like that … – and a new cast, which is to say, the old cast, minus samantha (kim cattrall). anyone who is surprised to see them recovered from the bruising experience of the movie sequel just has too long a memory. sex and the city 2  was more than 10 years ago. the statute of limitations on awful moments in culture has long since expired.",False,True,False,False,False,False,False,False
