CityTown,Location,StateTerritory,Country,Date,EstimateText,EstimateLow,BestGuess,EstimateHigh,AdjustedLow,AdjustedHigh,Actor,Claim,Pro(2)/Anti(1),EventType,ReportedArrests,ReportedParticipantInjuries,ReportedPoliceInjuries,ReportedPropertyDamage,TownsCities,Events,Source1,Source2,Source3,Misc.,
Philadelphia,Independence Mall ,PA,US,2017-06-22,hundreds,200,200,200,220,180,AFGE Local 3631,Oppose proposed federal spending cuts,1,protest,0,0,0,0,1,1,http://www.philly.com/philly/business/labor_and_unions/worried-about-cuts-federal-employees-to-protest-in-philly-20170621.html,,,,
Seattle,downtown,WA,US,2017-06-22,,200,200,200,220,180,Movement for Black Lives; Black Liberation Front Seattle,Black Women Matter,1,march,0,0,0,0,1,1,http://www.king5.com/news/local/seattle/black-women-matter-rally-calls-for-justice-after-death-of-charleena-lyles/451469776,,,,
Trenton,state house,NJ,US,2017-06-22,,,,,,,Students from the Chesterfield School District ,Support passage of new state education budget,0,rally,0,0,0,0,1,1,http://newjersey.news12.com/story/35729895/school-children-rally-at-state-house-for-education-budget,,,,
Washington,inside US Capitol at Sen. Mitch McConnell's office,DC,US,2017-06-22,,60,60,60,66,54,ADAPT,against GOP Senate health care bill,1,die-in,43,0,0,0,1,1,https://twitter.com/frankthorp/status/877972767185944576,http://cjonline.com/news/state-government/2017-06-22/topeka-disability-rights-advocates-among-protesters-arrested-dc,https://www.washingtonpost.com/local/public-safety/disability-advocates-arrested-during-health-care-protest-at-mcconnells-office/2017/06/22/f5dd9992-576f-11e7-ba90-f5875b7d1876_story.html?utm_term=.893c0cd47bc8,civil dis,
Washington City,"The Puppy Store, 1055 W. Red Cliffs Drive",UT,US,2017-06-22,approximately 10,10,10,10,11,9,Best Friends Animal Sanctuary in Kanab; Southern Utah Animal Alliance; Humane Society of the United States,Oppose opening of puppy mill pet store; animal rights,0,protest,0,0,0,0,1,1,https://www.stgeorgeutah.com/news/archive/2017/06/24/cgb-pet-store-ribbon-cutting-in-washington-triggers-protest-from-animal-rights-people/#.WVUpPYjyvIU,,,,
Albany,Rensselaer Amtrak Station,NY,US,2017-06-23,,,,,,,Rally4Trains,against Trump budget plan; support funding for trains,1,rally,,,,,1,1,https://townswithouttrains.com/rally_locator/,,,,
Alpine,102 W Holland Ave.,TX,US,2017-06-23,,,,,,,Rally4Trains,against Trump budget plan; support funding for trains,1,rally,,,,,1,1,https://townswithouttrains.com/rally_locator/,,,,
Augusta,Edmund S. Muskie Federal Building,ME,US,2017-06-23,Postman and a half-dozen other ,7,7,7,8,6,general protesters,Oppose ACA repeal,1,protest,0,0,0,0,1,1,http://www.centralmaine.com/2017/06/23/augusta-demonstrators-urge-sen-collins-to-reject-senate-republicans-health-care-bill/,,,,
Augusta,Senator Inn & Spa,ME,US,2017-06-23,nearly two dozen,24,24,24,26,22,Mainers for Accountable leadership,Oppose ACA repeal,1,protest,0,0,0,0,1,1,http://www.centralmaine.com/2017/06/23/augusta-demonstrators-urge-sen-collins-to-reject-senate-republicans-health-care-bill/,,,,
Charlottesville,Charlottesville Union Station,VA,US,2017-06-23,,,,,,,Rally4Trains,against Trump budget plan; support funding for trains,1,rally,,,,,1,1,https://townswithouttrains.com/rally_locator/,,,,
Chicago,Chicago Union Station,IL,US,2017-06-23,,,,,,,Rally4Trains,against Trump budget plan; support funding for trains,1,rally,,,,,1,1,https://townswithouttrains.com/rally_locator/,,,,
Cleveland,Cleveland Amtrak Station,OH,US,2017-06-23,,,,,,,Rally4Trains,against Trump budget plan; support funding for trains,1,rally,,,,,1,1,https://townswithouttrains.com/rally_locator/,,,,
Colorado Springs,Focus on the Family,CO,US,2017-06-23,1650,1650,1650,1650,1815,1485,Vice President Mike Pence; Focus on the Family,Defund Planned Parenthood,2,rally,0,0,0,0,1,1,http://kneb.com/abc_politics/handmaids-tale-protesters-greet-mike-pence-at-colorado-speech-abcid35930859/,,,,
Colorado Springs,outside the entrance to Focus on the Family,CO,US,2017-06-23,about 150,150,150,150,165,135,Unite Colorado Springs; Colorado Springs Socialists; Colorado Action Network in Colorado Springs; Pikes Peak Progressives,Oppose visit by Vice President Pence,1,protest,0,0,0,0,1,1,http://gazette.com/vice-president-bypasses-protesters-during-focus-on-the-family-visit/article/1605807,http://kneb.com/abc_politics/handmaids-tale-protesters-greet-mike-pence-at-colorado-speech-abcid35930859/,,,
Columbus,High St. at Nationwide Blvd,OH,US,2017-06-23,,,,,,,Rally4Trains,against Trump budget plan; support funding for trains,1,rally,,,,,1,1,https://townswithouttrains.com/rally_locator/,,,,
Emeryville,Emeryville Amtrak Station,CA,US,2017-06-23,,,,,,,Rally4Trains,against Trump budget plan; support funding for trains,1,rally,,,,,1,1,https://townswithouttrains.com/rally_locator/,,,,
Fisher,Roy Holland Memorial Park,IN,US,2017-06-23,,,,,,,Rally4Trains,against Trump budget plan; support funding for trains,1,rally,,,,,1,1,https://townswithouttrains.com/rally_locator/,,,,
Fort Madison,Fort Madison Amtrak Station,IA,US,2017-06-23,,,,,,,Rally4Trains,against Trump budget plan; support funding for trains,1,rally,,,,,1,1,https://townswithouttrains.com/rally_locator/,,,,
Fort Pierce,northwest neighborhoods,FL,US,2017-06-23,,100,100,100,110,90,local youths; Roundtable of St. Lucie County,Demand end to criminal killings; against gun violence,0,march,0,0,0,0,1,1,http://www.tcpalm.com/story/news/crime/st-lucie-county/2017/06/26/fort-pierce-youths-march-peace-end-gunfire/426799001/,,,,
Jefferson,outside Ashe High Auditorium,NC,US,2017-06-23,,,,,,,Westboro Baptist Church,Protest soldier's funeral,0,protest,0,0,0,0,1,1,http://www.jeffersonpost.com/news/breaking-news/7973/westboro-church-plans-to-protest-fallen-heros-funeral,http://www.charlotteobserver.com/news/local/article157638719.html,,,
Kalkaska,National Trout Memorial,MI,US,2017-06-23,,,,,,,Michigan Muslim Community Council; Womens March Michigan,Demand resignation of Kalkaska village president over anti-Muslim remarks; against Islamophobia,0,demonstration,0,0,0,0,1,1,http://www.record-eagle.com/news/local_news/police-to-monitor-protest/article_7f621b14-38ab-5695-b953-ca1918871077.html,http://www.record-eagle.com/news/local_news/kalkaska-gun-gathering-planned-near-protest/article_8c692e3d-df03-5ba9-a2dc-7309e4d2d0cb.html,,,
Kalkaska,,MI,US,2017-06-23,200 to 300,200,245,300,220,270,Your Defending Fathers; Michigan Sons of Liberty Riders,Support open-carry laws and President Trump; possibly also counter protest nearby liberal protest,2,rally,0,0,0,0,1,1,http://www.record-eagle.com/news/local_news/kalkaska-gun-gathering-planned-near-protest/article_8c692e3d-df03-5ba9-a2dc-7309e4d2d0cb.html,,,,
Kenosha ,"United Auto Workers Local 72 Hall, 3815 Washington Road",WI,US,2017-06-23,,,,,,,Randy Bryce; local Democratic activists and supporters,Rally for campaign to challenge Speaker Paul Ryan,1,rally,0,0,0,0,1,1,http://www.kenoshanews.com/news/local/bryce-to-host-campaign-rally-in-kenosha/article_4f3ba0b8-0565-53f3-ba68-be74cdf7dd2f.html,,,,
La Plata,Depot Inn,MO,US,2017-06-23,,,,,,,Rally4Trains,against Trump budget plan; support funding for trains,1,rally,,,,,1,1,https://townswithouttrains.com/rally_locator/,,,,
Los Angeles,outside City Hall,CA,US,2017-06-23,dozens,24,24,24,26,22,International Brotherhood of Teamsters,Demand recognition of port workers as regular employees not contractors; support worker rights,0,march,0,0,0,0,1,1,http://www.dailybreeze.com/social-affairs/20170623/striking-port-truckers-take-their-protest-to-la-city-hall,,,,
Miami,Miami Amtrak Station,FL,US,2017-06-23,,,,,,,Rally4Trains,against Trump budget plan; support funding for trains,1,rally,,,,,1,1,https://townswithouttrains.com/rally_locator/,,,,
Missoula,office of Sen. Steve Daines,MT,US,2017-06-23,about 40,40,40,40,44,36,Missoula Rises,Oppose ACA repeal,1,protest,0,0,0,0,1,1,http://missoulian.com/news/local/group-rallies-at-daines-missoula-office-over-health-care-bill/article_e6c8c92c-d6bc-5b87-9f15-61616fb7bb34.html,,,,
Montana City,,MT,US,2017-06-23,,,,,,,Montana Nurses Association Local Unit No. 13,Support St. Peter's nurses' contract negotiations,0,demonstration,0,0,0,0,1,1,http://helenair.com/business/st-peter-s-nurses-rally-community-amid-push-for-higher/article_afce081b-2460-5d5c-a610-23c3405576e0.html,,,,
Montpelier,outside statehouse,VT,US,2017-06-23,dozens,24,24,24,26,22,Migrant Justice ,Demand ICE release of two migrant workers,1,protest,0,0,0,0,1,1,http://www.mynbc5.com/article/dozens-rally-for-freedom-of-2-dairy-farmers-detained-by-ice/10216427,,,,
Philadelphia,outside Senator Pat Toomey's Philadelphia office,PA,US,2017-06-23,,,,,,,general protesters,Oppose ACA repeal,1,protest,0,0,0,0,1,1,http://6abc.com/health/folks-protest-proposed-senate-republican-health-care-bill/2137501/,,,,
Philadelphia,,PA,US,2017-06-23,,,,,,,general protesters,Support state soda tax,0,demonstration,0,0,0,0,1,1,http://www.ldnews.com/story/news/politics/2017/06/23/raucous-soda-tax-supporters-tell-wagner-haul-his-trash-back-york/424361001/,,,,
Tampa,Kennedy Boulevard,FL,US,2017-06-23,,9,9,9,10,8,Cleanup Kennedy ,Protest organized prostitution in local spas,0,demonstration,0,0,0,0,1,1,http://wfla.com/2017/06/19/8-on-your-side-storefronts-for-sex-investigation-prompts-protest-of-kennedy-blvd-spas/,https://www.facebook.com/events/1974164446161934/?acontext=%7B%22action_history%22%3A%22null%22%7D,,,
Washington,US Supreme Court,DC,US,2017-06-23,,,,,,,general protesters,protect voting rights,1,protest,,,,,1,1,http://fpl.actionkit.com/sign/Jericho-march-jun17/,,,,
West Chester,21 W. Market St.,PA,US,2017-06-23,,,,,,,Concerned Constituent Action Group,support  Gun Violence prevention,1,rally,0,0,0,0,1,1,https://wcborodems.org/2017/06/21/disarm-hate-act-background-june-23-rally/,,,,
Yuba City,"Feather River Parkway,",CA,US,2017-06-23,more than 100,100,100,100,110,90,Assemblyman James Gallagher and state Sen. Jim Nielsen; local residents; business leaders ,Speak Up Rally for Levee Funding ,0,rally,0,0,0,0,1,1,http://www.appeal-democrat.com/news/speak-up-for-levee-funding-at-friday-rally/article_be4b91ea-54af-11e7-8567-27780bed6fed.html,http://www.appeal-democrat.com/news/elected-officials-community-rally-for-levee-funding/article_49cecc06-586f-11e7-bcf3-cf6f10f92db9.html,,,
Yuma,Joe Henry Park,AZ,US,2017-06-23,,,,,,,Colorado River Tea Party,support America First policy,2,rally,0,0,0,0,1,1,http://www.yumasun.com/news/america-first-rally-set-at-joe-henry-park/article_4227cf3c-5867-11e7-bcf3-77c52eed608d.html,,,,
Ashbury,Asbury Park ,NJ,US,2017-06-24,about 60,60,60,60,66,54,local residents and activists,Oppose development of a beachfront land,0,march,0,0,0,0,1,1,http://www.nj.com/monmouth/index.ssf/2017/06/asbury_park_development_protest.html,,,,
Charleston,Summers Street,WV,US,2017-06-24,Nearly 200; dozens,200,260,333,220,300,general protesters,Free the Nip Top Freedom Rally,0,rally,0,0,0,0,1,1,http://www.wsaz.com/content/news/Charleston-mayor-asking-for-topless-march-to-be-postponed-because-of-children-429966623.html,http://www.wvgazettemail.com/news-kanawha-county/20170621/charleston-asks-topless-protest-organizers-to-reschedule-,http://www.times-news.com/news/dozens-protest-topless-to-normalize-female-bodies/article_94869688-52bf-544a-80b7-207fc40ce60d.html,https://www.facebook.com/events/1291491937637529/,
Chicago,Little Village,IL,US,2017-06-24,,,,,,,general protesters,Dyke March; pro-LGBTQ,1,march,0,0,0,0,1,1,http://www.foxnews.com/us/2017/06/25/women-with-star-david-flags-told-to-leave-chicago-gay-pride-march.html,http://www.chicagotribune.com/news/local/breaking/ct-pride-parade-met-20170625-story.html,,,
Coeur dAlene,Independence Point,ID,US,2017-06-24,,,,,,,Save IMCDA 140.6,Demand city keep the full Ironman race,0,rally,0,0,0,0,1,1,http://www.cdapress.com/article/20170623/ARTICLE/170629920,,,,
Durango,Buckley Park,CO,US,2017-06-24,about 200,200,200,200,220,180,general protesters,"Pride Parade, pro-LGBTQ",1,march ,0,0,0,0,1,1,https://durangoherald.com/articles/167679-pride-parade-in-durango,,,,
El Paso,Memorial Park to El Paso Police Dept HQ,TX,US,2017-06-24,,100,142,194,110,175,Border Network for Human Rights,against border wall,1,protest,0,0,0,0,1,1,http://www.elpasotimes.com/picture-gallery/news/2017/06/26/handcuffed-members-of-border-network-for-human-rights-protest-sb4/103218742/,https://www.facebook.com/events/1851168905136419/?acontext=%7B%22source%22%3A5%2C%22page_id_source%22%3A101664589909062%2C%22action_history%22%3A[%7B%22surface%22%3A%22page%22%2C%22mechanism%22%3A%22main_list%22%2C%22extra_data%22%3A%22%7B%5C%22page_id%5C%22%3A101664589909062%2C%5C%22tour_id%5C%22%3Anull%7D%22%7D]%2C%22has_source%22%3Atrue%7D,,,
Fraser,Winter Park Resort,CO,US,2017-06-24,,,,,,,Rally4Trains,against Trump budget plan; support funding for trains,1,rally,,,,,1,1,https://townswithouttrains.com/rally_locator/,,,,
Gardena,Nakaoka Community Center,CA,US,2017-06-24,around 80,80,80,80,88,72,general protesters,Oppose Rep. Maxine Waters' town hall meeting,2,protest,0,0,0,0,1,1,http://www.latimes.com/local/lanow/la-me-ln-maxine-waters-townhall-20170624-story.html,,,,
Granby,Winter Park Resort,CO,US,2017-06-24,,,,,,,Rally4Trains,against Trump budget plan; support funding for trains,1,rally,,,,,0,0,"see Fraser, CO",,,,
Greenfield,Federal Street,MA,US,2017-06-24,approximately 400,400,400,400,440,360,general protesters,"Franklin County Pride, pro-LGBTQ",1,march,0,0,0,0,1,1,http://www.recorder.com/Residents-show-their-Pride-through-rally-march-10912956.aspx,http://wwlp.com/2017/06/24/hundreds-march-for-greenfields-first-ever-pride-march/,,,
Greenville,Greenville Amtrak Station,SC,US,2017-06-24,,,,,,,Rally4Trains,against Trump budget plan; support funding for trains,1,rally,,,,,1,1,https://townswithouttrains.com/rally_locator/,,,,
Hollidaysburg,in front of the Blair County Courthouse ,PA,US,2017-06-24,about 30,30,30,30,33,27,Blair County Coalition for Public Safety,Oppose pipeline construction ,1,protest,0,0,0,0,1,1,http://www.altoonamirror.com/news/local-news/2017/06/group-holding-pipeline-protest/,http://www.altoonamirror.com/news/local-news/2017/06/dozens-protest-pipeline-construction-project/,,,
Houston,downtown,TX,US,2017-06-24,,,,,,,general protesters,"Pride parade, pro-LGBTQ",1,march,0,0,0,0,1,1,http://www.theeagle.com/news/local/a-m-pride-on-display-as-aggies-march-in-houston/article_6a46a775-c00a-5e29-b138-cc3f193f62f7.html,,,,
Killeen ,Killeen Community Center,TX,US,2017-06-24,over 60,60,60,60,66,54,Gospel Travelers of Killeen; local residents;,Juneteenth celebration,1,rally,0,0,0,0,1,1,http://kdhnews.com/news/local/juneteenth-worship-service-rallies-residents/article_f016d416-592b-11e7-a572-6b19dd19fd56.html,,,,
Klamath Falls,Klamath Falls Amtrak Station,OR,US,2017-06-24,,,,,,,Rally4Trains,against Trump budget plan; support funding for trains,1,rally,,,,,1,1,https://townswithouttrains.com/rally_locator/,,,,
Klamath Falls,Oregon Tech,OR,US,2017-06-24,,,,,,,Klamath County Democratic Central Committee,Oppose ACA repeal,1,protest,0,0,0,0,1,1,http://www.heraldandnews.com/news/local-dems-organize-anti-trumpcare-protest/article_70a40196-e6a7-52f1-9dcf-97b8b0d03c1f.html,,,,
Missoula,Sunrise Saloon; Kiwanis Park,MT,US,2017-06-24,20 or so,20,20,20,22,18,general protesters; Montana Human Rights Network ,Our CommUNITY Aligned Against Hate protest against racist art at local bar,1,rally,0,0,0,0,1,1,http://missoulian.com/news/local/some-protest-missoula-bar-s-art-as-racist/article_288094ec-a51b-59cb-9752-7e224d7b224f.html,https://www.facebook.com/events/142058679689041/?acontext=%7B%22ref%22%3A%2222%22%2C%22feed_story_type%22%3A%2222%22%2C%22action_history%22%3A%22null%22%7D&pnref=story,https://missoulanews.bigskypress.com/missoula/pepe-goes-to-a-picnic/Content?oid=4444102,,
Noblesville,Federal Hill Commons,IN,US,2017-06-24,,,,,,,Rally4Trains,against Trump budget plan; support funding for trains,1,rally,,,,,1,1,https://townswithouttrains.com/rally_locator/,,,,
Pittsburgh,David L. Lawrence Convention Center ballroom,PA,US,2017-06-24,some 1600,1600,1600,1600,1760,1440,Sen. Bernie Sanders; MoveOn.org; One PA; Keystone Progress; Planned Parenthood,support ACA and health care ,1,rally,0,0,0,0,1,1,http://www.pennlive.com/news/2017/06/bernie_sanders_health_care_bil.html,http://www.pennlive.com/news/2017/06/bernie_sanders_to_rally_agains.html,http://www.post-gazette.com/news/politics-local/2017/06/25/Vermont-Sen-Bernie-Sanders-rallies-crowd-to-oppose-GOP-healthcare-bill-pittsburgh/stories/201706240122,,
Portland,Portland Amtrak Station,OR,US,2017-06-24,,,,,,,Rally4Trains,against Trump budget plan; support funding for trains,1,rally,,,,,1,1,https://townswithouttrains.com/rally_locator/,,,,
San Luis Obispo,San Luis Obispo Amtrak Station,CA,US,2017-06-24,,,,,,,Rally4Trains,against Trump budget plan; support funding for trains,1,rally,,,,,1,1,https://townswithouttrains.com/rally_locator/,,,,
Sandisfield,Lower Spectacle Pond,MA,US,2017-06-24,about 80 ,80,80,80,88,72,Sugar Shack Alliance,Oppose new fracking pipeline through state park,1,demonstration,8,0,0,0,1,1,http://theberkshireedge.com/eight-more-protesters-arrested-at-otis-state-forest-pipeline-imbroglio/,https://www.bostonglobe.com/metro/2017/06/24/eight-arrested-pipeline-demonstration-sandisfield/OrjbZ1el3NWSyPCPHkdF2K/story.html,"http://www.berkshireeagle.com/stories/98-year-old-woman-arrested-in-pipeline-protest-my-life-has-been-devoted-to-trying-to-wake-people,511576",,
Smithtown,in front of state Senate Majority Leader John Flanagans Smithtown office,NY,US,2017-06-24,about 15,15,15,15,17,14,Long Island Transgender Advocacy Coalition,"Oppose failure of State Senate to bring the Gender Expression Non-Discrimination Act, to a vote",0,protest,0,0,0,0,1,1,http://www.newsday.com/long-island/suffolk/rally-for-transgender-rights-outside-john-flanagan-s-office-1.13761612,http://www.newsday.com/long-island/suffolk/transgender-activists-protest-outside-flanagan-s-office-1.13761489,,,
South Bend,South Bend Amtrak Station,IN,US,2017-06-24,,,,,,,Rally4Trains,against Trump budget plan; support funding for trains,1,rally,,,,,1,1,https://townswithouttrains.com/rally_locator/,,,,
St. Mary's,Howard Gilman Waterfront Park,GA,US,2017-06-24,nearly 500,500,500,500,550,450,St. Marys EarthKeppers; National Parks Conservation Association; Save Cumberland Island; Oceana; Georgia Sierra Club; Georgia Trails Alliance; Dogwood Alliance,Oppose further development of Cumberland Island,0,protest,0,0,0,0,1,1,http://wsav.com/2017/06/23/cumberland-island-rally-set-for-this-weekend/,http://goldenisles.news/news/local_news/cumberland-rally-attracts-hundreds/article_0358f705-62ec-56ce-934c-c379efc3659c.html,,,
St. Paul,St. Paul Union Depot,MN,US,2017-06-24,,,,,,,Rally4Trains,against Trump budget plan; support funding for trains,1,rally,,,,,1,1,https://townswithouttrains.com/rally_locator/,,,,
Tampa,Tampa Union Station,FL,US,2017-06-24,,,,,,,Rally4Trains,against Trump budget plan; support funding for trains,1,rally,,,,,1,1,https://townswithouttrains.com/rally_locator/,,,,
Toledo,Central Union Terminal,OH,US,2017-06-24,about 20,20,20,20,22,18,National Association of Railroad Passengers,against Trump budget plan; support funding for trains,1,rally,0,0,0,0,1,1,http://www.toledoblade.com/Politics/2017/06/25/Train-enthusiasts-protest-Trump-cuts-to-Amtrak.html,https://townswithouttrains.com/rally_locator/,,,
Wausau,Wausau Train Depot,WI,US,2017-06-24,,,,,,,Rally4Trains,against Trump budget plan; support funding for trains,1,rally,,,,,1,1,https://townswithouttrains.com/rally_locator/,,,,
Winter Park,Winter Park Resort,CO,US,2017-06-24,,,,,,,Rally4Trains,against Trump budget plan; support funding for trains,1,rally,,,,,0,0,"see Fraser, CO",,,,
Annapolis,City Dock at Kunta Kinte-Alex Haley Memorial,MD,US,2017-06-25,,10,10,10,11,9,coalition of advocacy groups,Demand state of emergency declaration on race relations; against racism,1,rally,0,0,0,0,1,1,https://www.fredericknewspost.com/public/ap/groups-march-for-state-of-emergency-on-race-relations/article_182d8163-9eaa-5eb2-b0a2-e1a29200fdee.html,http://www.capitalgazette.com/news/annapolis/ph-ac-cn-emergency-rally-0626-20170625-story.html,,Count from picture,
Charleston,Charleston Municipal Auditorium,WV,US,2017-06-25,,,,,,,Sen. Bernie Sanders; Move On Civic Action; Planned Parenthood South Atlantic; West Virginia Healthy Kids and Families Coalition; West Virginians for Affordable Health Care; Our Children Our Future; Organizing for Action; ACLU; WV Citizen Action Group; Wood County Indivisible; West Virginia Center for Budget and Policy; WV Free; Kanawha Valley Democratic Socialists of America; Rise Up WV; West Virginia Womens March,Protect Our Health Care Rally,1,rally,0,0,0,0,1,1,http://www.wvgazettemail.com/news/20170622/sen-sanders-to-be-at-municipal-auditorium-for-health-care-rally-sunday,http://www.wvgazettemail.com/news/20170622/sen-sanders-to-be-at-municipal-auditorium-for-health-care-rally-sunday,,,
Chicago,downtown,IL,US,2017-06-25,"More than 250,000",250000,250000,250000,275000,225000,general protesters,"Pride Parade, pro-LGBTQ",1,march,0,0,0,0,1,1,http://www.foxnews.com/us/2017/06/25/women-with-star-david-flags-told-to-leave-chicago-gay-pride-march.html,http://www.chicagotribune.com/news/local/breaking/ct-pride-parade-met-20170625-story.html,,,
Columbus,EXPRESS LIVE! concert hall ,OH,US,2017-06-25,,2200,2200,2200,2420,1980,Sen. Bernie Sanders; MoveOn.org,suppoort ACA and Healthcare,1,rally,0,0,0,0,1,1,http://kneb.com/abc_politics/bernie-sanders-headlining-dont-take-our-health-care-rallies-in-three-states-abcid35930897/,http://www.pennlive.com/news/2017/06/bernie_sanders_to_rally_agains.html,http://www.thelantern.com/2017/06/2200-gather-at-bernie-sanders-rally-to-oppose-senate-health-care-bill/,,
Doral,marched from the Trump Doral to the U.S. Southern Command,MI,US,2017-06-25,,10,10,10,11,9,general protesters,Demand closure of the US prison at Guantanamo Bay in Cuba,1,march,0,0,0,0,1,1,http://miami.cbslocal.com/2017/06/25/activists-demand-guantanamo-bay-shutdown-rally-trump-golf-course/,,,,
Durango,Animas River,CO,US,2017-06-25,,,,,,,general protesters,Durango Pride Festival River Parade; pro-LGBTQ,1,march ,0,0,0,0,1,1,https://durangoherald.com/articles/167679-pride-parade-in-durango,,,,
Minneapolis ,Hennepin Avenue,MN,US,2017-06-25,tens of thousands,20000,20000,20000,22000,18000,general protesters,"Twin Cities Pride parade, pro-LGBTQ",0,march,0,0,0,0,1,1,http://www.startribune.com/some-cops-complain-after-being-told-they-can-t-march-in-lgbt-pride-parade/430031313/,http://www.startribune.com/tens-of-thousands-pack-downtown-minneapolis-for-pride-parade/430695433/,,,
Minneapolis ,Hennepin Avenue,MN,US,2017-06-25,about 200,200,200,200,220,180,BLM,Oppose inclusion of police in parade,0,blockade; die-in,0,0,0,0,1,1,http://minnesota.cbslocal.com/2017/06/25/pride-parade-protesters-police/,http://www.kwwl.com/story/35744641/2017/06/25/anti-police-protesters-disrupt-twin-cities-pride-parade,,,
Missoula,North Higgins Avenue,MT,US,2017-06-25,,,,,,,Missoulians for Peace,"Oppose police brutality, against racism",1,march,0,0,0,0,1,1,http://missoulian.com/news/local/missoulians-march-to-bring-attention-to-police-treatment-of-minorities/article_1a30ca76-c5e8-5016-89f5-e8f31ceb4149.html,,,,
New York,"5th Ave, Manhattan",NY,US,2017-06-25,thousands,2000,2000,2000,2200,1800,general protesters ,"New York Gay Pride Parade, pro-LGBTQ",1,march ,0,0,0,0,1,1,https://www.usatoday.com/picture-gallery/news/2017/06/11/across-the-us-thousands-rally-for-lgbtq-rights/102756538/,,,,
San Francisco,Market Street ,CA,US,2017-06-25,hundreds of thousands,200000,200000,200000,220000,180000,general protesters,"7th annual Pride Parade, pro-LGBTQ",1,march,0,0,0,0,1,1,http://www.sfchronicle.com/news/article/Revelers-ready-for-Pride-parade-11245461.php,,,,
Sarasota,Unconditional Surrender statue along Bayfront Drive,FL,US,2017-06-25,about 180,180,180,180,198,162,Action Together Suncoast; Indivisible Bradenton Progressive,Oppose ACA repeal,1,protest,0,0,0,0,1,1,http://www.bradenton.com/news/local/article158094704.html,http://www.bradenton.com/news/local/article158163669.html,,,
Seattle,along Fourth avenue from Union street up to Seattle Center,WA,US,2017-06-25,hundreds of thousands,200000,200000,200000,220000,180000,general protesters,"Pride Parade, pro-LGBTQ",1,march,0,0,0,0,1,1,http://www.seattletimes.com/seattle-news/through-the-heat-thousands-march-in-43rd-annual-pride-parade/,,,,
Seattle,Fourth avenue,WA,US,2017-06-25,,,,,,,anti-gay religious group,"Disrupt Pride, anti-LGBTQ",2,protest,0,0,0,0,1,1,http://www.seattletimes.com/seattle-news/through-the-heat-thousands-march-in-43rd-annual-pride-parade/,,,,
Seattle,Fourth avenue,WA,US,2017-06-25,,,,,,,Black Lives Matter,Honor black mother Charleena Lyles slain by police; Black Lives Matter; against racism,1,sit-in,0,0,0,0,1,1,http://www.seattletimes.com/seattle-news/through-the-heat-thousands-march-in-43rd-annual-pride-parade/,,,,
St. Louis,,MO,US,2017-06-25,,,,,,,general protesters,"PrideFest St. Louis parade, pro-LGBTQ",1,march,0,0,0,0,1,1,http://news.stlpublicradio.org/post/pridefest-planners-and-community-grapple-over-how-express-pride-party-or-protest#stream/0,,,,
St. Petersburg,,FL,US,2017-06-25,,,,,,,general protesters,"St. Pete Pride parade, pro-LGBTQ",1,march,0,0,0,0,1,1,http://www.tampabay.com/news/politics/elections/will-rick-baker-finally-march-in-st-pete-pride-this-year-its-complicated/2328094,,,,
Washington,D.C. police headquarters,DC,US,2017-06-25,,,,,,,"speakers from comminuties of immigrants, Muslims, POC, and women",Really Really Free Speech rally,1,rally,0,0,0,0,1,1,http://wtop.com/dc/2017/06/4-rallies-scheduled-for-sunday-in-dc/,,,,
