CityTown,Location,County,StateTerritory,Country,Date,EstimateText,EstimateLow,BestGuess,EstimateHigh,AdjustedLow,AdjustedHigh,Actor,Claim,Pro(2)/Anti(1),EventType,ReportedArrests,ReportedParticipantInjuries,ReportedPoliceInjuries,ReportedPropertyDamage,TownsCities,Events,Source1,Source2,Source3,Misc.,Source4,Source5
Austin,,Travis,TX,US,2019-10-01,,,,,,,,Other; Against discipline/conviction,0,Rally,,,,,,,https://www.kxan.com/news/local-news/family-of-rodney-reed-rallies-to-stop-his-november-execution/,,,,,
Baldwin,,Nassau ,NY,US ,2019-10-01,,,,,,,,Immigration; For compassionate immigration,1,Protest,3,,,,,,http://www.shorelinemedia.net/ludington_daily_news/news/three-arrested-from-protest-at-north-lake-correctional-facility/article_dada0382-2d1b-5caa-a1c7-8b8f6727d0b2.html,,,,,
Detroit,City Hall,Wayne ,MI ,US,2019-10-01,,20,,20,,,,For animal welfare; Other,0,Protest,,,,,,,https://www.detroitnews.com/story/news/local/detroit-city/2019/10/01/rescue-groups-want-detroit-oust-new-animal-control-director/3826326002/,,,,,
El Centro,8th and mainstreet,Imperial ,CA,US,2019-10-01,,,,,,,General Protestors ,Other; Against sexual/domestic violence,0,Rally ,0,,0,0,1,1,https://www.ivpressonline.com/news/local/county/marchers-rally-for-end-to-domestic-violence/article_74ba21be-e59d-11e9-8bbc-3357d5c56eaf.html,,,,,
Fayetteville	,Ray Avenue and Mason Street,Cumberland ,NC,US,2019-10-01,,,,,,,,LGBTQ community,0,Protest,,,,,1,1,https://www.fayobserver.com/news/20190930/respectful-rally-planned-to-counter-franklin-grahams-fayetteville-event,,,,,
Freeport ,J.W. Dodd Middle School ,Nassau,NY,US,2019-10-01,NA,25,,25,,,General Protestors,Education; Against cabinet member,1,Protest,0,,0,0,1,1,https://www.dailyworld.com/story/news/local/2019/10/01/relatives-hit-and-run-krotz-springs-louisiana-teen-victim-protest-outside-courtroom-during-trial/3830636002/,,,,,
Lansing ,State Capitol,Ingham ,MI,US,2019-10-01,,,,,,,,Other; Against sexual/domestic violence,0,Rally,,,,,,,https://www.lenconnect.com/news/20191002/kahle-addresses-domestic-abuse-survivors-at-capitol-rally,,,,,
Opelousas,St. Landry Parish court building,St. Landry Parish,LA,US,2019-10-01,About a dozen,12,,12,,,General Protestors,"Other, for criminal justice",0,Protest,0,,0,0,1,1,https://www.dailyworld.com/story/news/local/2019/10/01/relatives-hit-and-run-krotz-springs-louisiana-teen-victim-protest-outside-courtroom-during-trial/3830636002/,,,,,
Shreveport,,Caddo,LA,US,2019-10-01,,30,,30,,,,Collective Bargaining; For worker rights; Transportation,0,Protest,,,,,,,https://www.ktbs.com/news/caddo-bus-drivers-protest-in-front-of-central-office/article_81d207c4-e54b-11e9-8759-f3b74962f95a.html,,,,,
Springfield,Park Central Square,Greene,MO,US,2019-10-01,More than 20,20,,29,,,General Protestors,"Other, against death penalty",0,Protest,0,,0,0,1,1,https://www.news-leader.com/story/news/politics/2019/10/01/death-penalty-opponents-protest-springfield-square-missouri/3825829002/,,,,,
St. Cloud,St. Cloud State University,Stearns,MN,US,2019-10-01,,,,,,,Staff and Students,"Collective bargaining, against lay offs",0,March/Rally,0,,0,0,1,1,https://www.sctimes.com/story/news/2019/10/01/students-professors-rally-protest-scsu-layoffs/3834410002/,,,,,
Dallas,Dallas courthouse,Dallas,TX,US,2019-10-02,About 50,50,,50,,,General Protestors ,Civil Rights; For greater accountability; For racial justice; Police,0,Prostest ,1,,0,0,1,1,https://www.star-telegram.com/news/local/crime/article235734817.html,,,,,
East Lansing ,Grand Traverse Pie Co.,Ingham ,MI,US,2019-10-02,,,,,,,,Legislative; Against congressional representative; Executive; For president; Impeachment,1,Protest,,,,,,,https://www.michiganadvance.com/2019/10/02/slotkin-tells-supporters-protesters-on-backing-impeachment-inquiry-i-believed-it-was-the-right-thing-to-do/,,,,,
Jackson,Mississippi Abortion clinic ,Hinds ,MS,US,2019-10-02,,,,,,,Pro-choice; Pro-life,Against abortion rights; Civil Rights,1,Prostest ,0,,0,0,1,1,https://apnews.com/192a9b667d5548909a75f51bae221e9b,,,,,
Jacksonville,University of North Florida,Duval,FL,US,2019-10-02,,,,,,,students,Protesting preachers,0,Protest,0,0,0,0,1,1,https://unfspinnaker.com/79294/latest-stories/dean-of-students-and-ombuds-respond-to-preachers-and-protesters-on-the-green/,,,,,
Las Vegas,Harley Davidson Parking Lot,Clark,NV,US,2019-10-02,NA,,,,,,General Protestors,"Guns, against greater gun control",2,Rally,0,,0,0,1,1,https://www.nevadacurrent.com/blog/no-long-guns-allowed-at-2nd-amendment-rally/,,,,,
Las Vegas,Las Vegas City Hall,Clark,NV,US,2019-10-02,,,,,,,General Protestors,"Other, for homeless residents",0,Rally,0,,0,0,1,1,https://www.nevadacurrent.com/blog/groups-plan-rally-at-city-hall-to-protest-ordinance-criminalizing-homelessness/,,,,,
Las Vegas ,City Hall ,Clark,NV,US,2019-10-02,,20,,20,,,,Other; For homeless residents; For affordable housing,0,Protest,,,,,,,https://www.reviewjournal.com/news/politics-and-government/las-vegas/homeless-join-advocates-to-protest-proposed-las-vegas-camping-ban-1861720/,,,,,
Los Angeles,Hall of Justice,Los Angeles,CA,US,2019-10-02,,,,,,,Black Lives Matter LA,"against police brutality, for police accountability, Black Lives Matter, against District Attorney Jackie Lacey",1,protest,,,,,1,1,https://www.cnn.com/2020/07/10/us/jackie-lacey-la-da-black-lives-matter/index.html,https://www.newyorker.com/magazine/2020/11/16/after-years-of-protests-every-wednesday-la-activists-welcome-a-new-da,,,,
Los Angeles,Los Angeles International Airport,Los Angeles,CA,US,2019-10-02,,100,,100,,,"Airport employees, Uber/Lyft drivers, Southland workers","Collective Bargaining, for unionization",0,March ,0,0,0,0,1,1,https://www.dailybreeze.com/2019/10/01/heading-to-lax-wednesday-union-march-could-slow-down-traffic/,https://abc7.com/society/workers-call-for-right-to-unionize-during-lax-march/5584310/,,,,
Montgomery,State Capitol,Montgomery,AL,US,2019-10-02,,20,,20,,,,Against sexual/domestic violence; Other,0,Rally,,,,,,,https://www.wsfa.com/2019/10/02/survivors-rally-bring-awareness-domestic-violence/,,,,,
Omaha,,Douglas ,NE,US,2019-10-02,Nearly 400,400,,400,,,Cattle Farmers; Ranchers,Other; For greater regulation; Farming,1,Rally ,0,,0,0,1,1,https://www.radioiowa.com/2019/10/03/farmers-and-ranchers-rally-in-omaha-to-protect-cattle-prices/,,,,,
Orono,University of Maine ,Penobscot,ME,US ,2019-10-02,,200,,200,,,,Other; Against sexual/domestic violence,0,Rally,,,,,,,https://www.newscentermaine.com/article/news/local/as-seen-on-tv/umaine-students-and-advocates-hold-domestic-violence-march/97-87b555e3-4b63-4afb-8136-6faaf0123531        ,,,,,
Reno,Reno-Tahoe International Airport,Washoe,NV,US,2019-10-02,,,,,,,,Executive; Legislative; Against congressional representative; For president; Impeachment,2,Prostest ,0,,0,0,1,1,https://www.rgj.com/story/news/politics/2019/10/03/gop-cries-foul-over-probe-into-pro-trump-protest/3858487002/,,,,,
San Francisco,San Francisco International Airport,San Francisco,CA,US,2019-10-02,About 50,50,,50,,,Airport workers ,Collective Bargaining; For worker rights,0,Prostest ,0,,0,0,1,1,https://www.sfexaminer.com/news/airport-workers-rally-at-sfo-for-better-working-conditions/,,,,,
Selma,,Dallas,AL,US ,2019-10-02,,,,,,,,Collective Bargaining; For better compensation,0,Protest,,,,,,,https://www.wsfa.com/2019/10/02/departments-close-selma-employees-protest-pay-work-conditions/,,,,,
Sioux Falls,"Sioux Falls, Mitchell, Pierre",Minnehaha,SD,US,2019-10-02,NA,,,,,,Truckers,"Collective bargaining, against layoffs, automation, transportation",,Demonstration,0,,0,0,1,1,https://kelo.com/news/articles/2019/oct/01/truckers-say-theyll-demonstrate-during-morning-commute-on-interstate-29/942970/,,,,,
St. Louis ,City Hall,St. Louis,MO,US,2019-10-02,,50,,50,,,,Collective Bargaining; For higher minimum wage,0,Protest,,,,,,,https://www.stltoday.com/news/local/govt-and-politics/mayoral-tweet-touting-mcdonald-s-jobs-school-aid-spurs-st/article_bb238fd6-0e58-5145-97f9-77c49befd29a.html,,,,,
Wichita ,Wichita State University,Sedgwick,KS,US,2019-10-02,about 30,30,,30,,,general protesters,Pro-impeachment,1,Protest,0,0,0,0,1,1,https://www-1.kansas.com/news/politics-government/article235725982.html,,,,,
Boston,State Capitol,Suffolk,MA,US,2019-10-03,na,13,,13,,,General Protestors,Immigration; For compassionate immigration,0,Prostest ,13,,0,0,1,1,https://www.bostonherald.com/2019/10/03/protesters-arrested-at-state-house-after-hours-ignored-state-police-orders-to-leave/,,,,,
Boston,State House,Suffolk,MA,US,2019-10-03,dozens ,24,,24,,,Vape industry; Vape Industry supporters ,Other; Against regulation; Drugs/Alcohol,0,Rally ,0,,0,0,1,1,https://www.bostonglobe.com/news/marijuana/2019/10/03/cigarette-stores-customers-protest-baker-vape-ban/jkAIhHuu6YzWY6aMX7Tb4L/story.html,,,,,
Burlington,,Middlesex,MA,US,2019-10-03,,,,,,,,Pro immigration ,1,Protest,,,,,1,1,https://www.wcvb.com/article/protesters-to-rally-in-boston-against-immigration-roundups-raids/29302792,,,,,
Ocala,Southwest 60th Avenue,Marion,FL,US,2019-10-03,two dozen,24,,24,,, National Committee to Preserve Social Security & Medicare,For Medicare; Healthcare,1,Prostest ,0,,0,0,1,1,https://www.ocala.com/news/20191003/two-dozen-protest-trump-over-medicare,,,,,
Reno,General Motors facility,Washoe,NV,US,2019-10-03,count pic,12,,14,,,Sen. Kamala Harris; Students,Collective Bargaining; For better compensatio,1,Rally ,0,,0,0,1,1,https://apnews.com/848d77ada0d94934a3adcb575f99fd6b,,,,,
San Francisco,Sansome St,San Francisco,CA,US,2019-10-03,About 50,50,,50,,,Asian Law Caucus; Immigration supporters; Cambodians,For compassionate immigration; Immigration; For refugees,1,Demostration ,0,,0,0,1,1,https://www.sfchronicle.com/bayarea/article/ICE-arrests-two-Cambodians-in-SF-as-advocates-14490431.php,,,,,
Sioux Falls ,,Minnehaha,SD,US ,2019-10-03,,,,,,,,Other; Transportation; Against regulation,0,Protest,,,,,,,https://rapidcityjournal.com/news/latest/truckers-plan-slow-roll-protest-thursday-in-south-dakota/article_de8e85dc-6596-5799-9455-25b6838449c6.html,,,,,
Weston ,Bonaventure Town Center Club,Boward ,FL,US,2019-10-03,a group; count pic,16,,,,,,Against congressional representative; Legislative,2,Prostest ,0,,0,0,1,1,https://www.miamiherald.com/news/politics-government/article235781582.html,,,,,
Bloomfield,intersection of Main Street and Penn Avenue,Allegheny,PA,US,2019-10-04,about 100,100,,100,,,general protesters,protesting violence against Black and Trans women in Pittsburgh ,1,protest; march,0,0,0,0,1,1,https://pittnews.com/article/151108/news/marchers-rally-in-bloomfield-for-black-women/,,,,,
Cape May,on the Courthouse steps,Cape May,NJ,US,2019-10-04,,,,,,,general protesters,republicans in support of Sherrifs ICE cooperation,2,rally,0,0,0,0,1,1,https://www.pressofatlanticcity.com/politics/republicans-to-rally-in-support-of-cape-may-county-ice/article_00f4378c-418c-5dd4-9e23-df78c9e08e46.html,,,,,
Detroit Lakes,,Becker,MN,US,2019-10-04,,,,,,,,Executive; For president; Impeachment; Legislative; Against congressional representative,1,,,,,,1,1,https://kbjr6.com/news/minnesota-news-from-the-associated-press/2019/10/03/anti-impeachment-protest-planned-at-rep-petersons-office/,,,,,
Iowa City,Dubque St.,Johnson,IA,US,2019-10-04,,,,,,,Greta Thunberg; Climate Change Activists ,Against climate change; Environment,0,,,,,,1,1,https://littlevillagemag.com/location-for-iowa-city-student-climate-strike-rally-featuring-greta-thunberg-has-been-changed/,,,,,
Oxford,University of Mississippi,Lafayette,MS,US,2019-10-04,,,,,,,general protestors,against selection of new chancellor,0,protest; march,0,0,0,0,1,1,https://www.chronicle.com/article/He-Was-a-Consultant-for-the/247289?key=OaLXj7e-XZPZeHLnkkXFWr3pO_ePvrWki7Rg0X5MTYweEbfeEkxwdgVWQ0Q5zv3HcGxBN2ttZlQ1U0E3d01WT19tcTRUTGpaeHM5bjVBX1BidWV5djlQd1hCTQ,,,,,
Arcadia,outside Santa Anita's race track,Los Angeles,CA,US,2019-10-05,about 50,50,,50,,,employees and supporters,pro-horse racing rally; against lay offs and anti-racing protesters,0,rally,0,0,0,0,1,1,https://www.abc10.com/article/news/local/california/santa-anita-horse-racing-supporters/103-23978ef0-71b4-460c-a161-bd0c1b724f07,,,,,
Ashland ,,Boyd,KY,US,2019-10-05,,,,,,,Kentucky Education Association,Against Governor Matt Bevin,2,Protest,0,0,0,0,1,1,https://www.courier-journal.com/story/news/politics/2019/10/09/kentucky-governor-matt-bevin-met-with-protesters-ashland-event/3919992002/,,,,,
Austin,along Yager Lane,Travis,TX,US,2019-10-05,dozens,24,,24,,,general protesters,marching for sidewalk and road safety after teen killed in car accident,0,vigil; march,0,0,0,0,1,1,https://www.statesman.com/news/20191006/dozens-march-hold-vigil-to-remember-teen-struck-and-killed-by-vehicle,https://www.kvue.com/article/news/local/billy-brown-vigil-and-march-in-northeast-austin-for-teen-killed-in-crash/269-b29daaa1-0dde-4456-9a57-b27bd24205c8,,,,
Brighton,,Livingston,MI,US,2019-10-05,,,,,,,general protesters,pro-impeachment,1,rally,0,0,0,0,1,1,https://www.lenconnect.com/news/20191014/protestors-rally-at-adrian-courthouse-for-trumps-impeachment,,,,,
Culpeper,"main street, outised Republican headquarters",Culpeper,VA,US,2019-10-05,more than 100,100,,100,,,Culpeper County Republicans,protesting impeachment and Democrat Congresswoman Spanberger,2,rally,0,0,0,0,1,1,https://www.starexponent.com/cse/gop-rally-in-culpeper-targets-spanberger/article_def3c835-cb8f-58ba-af2b-89b25a148413.html,,,,,
Glens Falls,,Warren,NY,US,2019-10-05,,,,,,,The Friends of President Trump,For President Trump,2,Protest,0,0,0,0,1,1,https://poststar.com/news/local/govt-and-politics/glens-falls-proposes-regulations-for-downtown-rallies/article_5326f187-b4bf-5f33-8cf5-b0a739d08c3d.html,,,,,
Glens Falls,,Warren,NY,US,2019-10-05,,,,,,,The Deplorables,Against President Trump,1,Counter-protest,0,0,0,0,0,1,https://poststar.com/news/local/govt-and-politics/glens-falls-proposes-regulations-for-downtown-rallies/article_5326f187-b4bf-5f33-8cf5-b0a739d08c3d.html,,,,,
Kaunakakai (Molokai),,,HI,US,2019-10-05,,,,,,,general protesters,"pro-environment, protesting construction of a telescope on summit of Mauna Kea",0,march,,,,,,0,https://www.mauinews.com/news/local-news/2019/10/maui-represented-in-rally-to-bring-all-the-islands-together/,,,,,
Lahaina,Front Street,Maui,HI,US,2019-10-05,nearly 1000,1000,,1000,,,general protesters,"pro-environment, protesting construction of a telescope on summit of Mauna Kea",0,march,0,0,0,0,1,1,https://www.mauinews.com/news/local-news/2019/10/maui-represented-in-rally-to-bring-all-the-islands-together/,,,,,
Lihue ,went from Vidinha Stadium to the Historic County Building,Kauai,HI,US,2019-10-05,about 2500,2500,,2500,,,"Hina Wong, the Mauna Majority Lahui and Na Koa Aloha ‘Aina","pro-environment, protesting construction of a telescope on summit of Mauna Kea",0,march,0,0,0,0,1,0,https://www.mauinews.com/news/local-news/2019/10/maui-represented-in-rally-to-bring-all-the-islands-together/,,,,,
New York,Manhattan,New York,NY,US,2019-10-05,count pic,10,,10,,,general protestors,Free Julian Assange & Chelsea Manning,0,vigil,,,,,,1,https://twitter.com/NYCFreeAssange/status/1180137507717046272,,,,,
Oahu,,,HI,US,2019-10-05,,,,,,,general protesters,"pro-environment, protesting construction of a telescope on summit of Mauna Kea",0,march,,,,,,0,https://www.mauinews.com/news/local-news/2019/10/maui-represented-in-rally-to-bring-all-the-islands-together/,,,,,
Pittsboro,East Street,Chatham ,NC,US,2019-10-05,10 people on each side of the street; approximately 30,10,,30,,,general protesters ,pro confederate memorial ,0,protest,3,0,0,0,1,1,https://www.wbtv.com/2019/10/06/charged-during-demonstrations-over-confederate-statue-pittsboro/,,,,,
Pittsboro,East Street,Chatham ,NC,US,2019-10-05,10 people on each side of the street; approximately 30,10,,30,,,general protesters ,anti confederate memorial ,0,counter-protest,3,0,0,0,0,1,https://www.wbtv.com/2019/10/06/charged-during-demonstrations-over-confederate-statue-pittsboro/,,,,,
Somerset, across the street from plaza in front of the county judicial building,Pulaski,KY,US,2019-10-05,handful,,,,,,Several church members,protesting the LGBTQ+ festival,2,protest,0,0,0,0,0,1,https://www.kentucky.com/news/state/kentucky/article235851652.html,,,,,
Somerset, plaza in front of the county judicial building,Pulaski,KY,US,2019-10-05,hundreds,200,,200,,,Kat Moses and LGBTQ+ community organizers,festival in support of LGBTQ+ people in the community,1,rally,0,0,0,0,1,1,https://www.kentucky.com/news/state/kentucky/article235851652.html,,,,,
Waikiki,Ala Moana Beach Park,Honolulu,HI,US,2019-10-05,more than 10000,10000,,10000,,,general protesters,"pro-environment, protesting construction of a telescope on summit of Mauna Kea",0,march,0,0,0,0,1,0,https://www.khon2.com/local-news/more-than-10000-march-through-waikiki-to-support-mauna-kea-and-the-protection-of-hawaiian-lands/,https://www.hawaiinewsnow.com/2019/10/01/aloha-aina-unity-march-set-this-weekend-waikiki/,,,,
White Sands,"New Mexico Highway 525, White Sands Missile Range",Dona Ana,NM,US,2019-10-05,,,,,,,Tularosa Basin Downsiders Consortium,protesting for better recognition and compensation for those effected by the radiation from the Trinity atomic bomb tests,0,protest,0,0,0,0,1,1,https://eu.alamogordonews.com/story/news/local/community/2019/10/07/trinity-site-fall-open-house-draws-crowd-protesters/3901394002/,,,yearly protest (7th year) organized by TBDC on the Trinity Site Open House,,
Atlanta,Atlanta Beltline,Fulton,GA,US,2019-10-06,more than 50,50,,50,,,BeltLine Rail Now,"against delay in construction of BeltLine light rail public transit system, against gentrification",0,protest,0,0,0,0,1,1,https://www.ajc.com/news/atlanta-beltline-demonstrators-pay-the-tax-now-lay-the-tracks/rS7ipt86MwfobD1XHHcjaL/,,,,,
Atlanta,,Fulton ,GA,US,2019-10-06,,,,,,,,Other; For public transportation,0,,,,,,1,1,https://www.ajc.com/news/local-govt--politics/atlanta-beltline-supporters-rally-for-transit-sunday/E6Q6GArw0PuSD3rpoGPyQP/,,,,,
Belton,from Christ the King Catholic Church on North Main Street,Bell,TX,US,2019-10-06,about 50,50,,50,,,general protesters,pro-life; Life Chain demonstration,2,protest,0,0,0,0,1,0,http://kdhnews.com/news/region/anti-abortion-group-holds-annual-demonstration/article_fb01f5b8-6497-5acd-82dc-1459962876d6.html,,,,,
Columbia,along Providence road,Boone,MO,US,2019-10-06,about 25,25,,25,,,family members of two victims of gun violence,protesting gun violence,1,protest,0,0,0,0,1,1,https://www.columbiamissourian.com/news/local/grassroots-march-for-justice-brings-attention-to-gun-violence/article_33d1f816-e87c-11e9-bbe2-8b8c5772d049.html,,,,,
Dayton,Courthouse square,Montgomery,OH,US,2019-10-06,,,,,,,Save My People Inc.,"""Stop the Violence Rally"" protesting gun violence",1,rally,0,0,0,0,1,1,https://www.wdtn.com/news/local-news/local-non-profit-hosts-stop-the-violence-rally/,,,,,
Frederick,Baker Park Bandshel,Frederick,MD,US,2019-10-06,hundreds,,,,,,general protesters,rally to show support of Frederick County Sheriff’s Office’s 287(g) policy- pro-ICE,2,rally,0,0,0,0,1,1,https://www.wusa9.com/article/news/local/maryland/frederick-rallies-over-immigration-issue/65-b51801d6-6bf0-43f2-bff6-0fc7ff53f48e,https://www.localdvm.com/news/frederick-rallies-clash-over-law-enforcement-and-immigration/,,,,
Frederick,Carroll Creek Amphitheater,Frederick,MD,US,2019-10-06,some 200,200,,200,,,Resources for Immigrant Support and Empowerment,rally to spread welcoming message to immigrants regardless of legal status,1,rally,0,0,0,0,1,1,https://www.wusa9.com/article/news/local/maryland/frederick-rallies-over-immigration-issue/65-b51801d6-6bf0-43f2-bff6-0fc7ff53f48e,https://www.localdvm.com/news/frederick-rallies-clash-over-law-enforcement-and-immigration/,,,,
Madison,outside the Wisconsin State Capital Building,Dane,WI,US,2019-10-06,,,,,,,Madison's National Organization for the Reform of Marijuana Laws,protesting in support for legalization of marijuana,1,protest,0,0,0,0,1,1,https://www.channel3000.com/news/great-midwest-marijuana-harvest-festival-ends-with-peaceful-protest/1129475024,,,,,
Melbourne,New Haven avenue highway,Brevard,FL,US,2019-10-06,about 531,531,,531,,,local churches and pro-life organizers,annual life-chain protest; pro-life,2,protest,0,0,0,0,1,1,https://eu.floridatoday.com/story/news/2019/10/06/dozens-gather-pray-march-melbourne-life-chain-silent-protest-unborn/3891284002/,,,,,
Portland,City Hall ,Cumberland,ME ,US,2019-10-06,,,,,,,,Executive; Against Supreme Court nomination,1,Rally,,,,,,,https://mainebeacon.com/mainers-will-rally-to-reclaim-the-court-one-year-after-kavanaugh-confirmation/,,,,,
San Francisco,Grattan Playground,San Francisco,CA,US,2019-10-06,,,,,,,general protestors,support Chesa Boudin campaign for DA,0,rally,,,,,,1,https://twitter.com/shaunking/status/1180288460189364224,,,,,
San Ysidro, baseball field near the international border and the Otay Mesa Detention Center,San Diego,CA,US,2019-10-06,roughly 60,60,,60,,,general protesters,rally to highlight inhumane treatment of girls and women in detention centers,1,rally,0,0,0,0,1,1,https://www.sandiegouniontribune.com/communities/san-diego/story/2019-10-06/san-ysidro-rally-focuses-on-treatment-of-immigrant-women-girls-at-border,,,,,
Temple,from South 31st street,Bell,TX,US,2019-10-06,about 50,50,,50,,,general protesters,pro-life Life Chain demonstration,2,protest,0,0,0,0,1,0,http://kdhnews.com/news/region/anti-abortion-group-holds-annual-demonstration/article_fb01f5b8-6497-5acd-82dc-1459962876d6.html,,,,,
Terre Haute,outside Vigo Count Courthouse,Vigo,IN,US,2019-10-06,,,,,,,general protesters,"pro-life protest; One of many ""life chain"" protests",2,protest,0,0,0,0,1,0,https://www.wthitv.com/content/news/Life-Chain-protest-makes-its-way-to-the-Wabash-Valley-562371561.html,,,,,
Victoria,along west side of North Navarro street,Victoria,TX,US,2019-10-06,more than 100,100,,100,,,general protesters,pro-life Life Chain demonstration,2,protest,0,0,0,0,1,0,https://www.victoriaadvocate.com/news/community_news/anti-abortion-advocates-line-navarro-for-annual-rally/article_9426f94c-e87b-11e9-89ea-ffa4c74de0cf.html,,,,,
Victoria,along west side of North Navarro street,Victoria,TX,US,2019-10-06,na,1,,1,,,Savannah Sanchez,pro-choice counter protester,1,protest,0,0,0,0,1,0,https://www.victoriaadvocate.com/news/community_news/anti-abortion-advocates-line-navarro-for-annual-rally/article_9426f94c-e87b-11e9-89ea-ffa4c74de0cf.html,,,,,
Washington,,DC,DC,US,2019-10-06,,,,,,,,Against Supreme Court nomination; Executive,1,Rally,,,,,,,https://mainebeacon.com/mainers-will-rally-to-reclaim-the-court-one-year-after-kavanaugh-confirmation/,,,,,
West Reading,the 600 block of Penn Avenue ,Berks,PA,US,2019-10-06,about 75,75,,75,,,general protesters,pro-life Life Chain demonstration,2,protest,0,0,0,0,1,0,https://www.readingeagle.com/news/article/human-chain-in-west-reading-prayers-for-an-end-to-abortion,,,,,
Winchester,along Amherst st,Winchester,VA,US,2019-10-06,about 100,100,,100,,,general protesters,pro-life Life Chain demonstration,2,protest,0,0,0,0,1,0,https://www.winchesterstar.com/winchester_star/local-church-forms-link-in-national-life-chain-abortion-protest/article_75158d84-b91b-593a-bc56-f093adac0ed9.html,,,,,
Aurora,in front of city hall,Adams,CO,US,2019-10-07,about 60,60,,60,,,Abolish ICE Denver,anti-ICE protesting federal immigration policies,1,protest,0,0,0,0,1,1,https://sentinelcolorado.com/sentinel-blogs/city-desk-geo-ice-prison-protest-vote-slated-monday-for-aurora-city-council-mandating-disease-outbreak-reporting/,https://sentinelcolorado.com/news/metro/anti-ice-protestors-suspend-aurora-city-council-meeting/,,,,
Elliston,locked on a Mountain Valley Pipeline helicopter ,Roanoke,VA,US,2019-10-07,na,1,,1,,,general protestor from Appalachians Against Pipelines,protesting the Mountain Valley Pipeline,1,sleeping dragon protest,1,0,0,0,1,1,https://wset.com/news/local/man-arrested-after-locking-himself-to-helicopter-to-protest-pipeline-project,https://www.whsv.com/content/news/Mountain-Valley-Pipeline-opponent-in-custody-after-locking-self-to-helicopter-562440021.html,,"only one protester locked to helicopter near Elliston, VA; charged with two felonies and four misdemeanors",,
Gearhart,outside Gearhart elementary school to Pacific Way,Clatsop,OR,US,2019-10-07,,,,,,,North Coast Indivisible,pro-impeachment rally,1,rally; march,0,0,0,0,1,1,https://www.seasidesignal.com/news/local-news/bonamici-town-hall-in-gearhart-tonight-indivisible-schedules-presidential-impeachment/article_4dfb00ca-e921-11e9-b41e-4fb79ff6b455.html,https://oregonthisweek.com/northerncoast/business/indivisible-north-coast/events/rally-impeach-now-trump-not-above-law-followed-us-representative,,,,
La Crosse,,Whitman,WI,US,2019-10-07,,,,,,,general protesters,Against impeachment investigation ,2,Protest,0,0,0,0,1,1,https://www.santafenewmexican.com/news/local_news/republican-protesters-push-torres-small-to-declare-stance-on-impeachment/article_d838b094-6113-53ce-bf94-149a96e96318.html,,,,,
Manchester,outside Democratic U.S. Sen. Jeanne Shaheen’s local office on Wall Street,Hillsborough,NH,US,2019-10-07,more than 100,100,,100,,,Corey Lewandowski,Anti-impeachement rally,2,rally,0,0,0,0,1,1,https://www.unionleader.com/news/politics/national/pro-trump-rally-draws-supporters-to-downtown-manchester/article_4ad0020a-33f6-5250-aa32-cef0a864a7cc.html,,,,,
New York,"near battery park, Wall St charging bull statue",New York,NY,US,2019-10-07,hundreds,200,,200,,,Extinction Rebellion,"climate change protest, and ""die in"" demonstration",1,protest,26,0,0,0,1,1,https://pix11.com/2019/10/07/climate-protesters-arrested-after-dousing-wall-street-bull-with-fake-blood-amid-global-demonstrations/,https://earther.gizmodo.com/were-here-extinction-rebellion-bloodies-new-york-as-pa-1838850374,,,,
