CityTown,Location,StateTerritory,Country,Date,EstimateText,EstimateLow,BestGuess,EstimateHigh,AdjustedLow,AdjustedHigh,Actor,Claim,Pro(2)/Anti(1),EventType,ReportedArrests,ReportedParticipantInjuries,ReportedPoliceInjuries,ReportedPropertyDamage,TownsCities,Events,Source1,Source2,Source3,Misc.
Madison,to various banks,WI,US,2017-05-05,50+,50,,50,,,the 350 Madison group,stop climate change,1,march,0,0,0,0,1,1,http://host.madison.com/ct/opinion/column/susan-amber-johnson-madison-s-may-divestment-march-continues-climate/article_ff6d868d-d310-5c79-82ef-c72f62b73b3d.html,https://twitter.com/350Madison/status/860615671725666304,http://www.dailycardinal.com/article/2017/05/local-and-student-organizations-join-for-grassroots-divestment-march,
Memphis,Austin Peay Highway,TN,US,2017-05-05,,,,,,,students,stop the violence rally,0,rally,0,0,0,0,1,1,http://www.localmemphis.com/news/local-news/local-students-rally-to-stop-the-violence/707831828,,,
Morristown ,Representative Rodney Frelinghuysen office,NJ,US,2017-05-05,about 120,120,,120,,,NJ-11th for Change,protest his support of AHCA,1,protest,0,0,0,0,0,1,https://www.nytimes.com/2017/05/08/health/republican-health-care-bill-protests.html,,,
New Haven,outside School of Management; Yale University,CT,US,2017-05-05,about 100,100,,100,,,graduate students,pro-union,1,rally,0,0,0,0,1,1,http://www.nhregister.com/general-news/20170505/yale-student-teachers-march-hunger-strikers-sit-outside-school-of-management-in-new-haven,,,
New York,East Harlem; Central Park East 1 school,NY,US,2017-05-05,about 80,80,,80,,,parents; students,want principal removed,0,boycott classes,0,0,0,0,1,1,http://pix11.com/2017/05/06/parents-pull-kids-from-harlem-school-in-one-day-protest-of-principal-they-say-is-destroying-it/,,,
New York,East Harlem; in front of Central Park East 1 school,NY,US,2017-05-05,dozens,24,,24,,,parents,want principal removed,0,protest,0,0,0,0,0,1,http://pix11.com/2017/05/06/parents-pull-kids-from-harlem-school-in-one-day-protest-of-principal-they-say-is-destroying-it/,,,
North Pole,North Pole Middle School,AK,US,2017-05-05,about 150,150,,150,,,students,against education funding cuts,0,walkout; protest,0,0,0,0,1,1,https://www.adn.com/alaska-news/education/2017/05/05/fairbanks-and-north-pole-students-stage-walkout-rally-against-proposed-education-cuts/,,,
Overland Park,outside office of Rep. Kevin Yoder (R);  79th Street in downtown,KS,US,2017-05-05,more than 100,100,,100,,,general protestors,against House health care bill,1,protest,0,0,0,0,1,1,http://www.kansascity.com/news/politics-government/article148828384.html,,,
Overland Park,outside office of Rep. Kevin Yoder (R);  79th Street in downtown,KS,US,2017-05-05,three dozen,36,,36,,,general protestors,against abortion; pro-Yoder,2,protest,0,0,0,0,0,1,http://www.kansascity.com/news/politics-government/article148828384.html,,,
Vista,at office of Rep Darrell Issa (R),CA,US,2017-05-05,,,,,,,general protestors,support Planned Parenthood; opposes funding cut,1,protest,,,,,1,1,http://www.reuters.com/article/us-usa-healthcare-planned-parenthood-idUSKBN181206,,,
Warner Robins,outside office of Rep Austin Scott,GA,US,2017-05-05,,,,,,,Georgia Women; Those Who Stand with Us,against House health care bill,1,protest,0,0,0,0,1,1,http://www.41nbc.com/2017/05/05/local-group-protests-healthcare-repeal-rep-austin-scotts-office/,,,
Washington,office of U.S. Rep. Blaine Luetkemeyer,MO,US,2017-05-05,,,,,,,general protestors,against House health care bill,1,protest,0,0,0,0,1,1,http://www.emissourian.com/local_news/washington/groups-protests-luetkemeyer-s-vote/article_fbf89ffc-31b3-11e7-bf45-c7bc0034bf9c.html,,,
Aberdeen,downtown Aberdeen post office,MD,US,2017-05-06,approx 40,40,,40,,,general protestors,demand accessible ramp at US Post Office,0,protest,0,0,0,0,1,1,http://www.baltimoresun.com/news/maryland/harford/aegis/entertainment/ph-ag-aberdeen-postoffice-rally-coverage-0510-20170507-story.html,,,
Arcata,at the farmer's market,CA,US,2017-05-06,about 100,100,,100,,,general protestors,justice for murder victim David Josiah Lawson,0,protest,0,0,0,0,1,1,http://www.krcrtv.com/north-coast-news/murder-suspects-release-ignites-protests-in-arcata/485141737,,,
Asheboro,1909 Historic Courthouse in downtown;  marched to the Asheboro Municipal Building on Church Street,NC,US,2017-05-06,about 90,90,,90,,,Silver Valley Redneck Revolt,anti-KKK ,0,rally,0,0,0,0,0,1,http://www.courier-tribune.com/news/20170506/rallies-against-kkk-find-support,,,
Asheboro,Memorial Park area,NC,US,2017-05-06,about 60,60,,60,,,general protestors,anti-KKK ,0,march,0,0,0,0,1,1,http://www.courier-tribune.com/news/20170506/rallies-against-kkk-find-support,,,
Bangor,Bangor High School,ME,US,2017-05-06,nearly 800,800,,800,,,Bangor High School Student Council; general protestors,suicide awareness,0,march,0,0,0,0,1,1,https://bangordailynews.com/2017/05/06/news/bangor/hundreds-walk-in-bangor-to-honor-area-teens-who-killed-themselves/,,,
Baton Rouge,outside the Baton Rouge Police Department headquarters,LA,US,2017-05-06,about 20,20,,20,,,New Black Panther Party,protest death of Alton Sterling,0,protest,0,0,0,0,1,1,http://www.theadvocate.com/baton_rouge/news/alton_sterling/article_735fb4da-3296-11e7-b824-cbf57a63beb1.html,,,
Battle Creek,Willard Library at 7 W. Van Buren St. to McCamly Square,MI,US,2017-05-06,,,,,,,general protestors,against bullying,0,protest,,,,,1,1,http://www.battlecreekenquirer.com/story/news/local/2017/05/04/march-against-bullying-saturday/101295190/,,,
Bedminster,corner of Route 206 and Lamington Road,NJ,US,2017-05-06,,40,,40,,,general protestors,pro-Trump,2,protest,0,0,0,0,1,1,http://www.newjerseyhills.com/bernardsville_news/news/protesters-supporters-greet-president-trump-in-bedminster/article_0cb89e9d-7c00-5e0d-85bf-9f8d04883593.html,,,
Bedminster,corner of Route 206 and Lamington Road,NJ,US,2017-05-06,about 40,40,,40,,,general protestors,anti-Trump ,1,protest,0,0,0,0,0,1,http://www.newjerseyhills.com/bernardsville_news/news/protesters-supporters-greet-president-trump-in-bedminster/article_0cb89e9d-7c00-5e0d-85bf-9f8d04883593.html,,,
Branchburg,drove from Branchburg past Trump National Golf Club to Clarence Dillon Public Library in Bedminster,NJ,US,2017-05-06,More than 30 cars,,,,,,general protestors,anti-Trump,1,protest motorcade; rally,0,0,0,0,1,1,http://www.mycentraljersey.com/story/news/politics/2017/05/06/anti-trump-protesters-take-bedminster-gear-up-summer-rallies/312036001/,https://www.washingtonpost.com/news/post-politics/wp/2017/05/06/spend-your-free-time-in-a-red-state-a-motorcade-of-protesters-rolls-by-trumps-n-j-property/?utm_term=.120057f4ff13,,
Buffalo,Grant St; Lafayette High School,NY,US,2017-05-06,more than 60,60,,60,,,Western New York Peace Center,pro-immigrants,1,march; rally,0,0,0,0,1,1,http://buffalonews.com/2017/05/06/community-advocates-march-support-refugees-immigrants/,,,
Buffalo,in front of Coca-Cola Field,NY,US,2017-05-06,,,,,,,Amalgamated Transit Union,rally for transit worker contract,0,rally,0,0,0,0,1,1,http://www.wgrz.com/news/local/transit-workers-rally-for-new-contract/437504690,,,
Cedar Falls,,IA,US,2017-05-06,about 40,40,,40,,,Americans for Democratic Action Iowa,against House health care bill; against U.S. Rep. Rod Blum's vote for bill,1,protest,0,0,0,0,1,1,http://www.kcrg.com/content/news/People-hold-rally-to-repeal-and-replace-Rep-Rod-Blum--421542623.html,,,
Columbus,Franklin Park,OH,US,2017-05-06,hundreds,200,,200,,,general protestors,support racial justice,0,march,0,0,0,0,1,1,http://nbc4i.com/2017/05/06/people-call-for-racial-justice-at-march-in-franklin-park/,,,
Daytona Beach,at the corner of South Atlantic Avenue and Revilo Boulevard,FL,US,2017-05-06,About half a dozen,6,,6,,,general protestors,neighborhood blight,0,protest,0,0,0,0,1,1,http://www.news-journalonline.com/news/20170506/daytona-beach-protesters-want-to-take-bite-out-of-blight,,,
Detroit,Lasher Road and Grand River Avenue,MI,US,2017-05-06,,,,,,,general protestors,peace rally; unsolved murders,0,rally,0,0,0,0,1,1,http://www.clickondetroit.com/news/families-of-unsolved-homicide-victims-attend-peace-rally-in-detroit,,,
Fargo,southeast corner of 13th Avenue South and 42nd Street,ND,US,2017-05-06,about 30,30,,30,,,Indivisible FM,against House health care bill,1,rally,0,0,0,0,1,1,http://www.valleynewslive.com/content/news/Indivisible-FM-rallies-against-AHCA-421541293.html,http://www.inforum.com/news/4262823-indivisible-fm-holds-pop-protest-against-health-care-measure-passed-house-republicans,,
Fort Worth,Burnett Park; march to Tarrant County Courthouse and back,TX,US,2017-05-06,,,,,,,DFW chapter of the National Organization for the Reform of Marijuana Laws,Marijuana March of North Texas; pro-legalization,0,march,,,,,1,1,http://www.star-telegram.com/news/local/article148857089.html,,,
Madison,outside Capitol,WI,US,2017-05-06,,,,,,,general protestors,"against House health care bill; ""Save American Healthcare""",1,rally; die-in,0,0,0,0,1,1,http://www.channel3000.com/news/politics/die-in-held-at-capitol-to-protest-new-health-care-bill/485063076,,,
Memphis,Morris Park,TN,US,2017-05-06,about 50,50,,50,,,Homeless Organizing for Power and Equality,call for city-run homeless shelter,0,protest,0,0,0,0,1,1,https://www.memphisdailynews.com/news/2017/may/9/morris-park-tent-city-calls-for-city-run-homeless-shelter/,,,
New York,"Staten Island; Salvation Army on Broad Street in Stapleton, and continued down Bay Street and Richmond Terrace before ending at the Richmond County Ballpark in St. George.",NY,US,2017-05-06,hundreds,200,,200,,,general protestors; misc churches,against drug epidemic,0,march,0,0,0,0,1,1,http://www.silive.com/news/2017/05/hundreds_march.html,,,
Otis,Otis State Forest,MA,US,2017-05-06,na,6,,6,,,general protestors,protesting the extension of the Tennessee Gas Pipeline,0,protest,6,0,0,0,1,1,https://www.bostonglobe.com/metro/2017/05/06/six-arrested-sandisfield-pipeline-protest/G1kVZfrPuGM2Ef3deYM5iN/story.html,,,(civil dis)
Palm Bay,the southeast corner of Palm Bay Road and Babcock Street,FL,US,2017-05-06,about 80; more than 100,80,,100,,,general protestors,pro-immigrants,1,protest,0,0,0,0,1,1,http://www.floridatoday.com/story/news/2017/05/06/immigration-debate-leads-rally-palm-bay/101372848/,,,
Patchogue,Blue Point Brewery,NY,US,2017-05-06,,,,,,,workers,strike against Clare Rose beer distributor,0,rally,0,0,0,0,1,1,http://www.newsday.com/long-island/suffolk/striking-clare-rose-workers-stage-rally-at-brewery-1.13576006,,,
Salt Lake City,in front of Capitol,UT,US,2017-05-06,thousands,2000,,2000,,,general protestors,in support of the Bears Ears and Grand Staircase Escalante National Monuments,0,rally,0,0,0,0,1,1,https://www.stgeorgeutah.com/news/archive/2017/05/07/fxn-thousands-rally-in-support-of-national-monuments-ahead-of-interior-secretarys-visit-to-utah/#.WRBeylKZNsM,,,
Sioux Falls,office of Rep. Kristi Noem,SD,US,2017-05-06,na,60,,60,,,The People’s Justice Project; general protestors,against House health care bill,1,protest,0,0,0,0,1,1,http://kelo.com/news/articles/2017/may/07/ahca-protests-in-sioux-falls/,,,
St. Paul,inside Capitol,MN,US,2017-05-06,30 or so; around 50,30,,50,,,general protestors,pro-Trump; 100 days,2,rally,0,0,0,0,1,1,http://www.startribune.com/protesters-trump-supporters-clash-at-minnesota-state-capitol/421529753/#1,http://www.twincities.com/2017/05/06/trump-rally-overshadowed-by-standoff-outside-minnesota-capitol/,,
St. Paul,outside Capitol,MN,US,2017-05-06,about 200,200,,200,,,anti-Fascist group,anti-Trump,1,protest,0,0,0,0,0,1,http://www.startribune.com/protesters-trump-supporters-clash-at-minnesota-state-capitol/421529753/#1,http://www.twincities.com/2017/05/06/trump-rally-overshadowed-by-standoff-outside-minnesota-capitol/,,
St. Paul,outside Capitol,MN,US,2017-05-06,about 50,50,,50,,,white nationalist,pro-Trump,2,protest,0,0,0,0,0,1,http://www.startribune.com/protesters-trump-supporters-clash-at-minnesota-state-capitol/421529753/#1,http://www.twincities.com/2017/05/06/trump-rally-overshadowed-by-standoff-outside-minnesota-capitol/,,
St. Petersburg,North Straub Park,FL,US,2017-05-06,about 50,50,,50,,,Women's March Pinellas,"against House health care bill; ""Save American Healthcare""",1,rally,0,0,0,0,1,1,http://www.tampabay.com/blogs/baybuzz/charlie-crist-womens-march-pinellas-organizers-rally-in-st-petersburg-to/2323055,,,
Trenton,city hall,NJ,US,2017-05-06,,,,,,,general protestors; Team 26,support gun control,1,protest,0,0,0,0,1,1,http://www.trentonian.com/social-affairs/20170506/trenton-gun-control-rally-greets-out-of-state-activists-on-bike-tour,,,
Valdosta,Drexel Park,GA,US,2017-05-06,,,,,,,general protestors,against campus (gun) carry,0,protest,0,0,0,0,1,1,http://www.valdostadailytimes.com/news/local_news/residents-protest-campus-carry/article_2609e543-510a-5ef6-b55a-57030a205340.html,,,
Waco,Indian Spring Park; marched down University Parks Drive ,TX,US,2017-05-06,dozens,24,,24,,,Waco Immigrants Alliance,pro-immigrants,1,march; rally,0,0,0,0,1,1,http://www.kwtx.com/content/news/Waco-Middle-school-student-hosts-protest-march-with-Waco-Immigration-Alliance-421545033.html,,,
Atlanta,,GA,US,2017-05-07,,,,,,,,against House health care bill,1,protest,0,0,0,0,1,1,http://www.11alive.com/news/politics/die-ins-protests-planned-over-obamacare-repeal/437400058,,,
Austin,outside Governor's Mansion,TX,US,2017-05-07,about 100,100,,100,,,general protestors,against Texas law that bans sanctuary cities,1,protest,,0,0,0,1,1,http://www.statesman.com/news/local/dozens-protest-law-banning-sanctuary-cities-governor-mansion/SXfdfcis218btc7PnYkSDI/,,,
Bentonville,Bentonville Square,AR,US,2017-05-07,,,,,,,Ozark Indivisible,against House health care bill,1,die-in,0,0,0,0,1,1,http://www.nwahomepage.com/news/die-in-protest-held-in-bentonville/708956975,,,
Charleston,outside school distric office,SC,US,2017-05-07,about 250,250,,250,,,general protestors,protesting poor educational funding,0,protest,0,0,0,0,1,1,http://www.postandcourier.com/news/anger-boils-over-at-charleston-county-school-district-protest-morale/article_1273ee06-31bb-11e7-9f8f-371b6b5e00bb.html,,,
Colorado Springs,Putside city hall,CO,US,2017-05-07,about 200,200,,200,,,general protestors,anti-Trumpcare,1,protest,0,0,0,0,1,1,http://gazette.com/gallery/6386/pictures/1389024/,,,
Houston,outside of office of US Rep. John Culberson,TX,US,2017-05-07,dozens,24,,24,,,general protestors; Houston Democratic Socialists of America,against House health care bill,1,protest,0,0,0,0,1,1,http://www.chron.com/business/article/Protests-target-Culberson-s-yes-vote-for-GOP-11128430.php,,,
Mount Kisco,Read more here: http://www.star-telegram.com/news/local/article148857089.html#storylink=cpy,NY,US,2017-05-07,hundreds,200,,200,,,Read more here: http://www.star-telegram.com/news/local/article148857089.html#storylink=cpy,pro-immigrants,1,march,0,0,0,0,1,1,http://westchester.news12.com/news/hundreds-march-in-mount-kisco-in-support-of-immigrants-1.13578466,,,
Naples,in front of Orangetree Publix in Golden Gate Estates,FL,US,2017-05-07,,,,,,,The Coalition of Immokalee Workers,protest Publix not member of Fair Food Program; pro-worker rights,0,protest,0,0,0,0,1,1,http://www.naplesnews.com/story/news/local/2017/05/07/farmworkers-protest-new-publix/101404420/,,,
New Orleans,Congo Square to Lee Circle,LA,US,2017-05-07,at least 300; more than 700,300,,700,,,Take Em Down,against confederate monument,0,march,0,0,0,0,1,1,http://www.wwltv.com/news/local/orleans/protesters-on-both-sides-of-confederate-monuments-debate-meet-at-lee-circle/437606216,http://www.nola.com/politics/index.ssf/2017/05/confederate_monument_new_orlea.html,,
New Orleans,,LA,US,2017-05-07,(included above),,,,,,general protestors,support confederate monument,0,demonstration,0,0,0,0,0,1,http://www.wwltv.com/news/local/orleans/protesters-on-both-sides-of-confederate-monuments-debate-meet-at-lee-circle/437606216,http://www.nola.com/politics/index.ssf/2017/05/confederate_monument_new_orlea.html,,
Troy,Prouty Plaza,OH,US,2017-05-07,approximately 25-30,25,,30,,,Indivisible Miami County; Indivisible OH8; Indivisible Springfield,against House health care bill,1,rally,0,0,0,0,1,1,http://tdn-net.com/news/22454/groups-protest-davidson-vote,,,
Austin,outside Governor's Mansion,TX,US,2017-05-08,,,,,,,general protestors,against Texas law that bans sanctuary cities,1,protest,0,0,0,0,1,1,http://www.washingtontimes.com/news/2017/may/8/united-latin-american-citizens-file-lawsuit-sanctu/,http://kxan.com/2017/05/07/protest-against-signed-sanctuary-cities-bill-sparks-outside-govenors-mansion/,,
Dubuque,outside town hall,IA,US,2017-05-08,,,,,,,general protestors,protest against representative Ron Blum's support of AHCA,1,protest,0,0,0,0,1,1,http://kdth.radiodubuque.com/protest-planned-blums-dubuque-town-hall/,,,
Encitas,downtown overpass,CA,US,2017-05-08,more than 100,100,,100,,,members of the Wagon Circle,against Congressman Darrell Issa's support of AHCA,1,protest,0,0,0,0,1,1,http://fox5sandiego.com/2017/05/08/protesters-question-congressman-darrell-issas-health-care-vote/,,,
Houston,inside the Harris County Republican offices,TX,US,2017-05-08,,,,,,,general protestors,against Texas law that bans sanctuary cities,1,protest,0,0,0,0,1,1,http://www.click2houston.com/news/protesters-of-texas-sanctuary-cities-ban-take-over-harris-county-gop-office,,,
Jackson,Rep Tim Walberg's office,MI,US,2017-05-08,about 60,60,,60,,,general protestors,against Tim Walberg's support of AHCA,1,protest,0,0,0,0,1,1,http://www.rollcall.com/news/politics/republicans-face-wrath-health-care-vote-town-halls,,,
McAllen,outside a Texas Department of Public Safety building,TX,US,2017-05-08,about 50,50,,50,,,general protestors,against Texas law that bans sanctuary cities,1,protest,0,0,0,0,1,1,http://www.themonitor.com/news/local/article_e7e7603a-345a-11e7-9c4c-8fc4679eacef.html,,,
Muskogee,Outside restaurant,OK,US,2017-05-08,about a dozen,12,,12,,,general protestors,protesting congressman's vote for AHCA,1,protest; die-in,0,0,0,0,1,1,http://www.muskogeephoenix.com/news/local_news/mullin-visit-draws-protesters-opposing-ahca/article_adc9f130-145a-57d6-a1f5-dd44e694fb4f.html,,,
Nashville,Outside Omni hotel,TN,US,2017-05-08,,,,,,,general protestors,protesting Kellyanne Conway's visit,1,protest,0,0,0,0,1,1,http://wkrn.com/2017/05/08/kellyanne-conway-visits-nashville-but-not-without-protest/,,,
Plattsburgh,Mountain Lake PBS,NY,US,2017-05-08,about 250,250,,250,,,general protestors,"protest Rep. Elise Stefanik, R-N.Y.support for ACHA",1,protest,0,0,0,0,1,1,http://www.npr.org/2017/05/09/527533782/at-town-hall-meeting-republican-lawmaker-gets-an-earful,,,
Reno,Pickett Park,NV,US,2017-05-08,several people,,,,,,general protestors,against Rep Amodi's support of AHCA,1,protest; die-in,0,0,0,0,1,1,http://mynews4.com/news/local/reno-die-in-protests-gop-health-care-bill-rep-amodei,,,
Richmond,U.S. Circuit Court of Appeals,VA,US,2017-05-08,dozens,24,,24,,,general protestors,against Trump's travel ban,1,protest,0,0,0,0,1,1,http://www.richmond.com/news/photos-protest-over-travel-ban-outside-u-s-court-of/collection_e3c8e7df-561a-53d0-812d-4cd370571c49.html#11,Photo count,,http://wtop.com/travel/2017/05/trumps-muslim-comments-haunt-travel-ban-appeal/
San Diego,outside City Hall,CA,US,2017-05-08,a few hundred,300,,300,,,general protestors,against city cuts for Arts funding,0,protest,0,0,0,0,0,1,http://www.sandiegouniontribune.com/news/politics/sd-me-arts-protest-20170508-story.html,,,
San Diego,Requeza Street overpass in Encinitas ,CA,US,2017-05-08,about 100,100,,100,,,San Diego Indivisible; general protestors,against Congressman Darrell Issa for his support of AHCA,1,protest,0,0,0,0,1,1,http://www.cbs8.com/story/35377095/protesters-call-to-repeal-and-replace-congressman-issa,,,
Seattle,"12 Chase Banks in Fremont, Wedgwood, Northgate, the University District, Queen Anne, the Central District, Capitol Hill, and downtown",WA,US,2017-05-08,about 200,200,,200,,,350 Seattle,against Keystone XL pipeline,1,protest,26,0,0,0,1,1,https://patch.com/washington/seattle/seattle-protesters-close-12-chase-bank-locations-over-keystone-xl-pipeline,,,civil dis
Tallahassee,outside of Congressman Neal Dunn's office,FL,US,2017-05-08,dozens,,,,,,general protestors,against Rep Dunn's support of AHCA,1,protest; die-in,0,0,0,0,1,1,http://www.wctv.tv/content/news/Local-Protesters-hold-die-in-outside-US-Congressmans-office-421692574.html,,,
Columbus,outside statehouse,OH,US,2017-05-09,hundreds,200,,200,,,general protestors,rally to let state officials know they're happy with the status of education,0,rally,0,0,0,0,1,1,http://www.ohio.com/news/break-news/supporters-of-largest-ohio-online-school-rally-at-statehouse-1.765771?cache=18961415304345%2525252525252Fnews%2525252525252Fohio%2525252525252Fcss%2525252525252Fresults%25252525252525%25252525252527+and+1%2525252525,,,
Durham,UNH Campus,NH,US,2017-05-09,a small group,,,,,,students/faculty,against state voting law,0,protest,0,0,0,0,1,1,http://www.fosters.com/news/20170509/unh-students-rally-against-voting-changes,,,
Fontana,Jessie Turner Center,CA,US,2017-05-09,hundreds,200,,200,,,Laborer’s International Union of North America (LiUNA); general protestors,against proposed Southern California Edison rate increases.,0,protest,0,0,0,0,1,1,http://www.fontanaheraldnews.com/business/hundreds-gather-in-fontana-to-express-concern-about-proposed-sce/article_a6ebe574-35d6-11e7-85fa-63f4a41b436a.html,,,
Forest Lake ,Forest Lake High School,MN,US ,2017-05-09,over 1300,1300,,1300,,,area high school students,protest against city vote to disband police force,0,protest,0,0,0,0,1,1,http://www.twincities.com/2017/05/09/forest-lake-students-walk-out-to-support-police-after-city-moves-to-disband-force/,,,
Greenville,Senator L. Graham’s office,SC,US,2017-05-09,,,,,,,general protestors,protest Graham's support of AHCA,1,protest,0,0,0,0,1,1,http://wspa.com/2017/05/09/anti-trump-rally-protests-healthcare-reform-in-greenville/,,,
Hartford,Bushnell Park,CT,US,2017-05-09,more than 2000,2000,,2000,,,realtors,resolve state budget problems,0,rally,0,0,0,0,1,1,http://www.courant.com/politics/hc-realtor-rally-legislative-agenda-hartford-20170509-story.html,,,
Huntington Beach ,US Rep Dana Rohrabacher's office (R),CA,US,2017-05-09,about 30,30,,30,,,Indivisible OC,against Rep. Dana Rohrabacher support of AHCA,1,protest,0,0,0,0,1,1,http://www.latimes.com/socal/daily-pilot/news/tn-dpt-me-protest-20170509-story.html,,,
Muskogee,Cowboy's BBQ,AZ,US,2017-05-09,about a dozen,12,,12,,,general protestors,against Sen. Mullin's support of AHCA,1,protest; die-in,0,0,0,0,1,1,http://www.tahlequahdailypress.com/news/local_news/mullin-visit-draws-protesters-opposing-ahca/article_263b4644-e51a-5d80-a2f8-b4f61ceeb459.html,,,
New York,Success Academy on West 118th Street and Malcolm X Boulevard; Harlem,NY,US,2017-05-09,Hundreds; over 200,200,,200,,,general protestors,against Paul Ryan and his support for the AHCA,1,protest,0,0,0,0,1,1,http://gothamist.com/2017/05/09/paul_ryan_harlem_visit.php,,,
New York,Trump Tower,NY,US,2017-05-09,,,,,,,9 Catholic organizations,against fossil fuels; support addressing climate change,1,protest,0,0,0,0,1,1,https://cruxnow.com/global-church/2017/05/11/nine-catholic-institutions-divest-fossil-fuels-ahead-g7/,,,
Normal,Outside Rep. Davis' office,IN,US,2017-05-09,about 30,30,,30,,,general protestors,Protesting his healthcare position,1,protest,0,0,0,0,1,1,http://www.pantagraph.com/news/local/government-and-politics/constituents-protest-as-davis-visits-normal/article_1f80f274-1028-588f-abaa-1afffd7e8ba6.html,,,
Orlando,US Sen. Marco Rubio's downtown office,FL,US,2017-05-09,about 100,100,,100,,,general protestors,against Rubio's support of the AHCA,1,protest; die-in,0,0,0,0,1,1,http://www.orlandosentinel.com/news/politics/political-pulse/os-rubio-protest-die-in-20170509-story.html,,,
Riverbank,protest outside a meet and greet with Rep. Jeff Denham,CA,US,2017-05-09,dozens; about 250,24,,250,,,general protestors,against Jeff Denham's support of AHCA,1,protest,0,0,0,0,1,1,http://www.mercurynews.com/2017/05/09/jeff-denham-angry-crowd-after-obamacare-repeal-vote/,,,
Salt Lake City,Grand America Hotel,UT,US,2017-05-09,100; hundreds,100,,200,,,Utah Indivisible; general protestors,protesting Betsy Devos,1,protest,0,0,0,0,1,1,http://www.ksl.com/?sid=44188852&nid=148,http://www.good4utah.com/news/us-secretary-betsy-devos-to-visit-salt-lake-city-school/710196274,,
San Andreas,at the Calaveras Unified School District complex,CA,US,2017-05-09,,,,,,,general protestors,"better pay, contract for teachers",0,protest,0,0,0,0,1,1,http://www.calaverasenterprise.com/news/article_0fb1c646-367c-11e7-864a-db68b50e7355.html,,,
Santa Cruz,,CA,US,2017-05-09,,,,,,,general protestors,pro-rights for homeless,0,protest,0,0,0,0,1,1,http://www.santacruzsentinel.com/article/NE/20170509/NEWS/170509658,,,
Topeka,University of Kansas,KS,US,2017-05-09,na,1,,1,,,Jacob Dorman PhD,against conceal-carry weapons policy on campus,1,protest; resignation,0,0,0,0,1,1,http://fox4kc.com/2017/05/05/ku-professor-resigns-in-light-of-concealed-carry-on-campus-calling-it-counterproductive-to-educational-mission/,,,
Tuscaloosa,outside Central Elementary,AL,US,2017-05-09,nearly a dozen,12,,12,,,Tuscaloosa County chapter of the NAACP,support new school construction,0,protest,0,0,0,0,1,1,http://www.tuscaloosanews.com/news/20170510/protest-held-outside-central-elementary,,,
Virginia Beach,Virginia Beach City Council ,VA,US,2017-05-09,,,,,,,flood victims,in protest of 2018 fiscal budget,0,protest,0,0,0,0,1,1,http://wavy.com/2017/05/09/virginia-beach-city-council-budget-vote-may-9-2017/,,,
