CityTown,Location,StateTerritory,Country,Date,EstimateText,EstimateLow,BestGuess,EstimateHigh,AdjustedLow,AdjustedHigh,Actor,Claim,Pro(2)/Anti(1),EventType,ReportedArrests,ReportedParticipantInjuries,ReportedPoliceInjuries,ReportedPropertyDamage,TownsCities,Events,Source1,Source2,Source3,Misc.
Evanston,Northwestern University sociology class,IL,US,2017-05-16,group of students,,,,,,group of students,protesting a US ICE public relations offiicer invited to offer guest lecture in sociology class,1,protest,0,0,0,0,1,1,https://dailynorthwestern.com/2017/05/17/campus/students-protest-ice-representatives-visit-to-campus/,http://time.com/4783252/northwestern-sociology-class-ice-protest/,,
Nashville,Outside home of Senator Alexander,TN,US,2017-05-16,more than 100,100,,100,,,Moral Movement Tennessee,Against AHCA,1,protest,0,0,0,0,1,1,http://www.tennessean.com/story/news/local/2017/05/16/group-hold-candlelight-vigil-sen-lamar-alexanders-nashville-home-protest-trumpcare/325903001/,,,
Pasadena,"Campus of Caltech, Astronomy Department",CA,US,2017-05-16,several dozen,24,,24,,,undergraduate students,protest against the return of a professor accused of harrassing female graduate students,0,protest,0,0,0,0,1,1,https://www.insidehighered.com/quicktakes/2017/05/18/caltech-students-protest-known-harassers-return,,,
Providence,State house,RI,US,2017-05-16,nearly 200,200,,200,,,general protesting,rally for legalization of marijuana.,0,rally,0,0,0,0,1,1,http://www.providencejournal.com/news/20170516/proponents-of-legalizing-pot-rally-as-lawmakers-opt-for-more-study--poll,,,
Santa Rosa,From a comunity college to the town registrat,CA,US,2017-05-16,about 40,40,,40,,,general protestors,march supporting rent control,0,rally; march,0,0,0,0,1,1,http://www.pressdemocrat.com/news/7000865-181/march-for-rent-control-in,,,
Vista,1800 Thibodo Rd,CA,US,2017-05-16,,,,,,,general protesters,"against President Trump, against U.S. Representative Darryl Issa",1,demonstration,,,,,1,1,https://www.latimes.com/politics/la-pol-ca-issa-protest-20180425-htmlstory.html,,,
Vista,1800 Thibodo Rd.,CA,US,2017-05-16,,,,,,,general protesters,for President Trump,2,counter-protest,,,,,0,1,https://www.latimes.com/politics/la-pol-ca-issa-protest-20180425-htmlstory.html,,,
Washington,"1600 block of 23rd Street NW, on Sheridan Circle; outside the Turkish Ambassador's Residence",DC,US,2017-05-16,,,,,,,general protestors,protest during Erdogan visit to US,0,protest,0,10,0,0,0,1,http://www.nbcwashington.com/news/local/Protest-Outside-Turkish-Ambassadors-DC-Home-422618484.html,,,
Washington,Department of Justice,DC,US,2017-05-16,,,,,,,general protestors,against AG Session's new war on drugs,1,rally,,,,,1,1,https://www.facebook.com/events/428543100847852/?,,,
Washington,In front of Turkish Embassy,DC,US,2017-05-16,massive group,,,,,,general protestors,against Turkish President Erdogan's regime,0,protest,2,9,0,0,0,1,http://thehill.com/policy/international/333995-turkish-embassy-calls-violent-clash-with-protesters-self-defense,,,
Wilmington,from Wells Fargo Branch to JPMorgan Chase & Co.’s annual meeting,DE,US,2017-05-16,about 250,250,,250,,,general protestors,to protest financing of private prisons and CEO Jamie Dimon’s seat on President Trump’s business advisory council,1,demonstration,0,0,0,0,1,1,http://www.newsweek.com/jpmorgan-chase-jamie-dimon-immigration-private-prison-protest-make-road-610463,,,
Hazelwood,Hazelwood West High School,MO,US,2017-05-17,nearly 2 dozen,24,,24,,,high school students,against suspension of students who walked out in support of teacher contract negotiations ,0,protest,0,0,0,0,1,1,http://fox2now.com/2017/05/17/new-protest-planned-after-student-march-leads-to-suspensions/,,,
Los Angeles,outside the home of US Rep. Maxine Waters (D-CA),CA,US,2017-05-17,more than a dozen,12,,12,,,Latinos for Trump; general protestors,impeach Waters because she called for impeaching Trump,2,protest,0,0,0,0,1,1,http://www.americanow.com/story/politics/2017/05/17/protesters-call-maxine-waters-impeachment,,,
New London,Along Rt. 32 near Coast Guard Academy,CT,US,2017-05-17,about 50,50,,50,,,Trump supporters,support of Trump at Coast Guard Academy,2,protest,0,0,0,0,0,1,http://www.courant.com/politics/hc-trump-coast-guard-commencement-20170516-story.html,,,
New London,McKinley Park in New London,CT,US,2017-05-17,about 300,300,,300,,,Ragin' Grannies of Westerly; general protestors,against Trump's speech at Coast Guard Academy,1,protest,0,0,0,0,1,1,http://www.courant.com/politics/hc-trump-coast-guard-commencement-20170516-story.html,,,
Oakland,Downtown,CA,US,2017-05-17,,,,,,,general protestors,protesting the arrest of a street vendor,0,protest,0,0,0,0,1,1,http://www.eastbaytimes.com/2017/05/17/fruit-vendors-arrest-by-sheriffs-deputy-spurs-protest/,,,
Pittsburgh,Outside Consol Energy,PA,US,2017-05-17,,500,,1500,,,United Mine Workers of America,Protesting heathcare cuts,0,protest,2,0,0,0,1,1,http://www.post-gazette.com/business/pittsburgh-company-news/2017/05/17/Coal-miners-protest-health-benefit-cuts-Consol-Energy-rally/stories/201705170165,,,
San Francisco,UC Board of Regents Meeting at UCSF Mission Bay campus,CA,US,2017-05-17,dozens,24,,96,,,UC students; UC workers,disrupted meeting to protest increased tuition and fees  in light of recent audit of UC President's office,0,rally,0,0,0,0,1,1,http://www.sfgate.com/news/article/Students-protesting-hidden-funds-shut-down-UC-11152991.php,,,
Trenton,Trenton Thunder parking lot,NJ,US,2017-05-17,more than 350,350,,350,,,high school students,protest inadequate state funding for education,0,protest,0,0,0,0,1,1,http://www.nj.com/ocean/index.ssf/2017/05/lakewood_student_protests.html,,,
Tulsa,Plaza outside the Courthouse,OK,US,2017-05-17,about 100,100,,100,,,general protestors,protest against the acquittal of a white police officer in a police shooting,0,protest,0,0,0,0,1,1,http://www.cbsnews.com/news/betty-shelby-acquittal-terence-crutcher-protests-tulsa-cop/,,,
Bridgeport,in front of City Hall Annex,CT,US,2017-05-18,more than 100,100,,100,,,general protestors; Black Lives Matter,police shooting,0,protest,0,0,0,0,1,1,http://www.ctpost.com/local/article/Negron-protest-held-outside-City-Hall-Annex-11157012.php,,,
Hazelwood,New Halls Ferry Rd; outside Hazelwood School District administration building,MO,US,2017-05-18,,,,,,,general protestors; high school students,against suspension of students who walked out in support of teacher contract negotiations ,0,protest,0,0,0,0,1,1,http://www.stltoday.com/news/local/education/hazelwood-reverses-controversial-suspensions-of-student-protesters/article_513bc871-2d1c-52c1-bf27-1fdad48266d8.html,,,
Pittsburgh,DCK Worldwide's Pittsburg office,PA,US,2017-05-18,dozen,12,,12,,,general protestors,to urge companies not to profit from border wall,1,protest,0,0,0,0,1,1,http://www.pghcitypaper.com/Blogh/archives/2017/05/18/pittsburghers-protest-local-firm-dck-worldwide-tied-to-detention-center-construction,,,
San Diego,Lincoln High School,CA,US,2017-05-18,,,,,,,students,protesting the interim principal,0,protest; walk-out,0,0,0,0,1,1,http://www.sandiegouniontribune.com/visuals/sd-lincoln-pg-high-students-walkout-in-protest-20170518-photogallery.html,,,
Shreveport,Caddo Parish Courthouse,LA,US,2017-05-18,,,,,,,general protestors,pro-Confederate monument,0,protest,0,0,0,0,1,1,http://www.arklatexhomepage.com/news/local-news/protests-meetings-continue-over-the-caddo-parish-confederate-monument/716782308,,,
Southbridge,,MA,US,2017-05-18,,,,,,,teachers,protest unfair contract; protest salary changes,0,demonstration,0,0,0,0,1,1,http://www.telegram.com/news/20170519/southbridge-teachers-protest-merit-based-compensation-plan,,,
St. Paul,steps of Derham Hall at St. Catherine University,MN,US,2017-05-18,about a dozen,12,,12,,,students,protesting the school's decision to cut music and theater programs,0,protest; sing-in,0,0,0,0,1,1,http://www.startribune.com/st-kate-s-music-theater-students-protest-demise-of-degrees-with-performances/422979913/,,,
Tulsa,Outside Tulsa County Courthouse,OK,US,2017-05-18,,,,,,,general protestors,Protesting officer Betty Shelby's manslaughter acquittal,0,protest,0,0,0,0,1,1,http://ktul.com/news/local/demonstrators-march-from-courthouse-through-streets-of-downtown,,,
Washington,outside Federal Communications Commission (FCC) headquarters,DC,US,2017-05-18,hundreds,50,,200,,,ACLU; Free Press; Electronic Frontier Foundation; Fight for the Future; members of Congress; general protesters,protesting FCC vote that opponents argue would erode net neutrality regulations,1,protest,0,0,0,0,1,1,https://www.commondreams.org/news/2017/05/18/fight-save-internet-takes-streets-fcc-votes-net-neutrality,http://www.washingtonexaminer.com/net-neutrality-rally-infiltrated-by-ban-drudge-and-breitbart-protesters/article/2623513,,
Wilsonville,World of Speed,OR,US,2017-05-18,,,,,,,Portland Tenants United,against celebration of rent increases,0,protest,0,0,0,0,1,1,http://portlandtribune.com/pt/9-news/360002-239842-renters-protest-lavish-event-held-for-property-managers-,,,
Boston,City Hall plaza,MA,US,2017-05-19,,,,,,,Vision Zero Coalition; safe streets and bicycle safety advocates ,"rally and memorial for pedestrians and cyclists killed or injured by cars on Boston streets; outcry against what advocates call ""victim-blaming"" comments by Mayor Marty Walsh",0,rally,,,,,1,1,https://www.bostonglobe.com/metro/2017/05/19/streets-are-for-people-vigil-set-for-boston-city-hall-plaza/Nvkv305raAatYM9i3KV4sJ/story.html,https://www.bostonglobe.com/metro/2017/05/18/group-plans-silent-vigil-protest-mayor-walsh-statements-about-bike-and-pedestrian-crashes/r2sJvP8rg8s3Ex6gBhIR7M/story.html,http://www.metro.us/news/local-news/boston/walshs-blame-bikers-pedestrians-protest,
Decatur,outside DeKalb Medical,GA,US,2017-05-19,,,,,,,general protestors,in opposition to the hospital’s birthing policies,0,protest,0,0,0,0,1,1,http://www.decaturish.com/2017/05/families-protest-birthing-polices-at-dekalb-medical-suspension-of-doctor/,,,
Los Angeles,outside of the Federal Building at 300 North Los Angeles Street (where ICE's local field office is),CA,US,2017-05-19,,,,,,,general protestors,protest detention of Claudia Rueda,1,protest,,,,,1,1,http://laist.com/2017/05/19/free_claudia_rueda_protests.php,,,
San Diego,outside of Border Patrol's San Ysidro Station at 311 Athey Avenue,CA,US,2017-05-19,,,,,,,general protestors,protest detention of Claudia Rueda,1,protest,0,0,0,0,1,1,http://laist.com/2017/05/19/free_claudia_rueda_protests.php,,,
Staten Island,Outside Spectrum store,NY,US,2017-05-19,over 100,100,,100,,,Electrical workers union,protesting Spectrum's employee conditions,0,protest,0,0,0,0,1,1,http://www.silive.com/news/2017/05/local_3_union_strikes_against.html,,,
Augusta,capitol,ME,US,2017-05-20,a small group,,,,,,Families for Treatment of Serious Mental Illness,rally for change in mental health care,0,rally,0,0,0,0,1,1,http://www.centralmaine.com/2017/05/20/small-group-gathers-in-augusta-to-rally-for-changes-to-mental-health-care-system/,,,
Boston,Boston Common,MA,US,2017-05-20,more than 4000,4000,,4000,,,general protestors,protesting eductaion cuts in Trump's budget,1,protest,0,0,0,0,1,1,https://www.bostonglobe.com/metro/2017/05/20/more-than-rally-oppose-education-cuts/riSR1gngNE99gN6vBdpjBK/story.html,,,
Butte,Civic Center,MT,US,2017-05-20,,,,,,,general protestors; Butte Area Rising Coalition ,B Sanders rally for candidate Rob Quist,1,rally,,,,,1,1,http://mtstandard.com/news/opinion/guest/local-coalition-leading-charge-of-protests/article_591079f3-1c3e-5d7c-b1c9-4f670e74da34.html,,,
Chicago,Chicago's South side,IL,US,2017-05-20,hundreds,200,,200,,,New Live Covenant Church,peace march; to end city's gun violence,0,march; vigil,0,0,0,0,1,1,http://www.nbcchicago.com/news/local/peace-march-on-south-side-draws-hundreds-despite-rainy-conditions-423404784.html,,,
Grove City,downtown,PA,US,2017-05-20,hundreds,200,,200,,,general protesting,Protesting VP Pence's visit,1,protest,0,0,0,0,1,1,http://www.wfmj.com/story/35478184/protesters-rally-against-vice-president-during-visit-to-grove-city,,,
Grove City,downtown,PA,US,2017-05-20,hundreds,200,,200,,,general protesting,rallying for VP Pence's visit,2,rally,0,0,0,0,1,1,http://www.wfmj.com/story/35478184/protesters-rally-against-vice-president-during-visit-to-grove-city,,,
Houston,Discovery Green,TX,US,2017-05-20,more than 150 ,150,,,,,general protestors,Black Lives Matter,1,protest,,,,,0,1,http://www.chron.com/local/article/Activists-protest-against-HPD-s-enforcement-of-SB4-11161354.php,http://www.chron.com/news/houston-texas/article/Black-Lives-Matter-march-draws-more-than-100-as-11161750.php,,
Houston,in front of the Houston Police Department headquarters downtown,TX,US,2017-05-20,,,,,,,general protestors,against new TX anti-sanctuary city law,1,protest,0,0,0,0,1,1,http://www.chron.com/local/article/Activists-protest-against-HPD-s-enforcement-of-SB4-11161354.php,,,
Lancaster,the courthouse steps and spilled into part of King Street,PA,US,2017-05-20,hundreds,200,,200,,,NAACP Lancaster and area faith groups,anti-racism; anti-KKK,0,protest,0,0,0,0,1,1,http://www.witf.org/news/2017/05/lancaster-rally-draws-250-people-to-protest-planned-cross-burning.php,,,
Memphis,Overton Square,TN,US,2017-05-20,several dozen,36,,36,,,Memphis Coalition of Concerned Citizens,highlight problems in city; anti-racism,0,protest; skits,0,0,0,0,1,1,https://www.memphisdailynews.com/news/2017/may/20/barbecue-decoy-surfaces-as-overton-square-protest-1/,,,
Missoula,University of Montana campus,MT,US,2017-05-20,about 3500,3500,,3500,,,general protestors,Bernie Sanders' rally for Rob Quist,0,rally,0,0,0,0,1,1,http://www.bozemandailychronicle.com/ap_news/montana/bernie-sanders-rallies-montana-voters-to-support-rob-quist/article_979dbd54-01b6-5580-8653-bfe31f4de160.html,,,
New York,"Brighton Beach, Brooklyn",NY,US,2017-05-20,,,,,,,general protestors,for LGBTQ+ pride,1,rally,,,,,1,1,https://www.riseandresist.org/past-actions,,,
Pomona,,,US,2017-05-20,,,,,,,Kennedy Austin Foundation,Million Mothers March,0,march,,,,,1,1,http://www.dailybulletin.com/social-affairs/20170518/why-mothers-will-march-in-pomona-on-saturday,,,
Pompano Beach,Pompona Beach,FL,US,2017-05-20,dozens,24,,24,,,general protestors,protesting off-shore drilling,0,protest,0,0,0,0,1,1,http://wsvn.com/news/local/dozens-hold-hands-on-pompano-beach-to-protest-offshore-drilling/,,,
Sacramento,Gov. Jerry Brown's downtown Sacramento mansion,CA,US,2017-05-20,a few dozen,36,,26,,,members of Democratic Party; general protestors,the Delegates Against Dirty Money march; anti-oil money,0,march,0,0,0,0,1,1,http://www.latimes.com/politics/essential/la-pol-ca-essential-politics-updates-progressives-bent-on-flushing-oil-money-1495332466-htmlstory.html,,,
San Diego,Ruocca Park downtown,CA,US,2017-05-20,,,,,,,veterans,Veterans March on America,0,march,,,,,1,1,http://www.sandiegouniontribune.com/military/veterans/sd-me-veterans-march-20170518-story.html,,,
Tulsa,intersection of Main and Third Streets,OK,US,2017-05-20,about 10,10,,10,,,general protestors,protest against the acquittal of a white police officer in a police shooting,0,protest; die-in,0,0,0,0,1,1,http://www.tulsaworld.com/homepagelatest/group-feigns-death-at-mayfest-to-protest-betty-shelby-verdict/article_447eb337-883e-5cab-bdfa-d4897342b4e3.html,,,
Washington,,DC,US,2017-05-20,,,,,,,general protestors; Operation Stand Together,The March Against Monsanto; anti-GMO; anti-herbicide,0,protest,,,,,1,1,https://www.benzinga.com/pressreleases/17/05/p9473275/march-against-monsanto-gears-up-for-sixth-global-protest-amid-epa-cance,,,
Cedar Rapids,,IA,US,2017-05-21,about 12,12,,12,,,general protestors,anti-AHCA; health care,1,rally;protest,0,0,0,0,1,1,http://www.thegazette.com/subject/news/health/cedar-rapids-rally-calls-for-medicare-for-all-20170521,,,
Dubuque,,IA,US,2017-05-21,about 40,40,,40,,,general protestors,medicare for all,1,rally; protest,0,0,0,0,1,1,http://www.kcrg.com/content/news/Medicare-for-all-rally-held-in-Dubuque-423514753.html,,,
Neligh,in field just north of Neligh,NE,US,2017-05-21,,,,,,,"activists, farmers, tribal leaders and members of the Cowboy-Indian Alliance",against Keystone pipeline,1,protest; planting,0,0,0,0,1,1,http://www.1011now.com/content/news/Planting-a-symbolic-protest-to-the-Keystone-XL-pipeline-423528393.html,,,
Oakland Park,outside U.S. citizenship/immigration building,FL,US,2017-05-21,,,,,,,general protesting,rally for Haitian immigrants,0,protest; rally,0,0,0,0,1,1,http://wsvn.com/news/local/protesters-rally-for-haitian-nationals-to-remain-in-us/,,,
South Bend,Notre Dame Commencement,IN,US,2017-05-21,more than 100 students; dozens,100,,150,,,We StaND For; graduating seniors,walkout during VP Mike Pence commencement address,1,protest,0,0,0,0,1,1,https://www.usatoday.com/story/news/nation-now/2017/05/21/mike-pence-notre-dame-speech/335083001/,https://www.washingtonpost.com/news/answer-sheet/wp/2017/05/21/protesting-notre-dame-students-walk-out-of-mike-pences-commencement-speech/?utm_term=.4550917d39b8,http://www.southbendtribune.com/news/politics/students-crowds-protesters-line-up-for-notre-dame-commencement-and/article_20104834-3e2c-11e7-8a0c-bfe8e6db6fff.html,https://www.washingtonpost.com/news/answer-sheet/wp/2017/05/17/notre-dame-students-plan-to-protest-against-mike-pence-at-commencement-and-the-university-is-okay-with-it/?utm_term=.763402a8f22f
South Bend,south of Notre Dame campus,IN,US,2017-05-21,dozens; about 300,100,,300,,,"We StaND For; South Bend Equality; We Go High! of St. Joe County, IN; Michiana Alliance for Democracy; Alliance for Democracy; the Nu Black Power Movement; Inclusive Michiana; Planned Parenthood of Indiana & Kentucky; and the IWW Local 26",against VP Mike Pence in solidarity with walk-out graduates,1,protest,0,0,0,0,0,1,https://www.usatoday.com/story/news/nation-now/2017/05/21/mike-pence-notre-dame-speech/335083001/,,https://www.washingtonpost.com/news/answer-sheet/wp/2017/05/17/notre-dame-students-plan-to-protest-against-mike-pence-at-commencement-and-the-university-is-okay-with-it/?utm_term=.763402a8f22f,
Binghamton ,outside US Rep Claudia Tenney's office,NY,US,2017-05-22,,,,,,,general protestors,demand town hall meeting; anti-ACHA,1,protest,0,0,0,0,1,1,http://www.wbng.com/story/35490220/protesters-call-on-tenney-to-meet-with-constituents,,,
Champaign,Mellon Administration Building,IL,US,2017-05-22,more than 100; about 60,60,,100,,,general protestors,protesting firing of a school janitor,0,protest;rally,0,0,0,0,1,1,http://www.news-gazette.com/news/local/2017-05-22/dismissal-champaign-schools-facilities-director-draws-protest.html,,,
Chicago,Levi Hall; University of Chicago,IL,US,2017-05-22,around 50,50,,50,,,African Caribbean Students Association; Arab Student Association; Movimiento Estudiantil Chicanx de Aztlan; Organization of Black Students; Organization of Latin American Students; PanAsia Solidarity Coalition,make campus better for minority students,0,rally,0,0,0,0,1,1,https://www.chicagomaroon.com/article/2017/5/23/students-protest-fiji-present-petition-demand-rall/,,,
Columbus,Columbus City Hall,OH,US,2017-05-22,about 100,100,,100,,,People's Justice Project,protesting gun violence,0,protest,0,0,0,0,1,1,http://nbc4i.com/2017/05/22/protesters-march-to-columbus-city-hall/,,,
Harrisburg,State Capitol building,PA,US,2017-05-22,,23,,200,,,March on Harrisburg,"protesting gifts, political graft, corruption, and gerrymandering",0,protest,23,0,0,0,1,1,http://www.philly.com/philly/news/politics/state/protest-arrest-harrisburg-lobbyists-gifts.html,http://fox43.com/2017/05/23/23-arrested-in-pa-capitol-protest/,,
Kalamazoo,outside Kalamazoo Central High School,MI,US,2017-05-22,about 25,25,,25,,,Michigan Coalition Against Racism in Sports and Media,against use of term Redskin as sports team nickname,0,protest,0,0,0,0,1,1,http://www.mlive.com/news/kalamazoo/index.ssf/2017/05/use_of_redskins_name_draws_pro.html,http://wwmt.com/news/local/protesters-campaign-against-paw-paw-mascot-at-k-central-baseball-game,,
Menomonie,Menomonie High School,WI,US,2017-05-22,about 40,40,,40,,,students,protesting racist message,0,protest,0,0,0,0,1,1,http://www.leadertelegram.com/News/Front-Page/2017/05/22/Standingfor-equality.html,,,
New Haven,Yale Commencement; march down Dixwell Avenue,CT,US,2017-05-22,up to 1000; some 1500,1000,,1500,,,UNITE Here; Local 33,against Yale's refusal to engage in collective bargaining process for unionization of graduate students,1,protest,0,0,0,0,1,1,http://www.newhavenindependent.org/index.php/archives/entry/yale_day/,http://wnpr.org/post/yale-graduate-students-hold-peaceful-protest-and-end-hunger-strike,,
Newington,Shattuck Way; in front of Westinghouse Electric Company ,NH,US,2017-05-22,about 30,30,,30,,,Local 651 labor union,against lockout,0,protest,0,0,0,0,1,1,http://www.fosters.com/news/20170522/workers-protest-lockout-at-westinghouse,,,
Prospect Heights,River Trails condominiums,IL,US,2017-05-22,,,,,,,Residents of the River Trails condominiums,against sale of complex to new developer,0,protest,0,0,0,0,1,1,http://www.dailyherald.com/news/20170522/prospect-heights-residents-protest-plans-to-convert-condos-to-apartments,,,
Royal Oak,Royal Oak City Hall,MI,US,2017-05-22,more than 100,100,,100,,,general protesting,protesting budget which requires residents to pay for sidewalks,0,protest,0,0,0,0,1,1,http://www.theoaklandpress.com/general-news/20170523/royal-oak-neighbors-protest-city-order-to-install-sidewalks,,,
San Antonio,The Alamo,TX,US,2017-05-22,dozens,24,,24,,,War Affected Minds Group,to remember Fallen Firefighter Scott Deem,0,march; vigil,0,0,0,0,1,1,http://foxsanantonio.com/news/local/dozens-march-through-downtown-to-remember-ff-scott-deem,,,
Chicago,Chicago's Trump Tower,IL,US,2017-05-23,thousands,2000,,2000,,,Fight for 15,"against McDonald's, for increase in minimum wage and union rights",1,march,0,0,0,0,0,1,https://www.commondreams.org/news/2017/05/23/massive-march-mcdonalds-takes-donald-trump-corporations,,,
Chicago,Daley Plaza,IL,US,2017-05-23,hundreds ,200,,200,,,low wage workers,for increase in minimum wage,0,march,0,0,0,0,1,1,http://abc7chicago.com/news/workers-march-in-chicago-for-hike-in-minimum-wage/2028155/,,,
Gainesville,downtown,FL,US,2017-05-23,dozens,24,,24,,,general protestors,protect confederate statue,0,protest,0,0,0,0,1,1,http://www.wcjb.com/local-news/2017/05/fate-confederate-soldier-statue-yields-protest,,,
Gainesville,downtown,FL,US,2017-05-23,(see above),,,,,,general protestors,take down confederate statue,0,protest,0,0,0,0,0,1,http://www.wcjb.com/local-news/2017/05/fate-confederate-soldier-statue-yields-protest,,,
Seattle,Fremont neighborhood,WA,US,2017-05-23,,,,,,,pilots,pay increase from Amazon,0,protest,0,0,0,0,1,1,http://www.cnbc.com/2017/05/23/amazons-shareholders-meeting-protest-in-pictures.html,http://www.cnbc.com/2017/05/22/amazon-shareholders-meeting-protest-prime-air-pilots.html,,
Seattle,Fremont neighborhood,WA,US,2017-05-23,,,,,,,general protestors,anti-hate; opposed to  Amazon's continued advertisements on right-wing website Breitbart,1,protest,0,0,0,0,0,1,http://www.cnbc.com/2017/05/23/amazons-shareholders-meeting-protest-in-pictures.html,,,
Seattle,Fremont neighborhood,WA,US,2017-05-23,,,,,,,general protestors,protest Amazon employment practices,0,protest,0,0,0,0,0,1,http://www.cnbc.com/2017/05/23/amazons-shareholders-meeting-protest-in-pictures.html,,,
Sheboygan,Outside a local school,MI,US,2017-05-23,about 85,85,,85,,,general protestors,immigrants rights protests,1,protest,0,0,0,0,1,1,http://www.sheboyganpress.com/story/news/2017/05/23/immigration-activists-rally-sasd-meeting/102079448/,,,
St. Louis,Forest Park,MO,US,2017-05-23,,,,,,,general protestors,protect confederate statue,0,protest,0,0,0,0,1,1,http://www.stltoday.com/news/local/metro/protesters-on-both-sides-square-off-at-confederate-statue-in/article_8bf37f5e-3a8c-5a68-b69d-5ec0ed271d4b.html,,,
St. Louis,Forest Park,MO,US,2017-05-23,,,,,,,general protestors,take down confederate statue,0,protest,0,0,0,0,0,1,http://www.stltoday.com/news/local/metro/protesters-on-both-sides-square-off-at-confederate-statue-in/article_8bf37f5e-3a8c-5a68-b69d-5ec0ed271d4b.html,,,
Vista,1800 Thibodo Rd,CA,US,2017-05-23,,,,,,,general protesters,"against President Trump, against U.S. Representative Darryl Issa",1,demonstration,,,,,1,1,https://www.latimes.com/politics/la-pol-ca-issa-protest-20180425-htmlstory.html,,,
Vista,1800 Thibodo Rd.,CA,US,2017-05-23,,,,,,,general protesters,for President Trump,2,counter-protest,,,,,0,1,https://www.latimes.com/politics/la-pol-ca-issa-protest-20180425-htmlstory.html,,,
Boston,Boston Common,MA,US,2017-05-24,,,,,,,EPA employees in New England,march and rally protesting federal budget cuts to Environmental Protection Agency (EPA),1,march; rally,,,,,1,1,http://boston.cbslocal.com/2017/05/21/epa-protest-boston-environmental-budget-cuts-new-england/,,,
Buffalo,Erie County Holding Center,NY,US,2017-05-24,,,,,,,Showing Up for Racial Justice in Buffalo,against Erie County Sheriff Timothy B. Howard's management of the county's jails and his appearance at a pro-Trump rally.,1,protest,5,0,0,0,0,1,http://buffalonews.com/2017/05/24/nine-arrested-two-protests-erie-county-sheriff/,,,
Buffalo,Outside Erie County Holding Center,NY,US,2017-05-24,na,70,,70,,,Showing Up for Racial Justice in Buffalo,against Erie County Sheriff Timothy B. Howard's management of the county's jails and his appearance at a pro-Trump rally.,1,protest,0,0,0,0,0,1,http://buffalonews.com/2017/05/24/nine-arrested-two-protests-erie-county-sheriff/,,,
