CityTown,Location,StateTerritory,Country,Date,EstimateText,EstimateLow,BestGuess,EstimateHigh,AdjustedLow,AdjustedHigh,Actor,Claim,Pro(2)/Anti(1),EventType,ReportedArrests,ReportedParticipantInjuries,ReportedPoliceInjuries,ReportedPropertyDamage,TownsCities,Events,Source1,Source2,Source3,Misc.,
Rogers,Frisco Stage,AR,US,2017-06-03,about 130 ,130,130,130,143,117,Indivisible Ozarks; March for Truth,Demand investigation into Trump-Russia ties,1,rally,0,0,0,0,1,1,http://www.nwaonline.com/news/2017/jun/04/march-for-truth-seeks-answers-on-russia/?news-arkansas-nwa,http://www.arkansasonline.com/news/2017/jun/04/march-for-truth-draws-crowds-20170604/,,,
Sacramento,Crocker Park,CA,US,2017-06-03,hundreds,,,,,,general protesters,Equality March,1,march,,,,,1,1,http://www.abc10.com/news/local/sacramento/march-for-equality-draws-hundreds-to-downtown-sacramento/445497974,,,,
Sacramento,State Capitol Building steps,CA,US,2017-06-03,,197,197,197,217,177,March for Truth,Demand investigation into Trump-Russia ties,1,march,,,,,1,1,https://www.marchfortruth.info/find-a-local-march/,https://www.facebook.com/events/214259799065084,,,
Salisbury,,CT,US,2017-06-03,,7,7,7,8,6,March for Truth,Demand investigation into Trump-Russia ties,1,march,,,,,1,1,https://www.marchfortruth.info/find-a-local-march/,https://www.facebook.com/events/230769034082287/?active_tab=about,,,
Salt Lake City ,City Creek park,UT,US,2017-06-03,,209,209,209,230,188,March for Truth,Demand investigation into Trump-Russia ties,1,march,,,,,1,1,https://www.marchfortruth.info/find-a-local-march/,https://www.facebook.com/events/1297612590345564/,,,
San Bernadino,Perris Hill Park,CA,US,2017-06-03,,50,50,50,55,45,March for Truth,Demand investigation into Trump-Russia ties,1,march,,,,,1,1,https://www.marchfortruth.info/find-a-local-march/,https://www.facebook.com/events/307796119633640/,,,
San Diego,Mission Bay Park,CA,US,2017-06-03,More than 300 people,300,350,411,330,370,March for Truth,Demand investigation into Trump-Russia ties,1,march,,,,,1,1,http://www.sandiegouniontribune.com/news/politics/sd-me-truth-march-20170603-story.html,https://www.facebook.com/events/846360855512979/,,,
San Francisco,1 Powell Street,CA,US,2017-06-03,,122,122,122,134,110,March for Truth,Demand investigation into Trump-Russia ties,1,flash mob,,,,,1,1,https://www.facebook.com/events/793441364165982/,,,,
San Francisco,Golden Gate Bridge Plaza,CA,US,2017-06-03,100 from photo and video; hundreds predicted,200,200,200,220,180,Momsdemandaction. org,National Gun Violence Awareness,0,rally,0,0,0,0,1,1,https://www.facebook.com/events/1324576680972179,http://sanfrancisco.cbslocal.com/2017/06/03/anti-gun-violence-march-gg-bridge/,http://kron4.com/2017/06/03/video-hundreds-to-march-across-golden-gate-for-gun-violence-awareness-day/,,
San Jose,San Jose City Hall Plaza,CA,US,2017-06-03,,,,,,,Indivisible East San Jose,National March for Truth,1,rally,0,,,,1,1,http://www.indivisibleeastsanjose.org/march-for-truth/,,,,
San Jose,,CA,US,2017-06-03,,,,,,,March for Truth,Demand investigation into Trump-Russia ties,1,march,,,,,1,1,https://www.marchfortruth.info/find-a-local-march/,,,,
Santa Barbara,,CA,US,2017-06-03,,87,87,87,96,78,March for Truth,Demand investigation into Trump-Russia ties,1,march,,,,,1,1,https://www.marchfortruth.info/find-a-local-march/,https://www.facebook.com/events/1882308865358664,,,
Sarasota,,FL,US,2017-06-03,More than 100,53,74,100,58,90,March for Truth,Demand investigation into Trump-Russia ties,1,march,0,0,0,0,1,1,http://www.heraldtribune.com/news/20170603/sarasota-protesters-stage-march-for-truth,https://www.facebook.com/events/650194208509349/,,,
Seattle,"Cal Anderson Park on Capitol Hill, marched to the Seattle Center",WA,US,2017-06-03,Hundreds,200,538,950,220,855,March for Truth,Demand investigation into Trump-Russia ties,1,march,0,0,0,0,1,1,http://komonews.com/news/local/protesters-march-for-truth-in-seattle-call-for-investigation-of-trump,http://www.seattletimes.com/seattle-news/its-so-obvious-hes-lying-march-for-truth-supports-investigation-into-trumps-russia-ties/,https://www.facebook.com/events/1723249677690442/,,
Sherman,,TX,US,2017-06-03,,11,11,11,12,10,March for Truth,Demand investigation into Trump-Russia ties,1,march,,,,,1,1,https://www.marchfortruth.info/find-a-local-march/,https://www.facebook.com/events/279202742549941/,,,
Shreveport,,LA,US,2017-06-03,a dozen,12,12,12,13,11,March for Truth,Demand investigation into Trump-Russia ties,1,march,,,,,1,1,https://www.ktbs.com/lifestyles/protestors-in-shreveport-march-for-truth-look-to-resist-the/article_f063017e-48d7-11e7-8562-7ffa89799453.html,,,,
Siesta Key ,,FL,US,2017-06-03,,67,67,67,74,60,March for Truth,Demand investigation into Trump-Russia ties,1,march,,,,,1,1,https://www.marchfortruth.info/find-a-local-march/,https://www.facebook.com/events/1359538190793457,,,
Sonoma,,CA,US,2017-06-03,,5,5,5,6,5,March for Truth,Demand investigation into Trump-Russia ties,1,flash mob,,,,,1,1,https://www.marchfortruth.info/find-a-local-march/,"https://www.facebook.com/events/432647313794972/?acontext={%22ref%22:%224%22,%22feed_story_type%22:%22308%22,%22action_history%22:%22null%22}",,,
Sonoma County,,CA,US,2017-06-03,,,,,,,general protesters,Equality March,1,march,,,,,1,1,http://www.equalitymarch2017.org/participating-cities/,,,,
Springfield,Missouri State University Strong Hall,MO,US,2017-06-03,,26,28,31,29,28,March for Truth,Demand investigation into Trump-Russia ties,1,protest,0,0,0,0,1,1,https://www.facebook.com/events/416610735384108,,,Count from pic,
St. Joseph,,MI,US,2017-06-03,,,,,,,March for Truth,Demand investigation into Trump-Russia ties,1,march,,,,,1,1,https://www.marchfortruth.info/find-a-local-march/,,,,
St. Joseph,,MO,US,2017-06-03,,13,13,13,14,12,March for Truth,Demand investigation into Trump-Russia ties,1,protest,0,0,0,0,1,1,http://www.stjoechannel.com/story/35583701/march-for-truth-takes-place-in-downtown-st-joseph,,,Count from pic,
St. Louis,,MO,US,2017-06-03,,537,537,537,591,483,March for Truth,Demand investigation into Trump-Russia ties,1,protest,,,,,1,1,http://www.stltoday.com/news/national/crowds-rally-at-march-for-truth-in-st-louis-and/article_f9738b97-f7f4-506e-a326-c54427880cb5.html,https://www.commondreams.org/news/2017/06/03/nationwide-march-truth-events-take-aim-trumps-destructive-fact-free-rule,https://www.facebook.com/events/651243328419098/,,
St. Louis,,MO,US,2017-06-03,several dozen,24,24,24,26,22,Moms Demand Action for Gun Sense in America,Against gun violence,0,rally,0,0,0,0,1,1,http://news.stlpublicradio.org/post/after-violent-week-st-louis-advocates-rally-against-gun-violence-join-national-movement#stream/0,,,,
St. Paul,,MN,US,2017-06-03,,13,13,13,14,12,Stand Up St Paul,Demand investigation into Trump-Russia ties,1,protest,0,0,0,0,1,1,https://twitter.com/Chrismf6/status/871049831569117185,https://www.facebook.com/events/1866031133614485/?ti=cl,,,
St. Petersburg,St. Petersburg Judicial Building,FL,US,2017-06-03,more than 250; more than 260,250,255,260,275,234,March for Truth,Demand investigation into Trump-Russia ties,1,protest,0,0,0,0,1,1,http://www.wmnf.org/protest-signs-saturdays-st-petersburg-march-truth/,http://www.cltampa.com/news-views/local-news/media-gallery/20863586/st-pete-protesters-250-plus-strong-gather-to-demand-independent-investigation-into-trumprussia-ties-photo-gallery,https://www.facebook.com/events/422373661469558/,,
"Sturgeon Bay, Door County",,WI,US,2017-06-03,,8,8,8,9,7,March for Truth,Demand investigation into Trump-Russia ties,1,march,,,,,1,1,https://www.marchfortruth.info/find-a-local-march/,https://www.facebook.com/events/1357683484316930,,,
Syracuse,,NY,US,2017-06-03,,94,94,94,103,85,March for Truth,Demand investigation into Trump-Russia ties,1,march,,,,,1,1,https://www.marchfortruth.info/find-a-local-march/,https://www.facebook.com/events/258992944568507/,,,
Tallahassee,Old Capitol,FL,US,2017-06-03,"about 20 marched; ""turned into about 100"" ",20,56,100,22,90,Moms Demand Action for Gun Sense in America; League of Women Voters,Against gun violence,0,,0,0,0,0,1,1,http://www.tallahassee.com/story/news/2017/06/03/tallahassee-moms-rally-against-gun-violence/368123001/,http://news.wfsu.org/post/tallahassee-rally-against-gun-violence,,,
Tavares,,FL,US,2017-06-03,,,,,,,March for Truth,Demand investigation into Trump-Russia ties,1,march,,,,,1,1,https://www.marchfortruth.info/find-a-local-march/,,,,
The Dalles,,OR,US,2017-06-03,,,,,,,March for Truth,Demand investigation into Trump-Russia ties,1,march,,,,,1,1,https://www.marchfortruth.info/find-a-local-march/,,,,
Victorville,,CA,US,2017-06-03,,,,,,,March for Truth,Demand investigation into Trump-Russia ties,1,march,,,,,1,1,https://www.marchfortruth.info/find-a-local-march/,,,,
Washington,Lafayette Square,DC,US,2017-06-03,Around 50,50,50,50,55,45,"Maryland for Trump, Fairfax County Republican Committee, Republican Party of VA",in support of Trumps withdrawal from Paris Accord; climate change,2,rally,0,0,0,0,1,1,https://www.facebook.com/events/134610310428686/?active_tab=about,http://www.post-gazette.com/news/politics-nation/2017/06/03/Trump-Pittsburgh-not-Paris-rally-Washington-small-Peduto/stories/201706030124?utm_campaign=Echobox&utm_medium=Social&utm_source=Facebook#link_time=1496507554,,,
Washington,Lafayette Square,DC,US,2017-06-03,,,,,,,NJ,against Trump's withdrawal from Paris Accord; climate change,1,counterprotest,0,0,0,0,1,1,http://bit.ly/2qL2dFP,,,,
Washington,Washington Monument,DC,US,2017-06-03,,,,,,,MarchforTruth,Demand investigation into Trump-Russia ties,1,demonstration/march,,,,,1,1,https://www.marchfortruth.info/take-action/,,,,
Washington,White House,DC,US,2017-06-03,hundreds,200,200,200,220,180,general protesters,supporting Trump's decision to withdraw from Paris Accords; ; climate change,2,rally,0,0,0,0,1,1,http://wtop.com/dc/2017/06/supporters-cheer-trump-at-pittsburgh-not-paris-rally-outside-white-house/,,,,
Watsonville ,,CA,US,2017-06-03,,,,,,,March for Truth,Demand investigation into Trump-Russia ties,1,march,,,,,1,1,https://www.marchfortruth.info/find-a-local-march/,,,,
Weaverville,,CA,US,2017-06-03,about 20,20,20,20,22,18,March for Truth,Demand investigation into Trump-Russia ties,1,protest,0,0,0,0,1,1,http://www.trinityjournal.com/news/local/image_0329da9e-4b17-11e7-91b3-eb59ba1af025.html,,,,
Wenatchee,,WA,US,2017-06-03,,22,22,22,24,20,March for Truth,Demand investigation into Trump-Russia ties,1,march,,,,,1,1,https://www.marchfortruth.info/find-a-local-march/,https://www.facebook.com/events/532065337182715/,,,
Wilmington,,NC,US,2017-06-03,,,,,,,March for Truth,Demand investigation into Trump-Russia ties,1,march,,,,,1,1,https://www.marchfortruth.info/find-a-local-march/,,,,
Buffalo,,NY,US,2017-06-04,,,,,,,general protesters,Equality March,1,march,,,,,1,1,http://www.equalitymarch2017.org/participating-cities/,,,,
Colorado Springs,Acacia Park ,CO,US,2017-06-04,about a hundred,100,100,100,110,90,general protesters,Protest Trump withdrawal from Paris accords,1,rally,0,0,0,0,1,1,http://gazette.com/about-100-gather-in-downtown-colorado-springs-to-protest-against-trumps-withdrawal-of-paris-climate-accord/article/1604494,,,,
Conway ,,AR,US,2017-06-04,,,,,,,general protesters,Equality March,1,march,,,,,1,1,http://www.equalitymarch2017.org/participating-cities/,,,,
Moscow,Moscow,ID,US,2017-06-04,,,,,,,Unity on the Palouse; Indivisible Palouse,Demand investigation into Trump-Russia ties,1,demonstration,,,,,1,1,https://www.facebook.com/marchfortruth/,,,,
New York,Manhattans Fifth Avenue,NY,US,2017-06-04,over 100,100,100,100,110,90,Jewish Voice for Peace; IfNotNow,anti-Israeli occupation; oppose NYPD exchange program with Israeli security forces,0,protest,7,0,0,0,1,1,https://972mag.com/jewish-activists-arrested-for-protesting-new-york-pro-israel-parade/127860/,,,,
Northampton,Pulaski Park,MA,US,2017-06-04,about three dozen,36,36,36,40,32,General protesters,protesting AHCA; health care,1,protest,0,0,0,0,1,1,http://www.masslive.com/news/index.ssf/2017/06/northampton_activists_stage_di.html,,,,
Orange Beach,Perdido Pass (in water),AL,US,2017-06-04,two dozen boats,48,48,48,53,43,recreational fishermen,against Federal limits on Red Snapper catch; fishing; economy,0,protest,0,0,0,0,1,1,http://wkrg.com/2017/05/31/red-snapper-protest-planned-at-perdido-pass/,http://local15tv.com/news/local/anglers-meet-to-talk-protest,http://wkrg.com/2017/06/04/perdido-pass-protest-over-3-day-red-snapper-season/,,
Portland,City Hall; Chapman square,OR,US,2017-06-04,"FB group; crowds swelled to thousands ""on both sides""",490,945,1500,539,1350,general protesters,Oppose fascism; counter protest Trump Free Speech rally,1,counter-protest,14,0,0,1,1,1,https://www.wtvq.com/2017/06/04/the-latest-police-detain-large-crowd-near-portland-rally/,https://www.facebook.com/events/1336757926445013/permalink/1338696972917775/,,It is ambiguous as to whether any of those arrested is associated with the pro-Trump camp. However police records generally suggest they are associated with antifa.,
Portland ,Terry D. Schrunk Plaza,OR,US,2017-06-04,hundreds,200,337,504,220,454,Patriot Prayer ,Trump Free Speech; pro-Trump,2,rally ,0,0,0,1,1,1,https://www.wtvq.com/2017/06/04/the-latest-police-detain-large-crowd-near-portland-rally/,http://www.reuters.com/article/us-oregon-protests-idUSKBN18V0J0,https://www.facebook.com/events/1927691894133941/,It is ambiguous as to whether any of those arrested is associated with the pro-Trump camp. However police records generally suggest they are associated with antifa.,
Washington,,DC,US,2017-06-04,,,,,,,IfNotNow,anti-Israeli occupation,0,protest,0,0,0,0,1,1,https://972mag.com/jewish-activists-arrested-for-protesting-new-york-pro-israel-parade/127860/,,,,
Conway,,SC,US,2017-06-05,,10,10,10,11,9,Grand Strand Action Together,Protesting comments on undocumented students by school board chairman,0,protest,0,0,0,0,1,1,http://www.myrtlebeachonline.com/news/local/education/article154587904.html,,,Count from picture,
Albany,State Capitol,NY,US,2017-06-06,,,,,,,NYRenews,Climate Lobby Day; support addressing climate change,1,rally,,,,,1,1,https://www.facebook.com/events/1861502247508170/?acontext=%7B%22action_history%22%3A%22null%22%7D,,,,
Chicago,Thompson Building,IL,US,2017-06-06,about 150 advocates ,,,,,,More than 30 organizations (mostly health-focused) ,"Reject GOP health care bill; protect Medicaid; ""don't cap my care"" ",0,rally,0,0,0,0,1,1,https://www.accessliving.org/1410ga850,http://www.lawndalenews.com/2017/06/dont-cap-our-care/,,,
Chicago,,IL,US,2017-06-06,,,,,,,general protesters; schoolchildren; spontaneous,Against police brutality; against Rahm Emmanuel; against cover-up of death of Laquan McDonald,0,protest,0,0,0,0,1,1,http://thehill.com/blogs/blog-briefing-room/336574-school-children-chant-16-shots-and-a-cover-up-at-rahm-emanuel,,,,
Idaho Falls,outside Rep. Simpon's home,ID,US,2017-06-06,hundreds,200,200,200,220,180,general protesters,supporting Medicaid,1,protest;rally,0,0,0,0,1,1,https://www.eastidahonews.com/2017/06/locals-march-for-medicaid-near-us-politicians-offices/,,,,
Missoula,,MT,US,2017-06-06,about 50,50,50,50,55,45,"""Don't Cap My Care"" ",Reject GOP health care bill,1,rally,0,0,0,0,1,1,http://mtpr.org/post/senator-daines-urged-protect-medicaid,,,,
National City,Outside City Hall,CA,US,2017-06-06,about 100,100,100,100,110,90,general protesters,supporting family whose parents are detained for immigration reasons,0,rally,0,0,0,0,1,1,http://www.sandiegouniontribune.com/news/immigration/sd-me-duarte-protest-20170607-story.html,,,,
Spokane,,WA,US,2017-06-06,dozens; about 30,24,27,30,26,27,The Arc of Spokane,"Reject GOP health care bill; protect Medicaid; ""don't cap my care"" ",1,rally,0,0,0,0,1,1,https://www.inlander.com/Bloglander/archives/2017/06/07/spokane-families-worry-that-medicaid-cuts-could-hinder-care-for-loved-ones-with-disabilities,http://www.kxly.com/news/local-news/dozens-rally-against-proposed-medicaid-cuts-in-spokane-1/530505721,,,
Vista,1800 Thibodo Rd,CA,US,2017-06-06,,,,,,,general protesters,"against President Trump, against U.S. Representative Darryl Issa",1,demonstration,,,,,1,1,https://www.latimes.com/politics/la-pol-ca-issa-protest-20180425-htmlstory.html,,,,
Vista,1800 Thibodo Rd.,CA,US,2017-06-06,,,,,,,general protesters,for President Trump,2,counter-protest,,,,,0,1,https://www.latimes.com/politics/la-pol-ca-issa-protest-20180425-htmlstory.html,,,,
Washington,,DC,US,2017-06-06,about 400,400,400,400,440,360,"""Don't Cap My Care"" ",Reject GOP health care bill; protect Medicaid,1,,0,0,0,0,1,1,http://money.cnn.com/2017/06/07/news/economy/gop-medicaid-rural/index.html,,,,
Winston-Salem,Merschel Plaza,NC,US,2017-06-06,about 20,20,20,20,22,18,general protesters,protesting death of two inmates while imprisoned,0,protest,0,0,0,0,1,1,http://www.mooresvilletribune.com/news/state/about-demonstrators-protest-the-deaths-of-two-jail-inmates/article_9ee8c38c-5f5d-5b0a-af43-49576eb1faa8.html,,,,
Brooklyn,Diocese of Brooklyn ,NY,US,2017-06-07,about 150,150,150,150,165,135,general protesters,Against closure of Middle Village Preparatory Charter School,0,,0,0,0,0,1,1,http://www.qchron.com/editions/central/middle-village-prep-marches-in-brooklyn/article_d6630a6c-b68d-557f-a97a-9b1275e190ac.html,,,,
Brooklyn,outside the office of Catholic Charities Brooklyn and Queens on Joralemon Street,NY,US,2017-06-07,,6,6,6,7,5,Brownsville Cultural Coalition,Against demolition of Our Lady of Loreto church,0,,0,0,0,0,1,1,http://www.brooklyneagle.com/articles/2017/6/7/save-our-lady-loreto-protesters-outside-catholic-church-offices-demand,,,Count from picture,
Dallas ,city hall,TX,US,2017-06-07,,,,,,,general protesters,in opposition of SB 4; pro-sanctuary,1,protest,,,,,1,1,https://www.dallasnews.com/news/news/2017/05/31/dozens-protest-outside-offices-matt-rinaldi-two-days-threatens-shoot-fellow-lawmaker-sb4-fight,,,,
El Paso,Outside Wells Fargo building,TX,US,2017-06-07,several,42,42,42,46,38,Border Network for Human Rights,"demanding firing of Rep. Rinaldi, againts racism, against ICE",0,protest,0,0,0,0,1,1,http://www.elpasoproud.com/news/el-pasoans-join-statewide-protest-demanding-rep-rinaldis-firing/734691165,https://www.facebook.com/events/818356918316715/?acontext=%7B%22source%22%3A5%2C%22page_id_source%22%3A101664589909062%2C%22action_history%22%3A[%7B%22surface%22%3A%22page%22%2C%22mechanism%22%3A%22main_list%22%2C%22extra_data%22%3A%22%7B%5C%22page_id%5C%22%3A101664589909062%2C%5C%22tour_id%5C%22%3Anull%7D%22%7D]%2C%22has_source%22%3Atrue%7D,,,
Macomb County,Outside Macomb County administration building,MI,US,2017-06-07,about two dozen,24,24,24,26,22,union officials,protesting workplace conditions,0,protest,0,0,0,0,1,1,http://www.macombdaily.com/government-and-politics/20170607/union-officials-protest-macomb-county-clerk-workplace-conditions,,,,
Raleigh,Wake County Justice Center,NC,US,2017-06-07,dozens,24,24,24,26,22,general protesters,protesting ICE's removal of a community man; Against arrest and deportation of Mosa Hamadeesa,0,protest; rally,0,0,0,0,1,1,http://abc11.com/news/supporters-rally-for-raleigh-father-detained-by-ice/2070686/,,,,
Bismarck,"south of I-94, between East Capitol Ave. and East Interchange",ND,US,2017-06-08,Facebook: 18 went; about 50,18,32,50,20,45,North Dakota ALF-CIO; community members,against GOP's AHCA; health care,1,rally,0,0,0,0,1,1,http://bismarcktribune.com/news/state-and-regional/north-dakotans-react-to-health-care-bill/article_4fa03706-cc79-53d8-b38b-e9991502cd29.html,https://www.facebook.com/events/1779102572104976/,http://www.ndaflcio.org/news/north-dakota-labor-and-fight-healthcare,,
Norristown,Montgomery County Courthouse,PA,US,2017-06-08,,,,,,,general protesters,Against sexual violence  regarding Bill Cosby trial,0,protest,,,,,1,1,http://counton2.com/2017/06/13/bill-cosby-jury-to-hear-more-of-his-deposition-testimony/,,,,
Columbus,Outside state house,OH,US,2017-06-09,about a dozen,12,12,12,13,11,general protesters,protesting the militia's presence,0,protest,0,0,0,0,1,1,http://nbc4i.com/2017/06/09/militia-members-march-on-ohio-statehouse/,,,,
Columbus,Outside state house,OH,US,2017-06-09,More than 100,100,100,100,110,90,Militia members,march to guarantee safety,0,rally,0,0,0,0,1,1,http://nbc4i.com/2017/06/09/militia-members-march-on-ohio-statehouse/,,,,
Granby,Granby Junior-Senior High School ,MA,US,2017-06-09,about 200,200,200,200,220,180,general protesters; students,support school and faculty; oppose faculty layoffs and budget cuts,0,walk-out,0,0,0,0,1,1,http://www.masslive.com/news/index.ssf/2017/06/granby_students_stage_walk-out.html,,,,
Little Rock ,State House,AR,US,2017-06-09,about 65 (estimated 15 religious leaders and about 50 supporters),65,65,65,72,59,Cooperative Baptist Fellowship of Arkansas,Support of Judge Wendell Griffen's First Amendment rights,0,rally,0,0,0,0,1,1,http://www.arkansasmatters.com/news/local-news/religious-leaders-defend-arkansas-judges-death-penalty-protest/736911216,http://www.arkansasonline.com/news/2017/jun/09/religious-leaders-rally-support-judge-penalized-de/,,,
Navarre Beach,,FL,US,2017-06-09,,12,12,12,13,11,Miscellaneous protesters,bring back the old Navarre Beach sign,0,,0,0,0,0,1,1,http://www.pnj.com/videos/news/2017/06/09/protesters-want-navarre-beach-sign-back/102692218/,,,Count from picture,
New York,Times Square,NY,US,2017-06-09,,20,20,20,22,18,general protesters,In support of body positivity,0,demonstration,,,,,1,1,http://www.refinery29.com/2017/06/158545/nude-body-positivity-protest-times-square-new-york,,,,
Pittsburgh,Allegheny County Courthouse,PA,US,2017-06-09,about a dozen,12,12,12,13,11,ACJ Health Justice Project,demand changes at Allegheny County Jail; demand fire warden and  abolish the jail ,0,protest,0,0,0,0,1,1,http://www.post-gazette.com/local/city/2017/06/10/Protestors-demand-changes-at-county-jail/stories/201706100093,,,,
Tulsa,,OK,US,2017-06-09,dozens,24,24,24,26,22,General protesters,"Protesting against police shooting of black man, Joshua Barre; against police brutality ",0,protest,0,0,0,0,1,1,http://www.chicagotribune.com/news/nationworld/ct-tulsa-police-shooting-20170609-story.html,,,,
Atlanta,across from Piedmont Park,GA,US,2017-06-10,,,,,,,Georgia chapter of the Council on American-Islamic Relations,Anti-March Against Sharia; anti-bigotry; against Islamophobia,1,protest,0,0,0,0,1,1,http://www.11alive.com/news/local/anti-sharia-pro-islam-rallies-held-in-atlanta/447641032,,,,
Atlanta,Piedmont Park,GA,US,2017-06-10,,61,61,61,67,55,Act For America,March Against Sharia,2,protest,0,0,0,0,1,1,http://www.11alive.com/news/local/anti-sharia-pro-islam-rallies-held-in-atlanta/447641032,https://www.facebook.com/events/1978908155670921,,,
Austin,State Capitol,TX,US,2017-06-10,hundreds,77,132,200,85,180,Act For America,March Against Sharia,2,protest,0,0,0,0,1,1,http://www.statesman.com/news/local/rally-against-islamic-sharia-law-draws-hundreds-including-counter-protest-capitol/vg3RWFai7HoOCjRmhRjxyI/,https://www.facebook.com/events/135208640357670,,,
Austin,,TX,US,2017-06-10,,,,,,,general protesters,Anti-March Against Sharia; anti-bigotry; against Islamophobia,1,protest,0,0,0,0,1,1,http://www.statesman.com/news/local/rally-against-islamic-sharia-law-draws-hundreds-including-counter-protest-capitol/vg3RWFai7HoOCjRmhRjxyI/,,,,
Berlin,,CT,US,2017-06-10,,,,,,,general protesters,Equality March,1,march,,,,,1,1,http://www.equalitymarch2017.org/participating-cities/,,,,
Bloomsburg,,PA,US,2017-06-10,,,,,,,general protesters,Equality March,1,march,,,,,1,1,http://www.equalitymarch2017.org/participating-cities/,,,,
Boston,139 Tremont Street,MA,US,2017-06-10,,74,74,74,81,67,Act For America,March Against Sharia,2,march,,,,,1,1,https://www.facebook.com/events/1231821556945245,,,,
Brooklyn,,NY,US,2017-06-10,,,,,,,general protesters,Equality March,1,march,,,,,1,1,http://www.equalitymarch2017.org/participating-cities/,,,,
Charlotte,,NC,US,2017-06-10,,600,600,600,660,540,Love Life Charlotte,Men against abortion,0,,,,,,1,1,http://www.huffingtonpost.com/entry/outside-a-clinic-in-charlotte-600-protestors-claim-abortion-is-a-mans-issue_us_593c1dffe4b0c5a35c9ffe69,http://www.charlotteobserver.com/news/local/article155522559.html,,,
Chicago,downtown,IL,US,2017-06-10,about 200,200,200,200,220,180,general protesters,Anti-March Against Sharia; anti-bigotry; against Islamophobia,1,counterprotest,0,0,0,0,1,1,https://twitter.com/ChicagoReporter/status/873654175007207429/photo/1,,,,
Chicago,Washington Square Park,IL,US,2017-06-10,about 20 ,20,47,80,22,72,Act For America,March Against Sharia,2,protest,0,0,0,0,1,1,https://twitter.com/ChicagoReporter/status/873654175007207429/photo/1,https://www.facebook.com/events/1205295786260111,,,
Dallas ,Abrams Rd & Centennial Blvd,TX,US,2017-06-10,,117,117,117,129,105,Act For America,March Against Sharia,2,march,,,,,1,1,https://www.facebook.com/events/304500689987148,,,,
Denver,Veterans Park,CO,US,2017-06-10,about 150-175,150,161,175,165,158,general protesters,Anti-March Against Sharia; anti-bigotry; against Islamophobia,1,Counterprotest,4,0,0,0,1,1,http://www.denverpost.com/2017/06/10/islamic-law-shariah-protest-denver/,,,,
Denver,West steps of state Capitol,CO,US,2017-06-10,,154,163,175,169,158,Act For America,March Against Sharia,2,protest,0,0,0,0,1,1,http://www.denverpost.com/2017/06/10/islamic-law-shariah-protest-denver/,https://www.facebook.com/events/302611956846664,,,
Des Moines,,IA,US,2017-06-10,about 40,40,40,40,44,36,March for Science Iowa,Protest Trump withdrawal from Paris accords; climate change,1,rally,0,0,0,0,1,1,http://www.desmoinesregister.com/story/news/local/2017/06/10/demonstrators-gather-iowa-capitol-protest-paris-accord-withdrawal/386520001/,,,,
